4568348], length 64
03:13:47.754945 IP 159.203.1.214.22 > 198.211.111.194.51520: Flags [P.], seq 7888:8112, ack 1, win 501, options [nop,nop,TS val 120283824 ecr 2364568348], length 224
03:13:47.754972 IP 159.203.1.214.22 > 198.211.111.194.51520: Flags [P.], seq 8112:8176, ack 1, win 501, options [nop,nop,TS val 120283824 ecr 2364568348], length 64
03:13:47.755009 IP 159.203.1.214.22 > 198.211.111.194.51520: Flags [P.], seq 8176:8384, ack 1, win 501, options [nop,nop,TS val 120283824 ecr 2364568348], length 208
03:13:47.755036 IP 159.203.1.214.22 > 198.211.111.194.51520: Flags [P.], seq 8384:8448, ack 1, win 501, options [nop,nop,TS val 120283824 ecr 2364568348], length 64
03:13:47.755072 IP 159.203.1.214.22 > 198.211.111.194.51520: Flags [P.], seq 8448:8656, ack 1, win 501, options [nop,nop,TS val 120283824 ecr 2364568348], length 208
03:13:47.769017 IP 198.211.111.194.51520 > 159.203.1.214.22: Flags [.], ack 5808, win 1842, options [nop,nop,TS val 2364568438 ecr 120283823], length 0
03:13:47.769075 IP 159.203.1.214.22 > 198.211.111.194.51520: Flags [P.], seq 8656:11184, ack 1, win 501, options [nop,nop,TS val 120283838 ecr 2364568438], length 2528
03:13:47.769271 IP 198.211.111.194.51520 > 159.203.1.214.22: Flags [.], ack 7312, win 1842, options [nop,nop,TS val 2364568438 ecr 120283823], length 0
03:13:47.783647 IP 198.211.111.194.51520 > 159.203.1.214.22: Flags [.], ack 11184, win 1842, options [nop,nop,TS val 2364568452 ecr 120283823], length 0
03:13:47.842735 IP 43.135.134.197.37504 > 159.203.1.214.22: Flags [S], seq 838473178, win 64240, options [mss 1424,sackOK,TS val 338783510 ecr 0,nop,wscale 7], length 0
03:13:47.842807 IP 159.203.1.214.22 > 43.135.134.197.37504: Flags [S.], seq 2589763583, ack 838473179, win 65160, options [mss 1460,sackOK,TS val 3825399874 ecr 338783510,nop,wscale 7], length 0
03:13:47.858048 IP 159.203.1.214.22 > 198.211.111.194.51520: Flags [P.], seq 11184:11408, ack 1, win 501, options [nop,nop,TS val 120283927 ecr 2364568452], length 224
03:13:47.858132 IP 159.203.1.214.22 > 198.211.111.194.51520: Flags [P.], seq 11408:11696, ack 1, win 501, options [nop,nop,TS val 120283927 ecr 2364568452], length 288
03:13:47.858174 IP 159.203.1.214.22 > 198.211.111.194.51520: Flags [P.], seq 11696:11760, ack 1, win 501, options [nop,nop,TS val 120283927 ecr 2364568452], length 64
03:13:47.858235 IP 159.203.1.214.22 > 198.211.111.194.51520: Flags [P.], seq 11760:11984, ack 1, win 501, options [nop,nop,TS val 120283927 ecr 2364568452], length 224
03:13:47.858264 IP 159.203.1.214.22 > 198.211.111.194.51520: Flags [P.], seq 11984:12048, ack 1, win 501, options [nop,nop,TS val 120283927 ecr 2364568452], length 64
03:13:47.858306 IP 159.203.1.214.22 > 198.211.111.194.51520: Flags [P.], seq 12048:12272, ack 1, win 501, options [nop,nop,TS val 120283927 ecr 2364568452], length 224
03:13:47.858336 IP 159.203.1.214.22 > 198.211.111.194.51520: Flags [P.], seq 12272:12336, ack 1, win 501, options [nop,nop,TS val 120283927 ecr 2364568452], length 64
03:13:47.858377 IP 159.203.1.214.22 > 198.211.111.194.51520: Flags [P.], seq 12336:12560, ack 1, win 501, options [nop,nop,TS val 120283927 ecr 2364568452], length 224
03:13:47.858430 IP 159.203.1.214.22 > 198.211.111.194.51520: Flags [P.], seq 12560:12624, ack 1, win 501, options [nop,nop,TS val 120283927 ecr 2364568452], length 64
03:13:47.858449 IP 159.203.1.214.22 > 198.211.111.194.51520: Flags [P.], seq 12624:12848, ack 1, win 501, options [nop,nop,TS val 120283927 ecr 2364568452], length 224
03:13:47.858484 IP 159.203.1.214.22 > 198.211.111.194.51520: Flags [P.], seq 12848:12912, ack 1, win 501, options [nop,nop,TS val 120283927 ecr 2364568452], length 64
03:13:47.858526 IP 159.203.1.214.22 > 198.211.111.194.51520: Flags [P.], seq 12912:13136, ack 1, win 501, options [nop,nop,TS val 120283927 ecr 2364568452], length 224
03:13:47.858556 IP 159.203.1.214.22 > 198.211.111.194.51520: Flags [P.], seq 13136:13200, ack 1, win 501, options [nop,nop,TS val 120283927 ecr 2364568452], length 64
03:13:47.858598 IP 159.203.1.214.22 > 198.211.111.194.51520: Flags [P.], seq 13200:13424, ack 1, win 501, options [nop,nop,TS val 120283927 ecr 2364568452], length 224
03:13:47.858628 IP 159.203.1.214.22 > 198.211.111.194.51520: Flags [P.], seq 13424:13488, ack 1, win 501, options [nop,nop,TS val 120283927 ecr 2364568452], length 64
03:13:47.858668 IP 159.203.1.214.22 > 198.211.111.194.51520: Flags [P.], seq 13488:13712, ack 1, win 501, options [nop,nop,TS val 120283927 ecr 2364568452], length 224
03:13:47.858697 IP 159.203.1.214.22 > 198.211.111.194.51520: Flags [P.], seq 13712:13776, ack 1, win 501, options [nop,nop,TS val 120283927 ecr 2364568452], length 64
03:13:47.858738 IP 159.203.1.214.22 > 198.211.111.194.51520: Flags [P.], seq 13776:14000, ack 1, win 501, options [nop,nop,TS val 120283927 ecr 2364568452], length 224
03:13:47.858767 IP 159.203.1.214.22 > 198.211.111.194.51520: Flags [P.], seq 14000:14064, ack 1, win 501, options [nop,nop,TS val 120283927 ecr 2364568452], length 64
03:13:47.858807 IP 159.203.1.214.22 > 198.211.111.194.51520: Flags [P.], seq 14064:14288, ack 1, win 501, options [nop,nop,TS val 120283927 ecr 2364568452], length 224
03:13:47.858836 IP 159.203.1.214.22 > 198.211.111.194.51520: Flags [P.], seq 14288:14352, ack 1, win 501, options [nop,nop,TS val 120283928 ecr 2364568452], length 64
03:13:47.858894 IP 159.203.1.214.22 > 198.211.111.194.51520: Flags [P.], seq 14352:14576, ack 1, win 501, options [nop,nop,TS val 120283928 ecr 2364568452], length 224
03:13:47.858920 IP 159.203.1.214.22 > 198.211.111.194.51520: Flags [P.], seq 14576:14640, ack 1, win 501, options [nop,nop,TS val 120283928 ecr 2364568452], length 64
03:13:47.858958 IP 159.203.1.214.22 > 198.211.111.194.51520: Flags [P.], seq 14640:14864, ack 1, win 501, options [nop,nop,TS val 120283928 ecr 2364568452], length 224
03:13:47.858985 IP 159.203.1.214.22 > 198.211.111.194.51520: Flags [P.], seq 14864:14928, ack 1, win 501, options [nop,nop,TS val 120283928 ecr 2364568452], length 64
03:13:47.859022 IP 159.203.1.214.22 > 198.211.111.194.51520: Flags [P.], seq 14928:15152, ack 1, win 501, options [nop,nop,TS val 120283928 ecr 2364568452], length 224
03:13:47.859048 IP 159.203.1.214.22 > 198.211.111.194.51520: Flags [P.], seq 15152:15216, ack 1, win 501, options [nop,nop,TS val 120283928 ecr 2364568452], length 64
03:13:47.859087 IP 159.203.1.214.22 > 198.211.111.194.51520: Flags [P.], seq 15216:15440, ack 1, win 501, options [nop,nop,TS val 120283928 ecr 2364568452], length 224
03:13:47.859121 IP 159.203.1.214.22 > 198.211.111.194.51520: Flags [P.], seq 15440:15504, ack 1, win 501, options [nop,nop,TS val 120283928 ecr 2364568452], length 64
03:13:47.859170 IP 159.203.1.214.22 > 198.211.111.194.51520: Flags [P.], seq 15504:15728, ack 1, win 501, options [nop,nop,TS val 120283928 ecr 2364568452], length 224
03:13:47.859205 IP 159.203.1.214.22 > 198.211.111.194.51520: Flags [P.], seq 15728:15792, ack 1, win 501, options [nop,nop,TS val 120283928 ecr 2364568452], length 64
03:13:47.859258 IP 159.203.1.214.22 > 198.211.111.194.51520: Flags [P.], seq 15792:16016, ack 1, win 501, options [nop,nop,TS val 120283928 ecr 2364568452], length 224
03:13:47.859289 IP 159.203.1.214.22 > 198.211.111.194.51520: Flags [P.], seq 16016:16080, ack 1, win 501, options [nop,nop,TS val 120283928 ecr 2364568452], length 64
03:13:47.859328 IP 159.203.1.214.22 > 198.211.111.194.51520: Flags [P.], seq 16080:16304, ack 1, win 501, options [nop,nop,TS val 120283928 ecr 2364568452], length 224
03:13:47.859355 IP 159.203.1.214.22 > 198.211.111.194.51520: Flags [P.], seq 16304:16368, ack 1, win 501, options [nop,nop,TS val 120283928 ecr 2364568452], length 64
03:13:47.859392 IP 159.203.1.214.22 > 198.211.111.194.51520: Flags [P.], seq 16368:16592, ack 1, win 501, options [nop,nop,TS val 120283928 ecr 2364568452], length 224
03:13:47.859418 IP 159.203.1.214.22 > 198.211.111.194.51520: Flags [P.], seq 16592:16656, ack 1, win 501, options [nop,nop,TS val 120283928 ecr 2364568452], length 64
03:13:47.859454 IP 159.203.1.214.22 > 198.211.111.194.51520: Flags [P.], seq 16656:16880, ack 1, win 501, options [nop,nop,TS val 120283928 ecr 2364568452], length 224
03:13:47.859481 IP 159.203.1.214.22 > 198.211.111.194.51520: Flags [P.], seq 16880:16944, ack 1, win 501, options [nop,nop,TS val 120283928 ecr 2364568452], length 64
03:13:47.859518 IP 159.203.1.214.22 > 198.211.111.194.51520: Flags [P.], seq 16944:17168, ack 1, win 501, options [nop,nop,TS val 120283928 ecr 2364568452], length 224
03:13:47.859546 IP 159.203.1.214.22 > 198.211.111.194.51520: Flags [P.], seq 17168:17232, ack 1, win 501, options [nop,nop,TS val 120283928 ecr 2364568452], length 64
03:13:47.859583 IP 159.203.1.214.22 > 198.211.111.194.51520: Flags [P.], seq 17232:17456, ack 1, win 501, options [nop,nop,TS val 120283928 ecr 2364568452], length 224
03:13:47.859609 IP 159.203.1.214.22 > 198.211.111.194.51520: Flags [P.], seq 17456:17520, ack 1, win 501, options [nop,nop,TS val 120283928 ecr 2364568452], length 64
03:13:47.859646 IP 159.203.1.214.22 > 198.211.111.194.51520: Flags [P.], seq 17520:17744, ack 1, win 501, options [nop,nop,TS val 120283928 ecr 2364568452], length 224
03:13:47.859673 IP 159.203.1.214.22 > 198.211.111.194.51520: Flags [P.], seq 17744:17808, ack 1, win 501, options [nop,nop,TS val 120283928 ecr 2364568452], length 64
03:13:47.859710 IP 159.203.1.214.22 > 198.211.111.194.51520: Flags [P.], seq 17808:18032, ack 1, win 501, options [nop,nop,TS val 120283928 ecr 2364568452], length 224
03:13:47.859738 IP 159.203.1.214.22 > 198.211.111.194.51520: Flags [P.], seq 18032:18096, ack 1, win 501, options [nop,nop,TS val 120283928 ecr 2364568452], length 64
03:13:47.859775 IP 159.203.1.214.22 > 198.211.111.194.51520: Flags [P.], seq 18096:18320, ack 1, win 501, options [nop,nop,TS val 120283928 ecr 2364568452], length 224
03:13:47.859808 IP 159.203.1.214.22 > 198.211.111.194.51520: Flags [P.], seq 18320:18384, ack 1, win 501, options [nop,nop,TS val 120283929 ecr 2364568452], length 64
03:13:47.859859 IP 159.203.1.214.22 > 198.211.111.194.51520: Flags [P.], seq 18384:18608, ack 1, win 501, options [nop,nop,TS val 120283929 ecr 2364568452], length 224
03:13:47.859895 IP 159.203.1.214.22 > 198.211.111.194.51520: Flags [P.], seq 18608:18672, ack 1, win 501, options [nop,nop,TS val 120283929 ecr 2364568452], length 64
03:13:47.859948 IP 159.203.1.214.22 > 198.211.111.194.51520: Flags [P.], seq 18672:18896, ack 1, win 501, options [nop,nop,TS val 120283929 ecr 2364568452], length 224
03:13:47.859976 IP 159.203.1.214.22 > 198.211.111.194.51520: Flags [P.], seq 18896:18960, ack 1, win 501, options [nop,nop,TS val 120283929 ecr 2364568452], length 64
03:13:47.860013 IP 159.203.1.214.22 > 198.211.111.194.51520: Flags [P.], seq 18960:19184, ack 1, win 501, options [nop,nop,TS val 120283929 ecr 2364568452], length 224
03:13:47.860041 IP 159.203.1.214.22 > 198.211.111.194.51520: Flags [P.], seq 19184:19248, ack 1, win 501, options [nop,nop,TS val 120283929 ecr 2364568452], length 64
03:13:47.860078 IP 159.203.1.214.22 > 198.211.111.194.51520: Flags [P.], seq 19248:19472, ack 1, win 501, options [nop,nop,TS val 120283929 ecr 2364568452], length 224
03:13:47.860146 IP 159.203.1.214.22 > 198.211.111.194.51520: Flags [P.], seq 19472:19744, ack 1, win 501, options [nop,nop,TS val 120283929 ecr 2364568452], length 272
03:13:47.860191 IP 159.203.1.214.22 > 198.211.111.194.51520: Flags [P.], seq 19744:19808, ack 1, win 501, options [nop,nop,TS val 120283929 ecr 2364568452], length 64
03:13:47.860249 IP 159.203.1.214.22 > 198.211.111.194.51520: Flags [P.], seq 19808:20032, ack 1, win 501, options [nop,nop,TS val 120283929 ecr 2364568452], length 224
03:13:47.860290 IP 159.203.1.214.22 > 198.211.111.194.51520: Flags [P.], seq 20032:20096, ack 1, win 501, options [nop,nop,TS val 120283929 ecr 2364568452], length 64
03:13:47.873053 IP 198.211.111.194.51520 > 159.203.1.214.22: Flags [.], ack 12848, win 1842, options [nop,nop,TS val 2364568542 ecr 120283927], length 0
03:13:47.873112 IP 159.203.1.214.22 > 198.211.111.194.51520: Flags [P.], seq 20096:21248, ack 1, win 501, options [nop,nop,TS val 120283942 ecr 2364568542], length 1152
03:13:47.873347 IP 198.211.111.194.51520 > 159.203.1.214.22: Flags [.], ack 14352, win 1842, options [nop,nop,TS val 2364568542 ecr 120283927], length 0
03:13:47.873829 IP 198.211.111.194.51520 > 159.203.1.214.22: Flags [.], ack 16016, win 1842, options [nop,nop,TS val 2364568543 ecr 120283928], length 0
03:13:47.874095 IP 198.211.111.194.51520 > 159.203.1.214.22: Flags [.], ack 17520, win 1842, options [nop,nop,TS val 2364568543 ecr 120283928], length 0
03:13:47.874485 IP 198.211.111.194.51520 > 159.203.1.214.22: Flags [.], ack 19184, win 1842, options [nop,nop,TS val 2364568543 ecr 120283928], length 0
03:13:47.887714 IP 198.211.111.194.51520 > 159.203.1.214.22: Flags [.], ack 21248, win 1842, options [nop,nop,TS val 2364568556 ecr 120283929], length 0
03:13:47.899742 IP 43.135.134.197.37504 > 159.203.1.214.22: Flags [.], ack 1, win 502, options [nop,nop,TS val 338783567 ecr 3825399874], length 0
03:13:47.899845 IP 43.135.134.197.37504 > 159.203.1.214.22: Flags [P.], seq 1:23, ack 1, win 502, options [nop,nop,TS val 338783567 ecr 3825399874], length 22: SSH: SSH-2.0-libssh_0.9.6
03:13:47.899866 IP 159.203.1.214.22 > 43.135.134.197.37504: Flags [.], ack 23, win 509, options [nop,nop,TS val 3825399932 ecr 338783567], length 0
03:13:47.911133 IP 159.203.1.214.22 > 43.135.134.197.37504: Flags [P.], seq 1:42, ack 23, win 509, options [nop,nop,TS val 3825399943 ecr 338783567], length 41: SSH: SSH-2.0-OpenSSH_8.9p1 Ubuntu-3ubuntu0.6
03:13:47.950759 IP 74.40.19.68.34916 > 159.203.1.214.22: Flags [S], seq 605725331, win 64240, options [mss 1460,sackOK,TS val 3235157403 ecr 0,nop,wscale 7], length 0
03:13:47.950847 IP 159.203.1.214.22 > 74.40.19.68.34916: Flags [S.], seq 144055370, ack 605725332, win 65160, options [mss 1460,sackOK,TS val 3918955359 ecr 3235157403,nop,wscale 7], length 0
03:13:47.963604 IP 159.203.1.214.22 > 198.211.111.194.51520: Flags [P.], seq 21248:25408, ack 1, win 501, options [nop,nop,TS val 120284032 ecr 2364568556], length 4160
03:13:47.963717 IP 159.203.1.214.22 > 198.211.111.194.51520: Flags [P.], seq 25408:29568, ack 1, win 501, options [nop,nop,TS val 120284032 ecr 2364568556], length 4160
03:13:47.963760 IP 159.203.1.214.22 > 198.211.111.194.51520: Flags [P.], seq 29568:33696, ack 1, win 501, options [nop,nop,TS val 120284032 ecr 2364568556], length 4128
03:13:47.967658 IP 43.135.134.197.37504 > 159.203.1.214.22: Flags [.], ack 42, win 502, options [nop,nop,TS val 338783635 ecr 3825399943], length 0
03:13:47.967658 IP 43.135.134.197.37504 > 159.203.1.214.22: Flags [P.], seq 23:999, ack 42, win 502, options [nop,nop,TS val 338783635 ecr 3825399943], length 976
03:13:47.967722 IP 159.203.1.214.22 > 43.135.134.197.37504: Flags [P.], seq 42:1154, ack 23, win 509, options [nop,nop,TS val 3825399999 ecr 338783635], length 1112
03:13:47.978252 IP 198.211.111.194.51520 > 159.203.1.214.22: Flags [.], ack 25408, win 1842, options [nop,nop,TS val 2364568647 ecr 120284032], length 0
03:13:47.978252 IP 198.211.111.194.51520 > 159.203.1.214.22: Flags [.], ack 29568, win 1842, options [nop,nop,TS val 2364568647 ecr 120284032], length 0
03:13:47.978301 IP 198.211.111.194.51520 > 159.203.1.214.22: Flags [.], ack 33696, win 1842, options [nop,nop,TS val 2364568647 ecr 120284032], length 0
03:13:47.978753 IP 74.40.19.68.34916 > 159.203.1.214.22: Flags [.], ack 1, win 502, options [nop,nop,TS val 3235157432 ecr 3918955359], length 0
03:13:47.978977 IP 74.40.19.68.34916 > 159.203.1.214.22: Flags [P.], seq 1:23, ack 1, win 502, options [nop,nop,TS val 3235157432 ecr 3918955359], length 22: SSH: SSH-2.0-libssh_0.9.6
03:13:47.978994 IP 159.203.1.214.22 > 74.40.19.68.34916: Flags [.], ack 23, win 509, options [nop,nop,TS val 3918955387 ecr 3235157432], length 0
03:13:47.989455 IP 159.203.1.214.22 > 74.40.19.68.34916: Flags [P.], seq 1:42, ack 23, win 509, options [nop,nop,TS val 3918955397 ecr 3235157432], length 41: SSH: SSH-2.0-OpenSSH_8.9p1 Ubuntu-3ubuntu0.6
03:13:48.009900 IP 159.203.1.214.22 > 43.135.134.197.37504: Flags [.], ack 999, win 502, options [nop,nop,TS val 3825400042 ecr 338783635], length 0
03:13:48.016886 IP 74.40.19.68.34916 > 159.203.1.214.22: Flags [.], ack 42, win 502, options [nop,nop,TS val 3235157470 ecr 3918955397], length 0
03:13:48.016945 IP 159.203.1.214.22 > 74.40.19.68.34916: Flags [P.], seq 42:1154, ack 23, win 509, options [nop,nop,TS val 3918955425 ecr 3235157470], length 1112
03:13:48.016988 IP 74.40.19.68.34916 > 159.203.1.214.22: Flags [P.], seq 23:999, ack 42, win 502, options [nop,nop,TS val 3235157470 ecr 3918955397], length 976
03:13:48.044413 IP 74.40.19.68.34916 > 159.203.1.214.22: Flags [.], ack 1154, win 501, options [nop,nop,TS val 3235157497 ecr 3918955425], length 0
03:13:48.057871 IP 159.203.1.214.22 > 74.40.19.68.34916: Flags [.], ack 999, win 502, options [nop,nop,TS val 3918955466 ecr 3235157470], length 0
03:13:48.066314 IP 159.203.1.214.22 > 198.211.111.194.51520: Flags [P.], seq 33696:36800, ack 1, win 501, options [nop,nop,TS val 120284135 ecr 2364568647], length 3104
03:13:48.066370 IP 43.135.134.197.37504 > 159.203.1.214.22: Flags [P.], seq 999:1047, ack 1154, win 501, options [nop,nop,TS val 338783733 ecr 3825399999], length 48
03:13:48.066398 IP 159.203.1.214.22 > 43.135.134.197.37504: Flags [.], ack 1047, win 502, options [nop,nop,TS val 3825400098 ecr 338783733], length 0
03:13:48.073105 IP 159.203.1.214.22 > 43.135.134.197.37504: Flags [P.], seq 1154:1686, ack 1047, win 502, options [nop,nop,TS val 3825400105 ecr 338783733], length 532
03:13:48.081007 IP 198.211.111.194.51520 > 159.203.1.214.22: Flags [.], ack 36800, win 1842, options [nop,nop,TS val 2364568750 ecr 120284135], length 0
03:13:48.085235 IP 74.40.19.68.34916 > 159.203.1.214.22: Flags [P.], seq 999:1047, ack 1154, win 501, options [nop,nop,TS val 3235157538 ecr 3918955466], length 48
03:13:48.085284 IP 159.203.1.214.22 > 74.40.19.68.34916: Flags [.], ack 1047, win 502, options [nop,nop,TS val 3918955493 ecr 3235157538], length 0
03:13:48.091546 IP 159.203.1.214.22 > 74.40.19.68.34916: Flags [P.], seq 1154:1686, ack 1047, win 502, options [nop,nop,TS val 3918955499 ecr 3235157538], length 532
03:13:48.118959 IP 74.40.19.68.34916 > 159.203.1.214.22: Flags [.], ack 1686, win 501, options [nop,nop,TS val 3235157572 ecr 3918955499], length 0
03:13:48.119179 IP 74.40.19.68.34916 > 159.203.1.214.22: Flags [P.], seq 1047:1063, ack 1686, win 501, options [nop,nop,TS val 3235157572 ecr 3918955499], length 16
03:13:48.129889 IP 43.135.134.197.37504 > 159.203.1.214.22: Flags [P.], seq 1047:1063, ack 1686, win 501, options [nop,nop,TS val 338783797 ecr 3825400105], length 16
03:13:48.161901 IP 159.203.1.214.22 > 74.40.19.68.34916: Flags [.], ack 1063, win 502, options [nop,nop,TS val 3918955570 ecr 3235157572], length 0
03:13:48.170825 IP 159.203.1.214.22 > 198.211.111.194.51520: Flags [P.], seq 36800:38784, ack 1, win 501, options [nop,nop,TS val 120284239 ecr 2364568750], length 1984
03:13:48.173886 IP 159.203.1.214.22 > 43.135.134.197.37504: Flags [.], ack 1063, win 502, options [nop,nop,TS val 3825400206 ecr 338783797], length 0
03:13:48.185633 IP 198.211.111.194.51520 > 159.203.1.214.22: Flags [.], ack 38784, win 1842, options [nop,nop,TS val 2364568854 ecr 120284239], length 0
03:13:48.189263 IP 74.40.19.68.34916 > 159.203.1.214.22: Flags [P.], seq 1063:1115, ack 1686, win 501, options [nop,nop,TS val 3235157642 ecr 3918955570], length 52
03:13:48.189315 IP 159.203.1.214.22 > 74.40.19.68.34916: Flags [.], ack 1115, win 502, options [nop,nop,TS val 3918955597 ecr 3235157642], length 0
03:13:48.189436 IP 159.203.1.214.22 > 74.40.19.68.34916: Flags [P.], seq 1686:1738, ack 1115, win 502, options [nop,nop,TS val 3918955597 ecr 3235157642], length 52
03:13:48.216852 IP 74.40.19.68.34916 > 159.203.1.214.22: Flags [P.], seq 1115:1199, ack 1738, win 501, options [nop,nop,TS val 3235157670 ecr 3918955597], length 84
03:13:48.230301 IP 43.135.134.197.37504 > 159.203.1.214.22: Flags [P.], seq 1063:1115, ack 1686, win 501, options [nop,nop,TS val 338783897 ecr 3825400206], length 52
03:13:48.230346 IP 159.203.1.214.22 > 43.135.134.197.37504: Flags [.], ack 1115, win 502, options [nop,nop,TS val 3825400262 ecr 338783897], length 0
03:13:48.230445 IP 159.203.1.214.22 > 43.135.134.197.37504: Flags [P.], seq 1686:1738, ack 1115, win 502, options [nop,nop,TS val 3825400262 ecr 338783897], length 52
03:13:48.257863 IP 159.203.1.214.22 > 74.40.19.68.34916: Flags [.], ack 1199, win 502, options [nop,nop,TS val 3918955666 ecr 3235157670], length 0
03:13:48.274279 IP 159.203.1.214.22 > 198.211.111.194.51520: Flags [P.], seq 38784:40592, ack 1, win 501, options [nop,nop,TS val 120284343 ecr 2364568854], length 1808
03:13:48.286915 IP 43.135.134.197.37504 > 159.203.1.214.22: Flags [P.], seq 1115:1199, ack 1738, win 501, options [nop,nop,TS val 338783954 ecr 3825400262], length 84
03:13:48.288887 IP 198.211.111.194.51520 > 159.203.1.214.22: Flags [.], ack 40592, win 1842, options [nop,nop,TS val 2364568958 ecr 120284343], length 0
03:13:48.329911 IP 159.203.1.214.22 > 43.135.134.197.37504: Flags [.], ack 1199, win 502, options [nop,nop,TS val 3825400362 ecr 338783954], length 0
03:13:48.356830 IP 79.110.62.88.55989 > 159.203.1.214.2465: Flags [S], seq 3671785362, win 1024, length 0
03:13:48.378252 IP 159.203.1.214.22 > 198.211.111.194.51520: Flags [P.], seq 40592:41392, ack 1, win 501, options [nop,nop,TS val 120284447 ecr 2364568958], length 800
03:13:48.405508 IP 198.211.111.194.51520 > 159.203.1.214.22: Flags [.], ack 41392, win 1842, options [nop,nop,TS val 2364569074 ecr 120284447], length 0
03:13:48.482125 IP 159.203.1.214.22 > 198.211.111.194.51520: Flags [P.], seq 41392:41776, ack 1, win 501, options [nop,nop,TS val 120284551 ecr 2364569074], length 384
03:13:48.503185 IP 198.211.111.194.51520 > 159.203.1.214.22: Flags [.], ack 41776, win 1842, options [nop,nop,TS val 2364569172 ecr 120284551], length 0
03:13:48.586099 IP 159.203.1.214.22 > 198.211.111.194.51520: Flags [P.], seq 41776:42160, ack 1, win 501, options [nop,nop,TS val 120284655 ecr 2364569172], length 384
03:13:48.607470 IP 198.211.111.194.51520 > 159.203.1.214.22: Flags [.], ack 42160, win 1842, options [nop,nop,TS val 2364569276 ecr 120284655], length 0
03:13:48.690116 IP 159.203.1.214.22 > 198.211.111.194.51520: Flags [P.], seq 42160:42544, ack 1, win 501, options [nop,nop,TS val 120284759 ecr 2364569276], length 384
03:13:48.706881 IP 198.211.111.194.51520 > 159.203.1.214.22: Flags [.], ack 42544, win 1842, options [nop,nop,TS val 2364569376 ecr 120284759], length 0
03:13:48.794091 IP 159.203.1.214.22 > 198.211.111.194.51520: Flags [P.], seq 42544:42928, ack 1, win 501, options [nop,nop,TS val 120284863 ecr 2364569376], length 384
03:13:48.814645 IP 198.211.111.194.51520 > 159.203.1.214.22: Flags [.], ack 42928, win 1842, options [nop,nop,TS val 2364569483 ecr 120284863], length 0
03:13:48.898128 IP 159.203.1.214.22 > 198.211.111.194.51520: Flags [P.], seq 42928:43312, ack 1, win 501, options [nop,nop,TS val 120284967 ecr 2364569483], length 384
03:13:48.919988 IP 198.211.111.194.51520 > 159.203.1.214.22: Flags [.], ack 43312, win 1842, options [nop,nop,TS val 2364569589 ecr 120284967], length 0
03:13:49.002247 IP 159.203.1.214.22 > 198.211.111.194.51520: Flags [P.], seq 43312:43696, ack 1, win 501, options [nop,nop,TS val 120285071 ecr 2364569589], length 384
03:13:49.023928 IP 198.211.111.194.51520 > 159.203.1.214.22: Flags [.], ack 43696, win 1842, options [nop,nop,TS val 2364569693 ecr 120285071], length 0
03:13:49.106063 IP 159.203.1.214.22 > 198.211.111.194.51520: Flags [P.], seq 43696:44080, ack 1, win 501, options [nop,nop,TS val 120285175 ecr 2364569693], length 384
03:13:49.125553 IP 198.211.111.194.51520 > 159.203.1.214.22: Flags [.], ack 44080, win 1842, options [nop,nop,TS val 2364569794 ecr 120285175], length 0
03:13:49.210131 IP 159.203.1.214.22 > 198.211.111.194.51520: Flags [P.], seq 44080:44464, ack 1, win 501, options [nop,nop,TS val 120285279 ecr 2364569794], length 384
03:13:49.231806 IP 198.211.111.194.51520 > 159.203.1.214.22: Flags [.], ack 44464, win 1842, options [nop,nop,TS val 2364569901 ecr 120285279], length 0
03:13:49.314143 IP 159.203.1.214.22 > 198.211.111.194.51520: Flags [P.], seq 44464:44848, ack 1, win 501, options [nop,nop,TS val 120285383 ecr 2364569901], length 384
03:13:49.335515 IP 198.211.111.194.51520 > 159.203.1.214.22: Flags [.], ack 44848, win 1842, options [nop,nop,TS val 2364570004 ecr 120285383], length 0
03:13:49.418296 IP 159.203.1.214.22 > 198.211.111.194.51520: Flags [P.], seq 44848:45232, ack 1, win 501, options [nop,nop,TS val 120285487 ecr 2364570004], length 384
03:13:49.440848 IP 198.211.111.194.51520 > 159.203.1.214.22: Flags [.], ack 45232, win 1842, options [nop,nop,TS val 2364570110 ecr 120285487], length 0
03:13:49.522125 IP 159.203.1.214.22 > 198.211.111.194.51520: Flags [P.], seq 45232:45616, ack 1, win 501, options [nop,nop,TS val 120285591 ecr 2364570110], length 384
03:13:49.539799 IP 198.211.111.194.51520 > 159.203.1.214.22: Flags [.], ack 45616, win 1842, options [nop,nop,TS val 2364570209 ecr 120285591], length 0
03:13:49.626137 IP 159.203.1.214.22 > 198.211.111.194.51520: Flags [P.], seq 45616:46000, ack 1, win 501, options [nop,nop,TS val 120285695 ecr 2364570209], length 384
03:13:49.644839 IP 198.211.111.194.51520 > 159.203.1.214.22: Flags [.], ack 46000, win 1842, options [nop,nop,TS val 2364570314 ecr 120285695], length 0
03:13:49.730128 IP 159.203.1.214.22 > 198.211.111.194.51520: Flags [P.], seq 46000:46384, ack 1, win 501, options [nop,nop,TS val 120285799 ecr 2364570314], length 384
03:13:49.751602 IP 198.211.111.194.51520 > 159.203.1.214.22: Flags [.], ack 46384, win 1842, options [nop,nop,TS val 2364570420 ecr 120285799], length 0
03:13:49.834046 IP 159.203.1.214.22 > 198.211.111.194.51520: Flags [P.], seq 46384:46768, ack 1, win 501, options [nop,nop,TS val 120285903 ecr 2364570420], length 384
03:13:49.854623 IP 198.211.111.194.51520 > 159.203.1.214.22: Flags [.], ack 46768, win 1842, options [nop,nop,TS val 2364570523 ecr 120285903], length 0
03:13:49.938073 IP 159.203.1.214.22 > 198.211.111.194.51520: Flags [P.], seq 46768:47152, ack 1, win 501, options [nop,nop,TS val 120286007 ecr 2364570523], length 384
03:13:49.960060 IP 198.211.111.194.51520 > 159.203.1.214.22: Flags [.], ack 47152, win 1842, options [nop,nop,TS val 2364570629 ecr 120286007], length 0
03:13:50.042146 IP 159.203.1.214.22 > 198.211.111.194.51520: Flags [P.], seq 47152:47536, ack 1, win 501, options [nop,nop,TS val 120286111 ecr 2364570629], length 384
03:13:50.063482 IP 198.211.111.194.51520 > 159.203.1.214.22: Flags [.], ack 47536, win 1842, options [nop,nop,TS val 2364570732 ecr 120286111], length 0
03:13:50.146128 IP 159.203.1.214.22 > 198.211.111.194.51520: Flags [P.], seq 47536:47920, ack 1, win 501, options [nop,nop,TS val 120286215 ecr 2364570732], length 384
03:13:50.166587 IP 198.211.111.194.51520 > 159.203.1.214.22: Flags [.], ack 47920, win 1842, options [nop,nop,TS val 2364570835 ecr 120286215], length 0
03:13:50.250148 IP 159.203.1.214.22 > 198.211.111.194.51520: Flags [P.], seq 47920:48304, ack 1, win 501, options [nop,nop,TS val 120286319 ecr 2364570835], length 384
03:13:50.271628 IP 198.211.111.194.51520 > 159.203.1.214.22: Flags [.], ack 48304, win 1842, options [nop,nop,TS val 2364570940 ecr 120286319], length 0
03:13:50.354109 IP 159.203.1.214.22 > 198.211.111.194.51520: Flags [P.], seq 48304:48688, ack 1, win 501, options [nop,nop,TS val 120286423 ecr 2364570940], length 384
03:13:50.373863 IP 198.211.111.194.51520 > 159.203.1.214.22: Flags [.], ack 48688, win 1842, options [nop,nop,TS val 2364571042 ecr 120286423], length 0
03:13:50.458118 IP 159.203.1.214.22 > 198.211.111.194.51520: Flags [P.], seq 48688:49072, ack 1, win 501, options [nop,nop,TS val 120286527 ecr 2364571042], length 384
03:13:50.479704 IP 198.211.111.194.51520 > 159.203.1.214.22: Flags [.], ack 49072, win 1842, options [nop,nop,TS val 2364571148 ecr 120286527], length 0
03:13:50.562144 IP 159.203.1.214.22 > 198.211.111.194.51520: Flags [P.], seq 49072:49456, ack 1, win 501, options [nop,nop,TS val 120286631 ecr 2364571148], length 384
03:13:50.583552 IP 198.211.111.194.51520 > 159.203.1.214.22: Flags [.], ack 49456, win 1842, options [nop,nop,TS val 2364571252 ecr 120286631], length 0
03:13:50.666098 IP 159.203.1.214.22 > 198.211.111.194.51520: Flags [P.], seq 49456:49840, ack 1, win 501, options [nop,nop,TS val 120286735 ecr 2364571252], length 384
03:13:50.689356 IP 198.211.111.194.51520 > 159.203.1.214.22: Flags [.], ack 49840, win 1842, options [nop,nop,TS val 2364571358 ecr 120286735], length 0
03:13:50.770126 IP 159.203.1.214.22 > 198.211.111.194.51520: Flags [P.], seq 49840:50224, ack 1, win 501, options [nop,nop,TS val 120286839 ecr 2364571358], length 384
03:13:50.786922 IP 198.211.111.194.51520 > 159.203.1.214.22: Flags [.], ack 50224, win 1842, options [nop,nop,TS val 2364571456 ecr 120286839], length 0
03:13:50.874101 IP 159.203.1.214.22 > 198.211.111.194.51520: Flags [P.], seq 50224:50608, ack 1, win 501, options [nop,nop,TS val 120286943 ecr 2364571456], length 384
03:13:50.892270 IP 198.211.111.194.51520 > 159.203.1.214.22: Flags [.], ack 50608, win 1842, options [nop,nop,TS val 2364571561 ecr 120286943], length 0
03:13:50.978099 IP 159.203.1.214.22 > 198.211.111.194.51520: Flags [P.], seq 50608:50992, ack 1, win 501, options [nop,nop,TS val 120287047 ecr 2364571561], length 384
03:13:51.000492 IP 198.211.111.194.51520 > 159.203.1.214.22: Flags [.], ack 50992, win 1842, options [nop,nop,TS val 2364571669 ecr 120287047], length 0
03:13:51.082074 IP 159.203.1.214.22 > 198.211.111.194.51520: Flags [P.], seq 50992:51376, ack 1, win 501, options [nop,nop,TS val 120287151 ecr 2364571669], length 384
03:13:51.100483 IP 198.211.111.194.51520 > 159.203.1.214.22: Flags [.], ack 51376, win 1842, options [nop,nop,TS val 2364571769 ecr 120287151], length 0
03:13:51.186066 IP 159.203.1.214.22 > 198.211.111.194.51520: Flags [P.], seq 51376:51760, ack 1, win 501, options [nop,nop,TS val 120287255 ecr 2364571769], length 384
03:13:51.207006 IP 198.211.111.194.51520 > 159.203.1.214.22: Flags [.], ack 51760, win 1842, options [nop,nop,TS val 2364571876 ecr 120287255], length 0
03:13:51.290134 IP 159.203.1.214.22 > 198.211.111.194.51520: Flags [P.], seq 51760:52144, ack 1, win 501, options [nop,nop,TS val 120287359 ecr 2364571876], length 384
03:13:51.310433 IP 198.211.111.194.51520 > 159.203.1.214.22: Flags [.], ack 52144, win 1842, options [nop,nop,TS val 2364571979 ecr 120287359], length 0
03:13:51.394397 IP 159.203.1.214.22 > 198.211.111.194.51520: Flags [P.], seq 52144:52528, ack 1, win 501, options [nop,nop,TS val 120287463 ecr 2364571979], length 384
03:13:51.413563 IP 159.203.1.214.22 > 43.135.134.197.37504: Flags [P.], seq 1738:1790, ack 1199, win 502, options [nop,nop,TS val 3825403445 ecr 338783954], length 52
03:13:51.416098 IP 198.211.111.194.51520 > 159.203.1.214.22: Flags [.], ack 52528, win 1842, options [nop,nop,TS val 2364572085 ecr 120287463], length 0
03:13:51.470278 IP 43.135.134.197.37504 > 159.203.1.214.22: Flags [P.], seq 1199:1251, ack 1790, win 501, options [nop,nop,TS val 338787137 ecr 3825403445], length 52
03:13:51.470279 IP 43.135.134.197.37504 > 159.203.1.214.22: Flags [F.], seq 1251, ack 1790, win 501, options [nop,nop,TS val 338787137 ecr 3825403445], length 0
03:13:51.470334 IP 159.203.1.214.22 > 43.135.134.197.37504: Flags [.], ack 1251, win 502, options [nop,nop,TS val 3825403502 ecr 338787137], length 0
03:13:51.472010 IP 159.203.1.214.22 > 43.135.134.197.37504: Flags [F.], seq 1790, ack 1252, win 502, options [nop,nop,TS val 3825403504 ecr 338787137], length 0
03:13:51.498234 IP 159.203.1.214.22 > 198.211.111.194.51520: Flags [P.], seq 52528:53712, ack 1, win 501, options [nop,nop,TS val 120287567 ecr 2364572085], length 1184
03:13:51.519436 IP 198.211.111.194.51520 > 159.203.1.214.22: Flags [.], ack 53712, win 1842, options [nop,nop,TS val 2364572188 ecr 120287567], length 0
03:13:51.528424 IP 43.135.134.197.37504 > 159.203.1.214.22: Flags [.], ack 1791, win 501, options [nop,nop,TS val 338787195 ecr 3825403504], length 0
03:13:51.602145 IP 159.203.1.214.22 > 198.211.111.194.51520: Flags [P.], seq 53712:54240, ack 1, win 501, options [nop,nop,TS val 120287671 ecr 2364572188], length 528
03:13:51.622987 IP 198.211.111.194.51520 > 159.203.1.214.22: Flags [.], ack 54240, win 1842, options [nop,nop,TS val 2364572292 ecr 120287671], length 0
03:13:51.706111 IP 159.203.1.214.22 > 198.211.111.194.51520: Flags [P.], seq 54240:54624, ack 1, win 501, options [nop,nop,TS val 120287775 ecr 2364572292], length 384
03:13:51.723642 IP 198.211.111.194.51520 > 159.203.1.214.22: Flags [.], ack 54624, win 1842, options [nop,nop,TS val 2364572392 ecr 120287775], length 0
03:13:51.810142 IP 159.203.1.214.22 > 198.211.111.194.51520: Flags [P.], seq 54624:55008, ack 1, win 501, options [nop,nop,TS val 120287879 ecr 2364572392], length 384
03:13:51.837914 IP 198.211.111.194.51520 > 159.203.1.214.22: Flags [.], ack 55008, win 1842, options [nop,nop,TS val 2364572507 ecr 120287879], length 0
03:13:51.914033 IP 159.203.1.214.22 > 198.211.111.194.51520: Flags [P.], seq 55008:55392, ack 1, win 501, options [nop,nop,TS val 120287983 ecr 2364572507], length 384
03:13:51.933136 IP 198.211.111.194.51520 > 159.203.1.214.22: Flags [.], ack 55392, win 1842, options [nop,nop,TS val 2364572602 ecr 120287983], length 0
03:13:52.018121 IP 159.203.1.214.22 > 198.211.111.194.51520: Flags [P.], seq 55392:55776, ack 1, win 501, options [nop,nop,TS val 120288087 ecr 2364572602], length 384
03:13:52.039324 IP 198.211.111.194.51520 > 159.203.1.214.22: Flags [.], ack 55776, win 1842, options [nop,nop,TS val 2364572708 ecr 120288087], length 0
03:13:52.122135 IP 159.203.1.214.22 > 198.211.111.194.51520: Flags [P.], seq 55776:56160, ack 1, win 501, options [nop,nop,TS val 120288191 ecr 2364572708], length 384
03:13:52.143450 IP 198.211.111.194.51520 > 159.203.1.214.22: Flags [.], ack 56160, win 1842, options [nop,nop,TS val 2364572812 ecr 120288191], length 0
03:13:52.226170 IP 159.203.1.214.22 > 198.211.111.194.51520: Flags [P.], seq 56160:56544, ack 1, win 501, options [nop,nop,TS val 120288295 ecr 2364572812], length 384
03:13:52.232563 IP 159.203.1.214.22 > 74.40.19.68.34916: Flags [P.], seq 1738:1790, ack 1199, win 502, options [nop,nop,TS val 3918959640 ecr 3235157670], length 52
03:13:52.247016 IP 198.211.111.194.51520 > 159.203.1.214.22: Flags [.], ack 56544, win 1842, options [nop,nop,TS val 2364572916 ecr 120288295], length 0
03:13:52.259939 IP 74.40.19.68.34916 > 159.203.1.214.22: Flags [P.], seq 1199:1251, ack 1790, win 501, options [nop,nop,TS val 3235161713 ecr 3918959640], length 52
03:13:52.259939 IP 74.40.19.68.34916 > 159.203.1.214.22: Flags [F.], seq 1251, ack 1790, win 501, options [nop,nop,TS val 3235161713 ecr 3918959640], length 0
03:13:52.260003 IP 159.203.1.214.22 > 74.40.19.68.34916: Flags [.], ack 1251, win 502, options [nop,nop,TS val 3918959668 ecr 3235161713], length 0
03:13:52.261844 IP 159.203.1.214.22 > 74.40.19.68.34916: Flags [F.], seq 1790, ack 1252, win 502, options [nop,nop,TS val 3918959669 ecr 3235161713], length 0
03:13:52.289239 IP 74.40.19.68.34916 > 159.203.1.214.22: Flags [.], ack 1791, win 501, options [nop,nop,TS val 3235161742 ecr 3918959669], length 0
03:13:52.330164 IP 159.203.1.214.22 > 198.211.111.194.51520: Flags [P.], seq 56544:57872, ack 1, win 501, options [nop,nop,TS val 120288399 ecr 2364572916], length 1328
03:13:52.364866 IP 198.211.111.194.51520 > 159.203.1.214.22: Flags [.], ack 57872, win 1842, options [nop,nop,TS val 2364573034 ecr 120288399], length 0
03:13:52.434127 IP 159.203.1.214.22 > 198.211.111.194.51520: Flags [P.], seq 57872:58256, ack 1, win 501, options [nop,nop,TS val 120288503 ecr 2364573034], length 384
03:13:52.453928 IP 198.211.111.194.51520 > 159.203.1.214.22: Flags [.], ack 58256, win 1842, options [nop,nop,TS val 2364573123 ecr 120288503], length 0
03:13:52.538148 IP 159.203.1.214.22 > 198.211.111.194.51520: Flags [P.], seq 58256:58640, ack 1, win 501, options [nop,nop,TS val 120288607 ecr 2364573123], length 384
03:13:52.559806 IP 198.211.111.194.51520 > 159.203.1.214.22: Flags [.], ack 58640, win 1842, options [nop,nop,TS val 2364573229 ecr 120288607], length 0
03:13:52.642143 IP 159.203.1.214.22 > 198.211.111.194.51520: Flags [P.], seq 58640:59024, ack 1, win 501, options [nop,nop,TS val 120288711 ecr 2364573229], length 384
03:13:52.664853 IP 198.211.111.194.51520 > 159.203.1.214.22: Flags [.], ack 59024, win 1842, options [nop,nop,TS val 2364573334 ecr 120288711], length 0
03:13:52.746070 IP 159.203.1.214.22 > 198.211.111.194.51520: Flags [P.], seq 59024:59408, ack 1, win 501, options [nop,nop,TS val 120288815 ecr 2364573334], length 384
03:13:52.768457 IP 198.211.111.194.51520 > 159.203.1.214.22: Flags [.], ack 59408, win 1842, options [nop,nop,TS val 2364573437 ecr 120288815], length 0
03:13:52.850054 IP 159.203.1.214.22 > 198.211.111.194.51520: Flags [P.], seq 59408:59792, ack 1, win 501, options [nop,nop,TS val 120288919 ecr 2364573437], length 384
03:13:52.867299 IP 198.211.111.194.51520 > 159.203.1.214.22: Flags [.], ack 59792, win 1842, options [nop,nop,TS val 2364573536 ecr 120288919], length 0
03:13:52.954098 IP 159.203.1.214.22 > 198.211.111.194.51520: Flags [P.], seq 59792:60176, ack 1, win 501, options [nop,nop,TS val 120289023 ecr 2364573536], length 384
03:13:52.975911 IP 198.211.111.194.51520 > 159.203.1.214.22: Flags [.], ack 60176, win 1842, options [nop,nop,TS val 2364573645 ecr 120289023], length 0
03:13:53.058072 IP 159.203.1.214.22 > 198.211.111.194.51520: Flags [P.], seq 60176:60560, ack 1, win 501, options [nop,nop,TS val 120289127 ecr 2364573645], length 384
03:13:53.075321 IP 198.211.111.194.51520 > 159.203.1.214.22: Flags [.], ack 60560, win 1842, options [nop,nop,TS val 2364573744 ecr 120289127], length 0
03:13:53.162080 IP 159.203.1.214.22 > 198.211.111.194.51520: Flags [P.], seq 60560:60944, ack 1, win 501, options [nop,nop,TS val 120289231 ecr 2364573744], length 384
03:13:53.184581 IP 198.211.111.194.51520 > 159.203.1.214.22: Flags [.], ack 60944, win 1842, options [nop,nop,TS val 2364573853 ecr 120289231], length 0
03:13:53.266063 IP 159.203.1.214.22 > 198.211.111.194.51520: Flags [P.], seq 60944:61328, ack 1, win 501, options [nop,nop,TS val 120289335 ecr 2364573853], length 384
03:13:53.286467 IP 198.211.111.194.51520 > 159.203.1.214.22: Flags [.], ack 61328, win 1842, options [nop,nop,TS val 2364573955 ecr 120289335], length 0
03:13:53.370125 IP 159.203.1.214.22 > 198.211.111.194.51520: Flags [P.], seq 61328:61712, ack 1, win 501, options [nop,nop,TS val 120289439 ecr 2364573955], length 384
03:13:53.386924 IP 198.211.111.194.51520 > 159.203.1.214.22: Flags [.], ack 61712, win 1842, options [nop,nop,TS val 2364574056 ecr 120289439], length 0
03:13:53.474122 IP 159.203.1.214.22 > 198.211.111.194.51520: Flags [P.], seq 61712:62096, ack 1, win 501, options [nop,nop,TS val 120289543 ecr 2364574056], length 384
03:13:53.491530 IP 198.211.111.194.51520 > 159.203.1.214.22: Flags [.], ack 62096, win 1842, options [nop,nop,TS val 2364574160 ecr 120289543], length 0
03:13:53.494484 IP 188.114.96.2.80 > 159.203.1.214.45587: Flags [R], seq 2675204657, win 0, length 0
03:13:53.578214 IP 159.203.1.214.22 > 198.211.111.194.51520: Flags [P.], seq 62096:62576, ack 1, win 501, options [nop,nop,TS val 120289647 ecr 2364574160], length 480
03:13:53.599612 IP 198.211.111.194.51520 > 159.203.1.214.22: Flags [.], ack 62576, win 1842, options [nop,nop,TS val 2364574268 ecr 120289647], length 0
03:13:53.682119 IP 159.203.1.214.22 > 198.211.111.194.51520: Flags [P.], seq 62576:62960, ack 1, win 501, options [nop,nop,TS val 120289751 ecr 2364574268], length 384
03:13:53.698637 IP 198.211.111.194.51520 > 159.203.1.214.22: Flags [.], ack 62960, win 1842, options [nop,nop,TS val 2364574367 ecr 120289751], length 0
03:13:53.786123 IP 159.203.1.214.22 > 198.211.111.194.51520: Flags [P.], seq 62960:63344, ack 1, win 501, options [nop,nop,TS val 120289855 ecr 2364574367], length 384
03:13:53.804099 IP 198.211.111.194.51520 > 159.203.1.214.22: Flags [.], ack 63344, win 1842, options [nop,nop,TS val 2364574473 ecr 120289855], length 0
03:13:53.890092 IP 159.203.1.214.22 > 198.211.111.194.51520: Flags [P.], seq 63344:63728, ack 1, win 501, options [nop,nop,TS val 120289959 ecr 2364574473], length 384
03:13:53.906756 IP 198.211.111.194.51520 > 159.203.1.214.22: Flags [.], ack 63728, win 1842, options [nop,nop,TS val 2364574576 ecr 120289959], length 0
03:13:53.994132 IP 159.203.1.214.22 > 198.211.111.194.51520: Flags [P.], seq 63728:64112, ack 1, win 501, options [nop,nop,TS val 120290063 ecr 2364574576], length 384
03:13:54.011277 IP 198.211.111.194.51520 > 159.203.1.214.22: Flags [.], ack 64112, win 1842, options [nop,nop,TS val 2364574680 ecr 120290063], length 0
03:13:54.098194 IP 159.203.1.214.22 > 198.211.111.194.51520: Flags [P.], seq 64112:64496, ack 1, win 501, options [nop,nop,TS val 120290167 ecr 2364574680], length 384
03:13:54.115144 IP 198.211.111.194.51520 > 159.203.1.214.22: Flags [.], ack 64496, win 1842, options [nop,nop,TS val 2364574784 ecr 120290167], length 0
03:13:54.202116 IP 159.203.1.214.22 > 198.211.111.194.51520: Flags [P.], seq 64496:64880, ack 1, win 501, options [nop,nop,TS val 120290271 ecr 2364574784], length 384
03:13:54.222167 IP 198.211.111.194.51520 > 159.203.1.214.22: Flags [.], ack 64880, win 1842, options [nop,nop,TS val 2364574891 ecr 120290271], length 0
03:13:54.260409 IP 188.114.96.2.80 > 159.203.1.214.45587: Flags [R], seq 2675204657, win 0, length 0
03:13:54.306155 IP 159.203.1.214.22 > 198.211.111.194.51520: Flags [P.], seq 64880:65360, ack 1, win 501, options [nop,nop,TS val 120290375 ecr 2364574891], length 480
03:13:54.329912 IP 198.211.111.194.51520 > 159.203.1.214.22: Flags [.], ack 65360, win 1842, options [nop,nop,TS val 2364574999 ecr 120290375], length 0
03:13:54.410126 IP 159.203.1.214.22 > 198.211.111.194.51520: Flags [P.], seq 65360:65744, ack 1, win 501, options [nop,nop,TS val 120290479 ecr 2364574999], length 384
03:13:54.431759 IP 198.211.111.194.51520 > 159.203.1.214.22: Flags [.], ack 65744, win 1842, options [nop,nop,TS val 2364575100 ecr 120290479], length 0
03:13:54.514118 IP 159.203.1.214.22 > 198.211.111.194.51520: Flags [P.], seq 65744:66128, ack 1, win 501, options [nop,nop,TS val 120290583 ecr 2364575100], length 384
03:13:54.535521 IP 198.211.111.194.51520 > 159.203.1.214.22: Flags [.], ack 66128, win 1842, options [nop,nop,TS val 2364575204 ecr 120290583], length 0
03:13:54.618116 IP 159.203.1.214.22 > 198.211.111.194.51520: Flags [P.], seq 66128:66512, ack 1, win 501, options [nop,nop,TS val 120290687 ecr 2364575204], length 384
03:13:54.635719 IP 198.211.111.194.51520 > 159.203.1.214.22: Flags [.], ack 66512, win 1842, options [nop,nop,TS val 2364575304 ecr 120290687], length 0
03:13:54.722145 IP 159.203.1.214.22 > 198.211.111.194.51520: Flags [P.], seq 66512:66896, ack 1, win 501, options [nop,nop,TS val 120290791 ecr 2364575304], length 384
03:13:54.739682 IP 198.211.111.194.51520 > 159.203.1.214.22: Flags [.], ack 66896, win 1842, options [nop,nop,TS val 2364575408 ecr 120290791], length 0
03:13:54.826122 IP 159.203.1.214.22 > 198.211.111.194.51520: Flags [P.], seq 66896:67280, ack 1, win 501, options [nop,nop,TS val 120290895 ecr 2364575408], length 384
03:13:54.843733 IP 198.211.111.194.51520 > 159.203.1.214.22: Flags [.], ack 67280, win 1842, options [nop,nop,TS val 2364575512 ecr 120290895], length 0
03:13:54.887034 IP 201.163.239.150.32645 > 159.203.1.214.22: Flags [S], seq 3336183503, win 29200, options [mss 1200,sackOK,TS val 3819390581 ecr 0,nop,wscale 7], length 0
03:13:54.887121 IP 159.203.1.214.22 > 201.163.239.150.32645: Flags [S.], seq 621588982, ack 3336183504, win 65160, options [mss 1460,sackOK,TS val 60977754 ecr 3819390581,nop,wscale 7], length 0
03:13:54.930205 IP 159.203.1.214.22 > 198.211.111.194.51520: Flags [P.], seq 67280:68032, ack 1, win 501, options [nop,nop,TS val 120290999 ecr 2364575512], length 752
03:13:54.946364 IP 201.163.239.150.32645 > 159.203.1.214.22: Flags [.], ack 1, win 229, options [nop,nop,TS val 3819390641 ecr 60977754], length 0
03:13:54.946364 IP 201.163.239.150.32645 > 159.203.1.214.22: Flags [P.], seq 1:23, ack 1, win 229, options [nop,nop,TS val 3819390641 ecr 60977754], length 22: SSH: SSH-2.0-libssh_0.9.6
03:13:54.946458 IP 159.203.1.214.22 > 201.163.239.150.32645: Flags [.], ack 23, win 509, options [nop,nop,TS val 60977813 ecr 3819390641], length 0
03:13:54.950555 IP 198.211.111.194.51520 > 159.203.1.214.22: Flags [.], ack 68032, win 1842, options [nop,nop,TS val 2364575619 ecr 120290999], length 0
03:13:54.957272 IP 159.203.1.214.22 > 201.163.239.150.32645: Flags [P.], seq 1:42, ack 23, win 509, options [nop,nop,TS val 60977824 ecr 3819390641], length 41: SSH: SSH-2.0-OpenSSH_8.9p1 Ubuntu-3ubuntu0.6
03:13:55.016046 IP 201.163.239.150.32645 > 159.203.1.214.22: Flags [.], ack 42, win 229, options [nop,nop,TS val 3819390711 ecr 60977824], length 0
03:13:55.016095 IP 159.203.1.214.22 > 201.163.239.150.32645: Flags [P.], seq 42:1154, ack 23, win 509, options [nop,nop,TS val 60977883 ecr 3819390711], length 1112
03:13:55.016276 IP 201.163.239.150.32645 > 159.203.1.214.22: Flags [P.], seq 23:999, ack 42, win 229, options [nop,nop,TS val 3819390711 ecr 60977824], length 976
03:13:55.034151 IP 159.203.1.214.22 > 198.211.111.194.51520: Flags [P.], seq 68032:69584, ack 1, win 501, options [nop,nop,TS val 120291103 ecr 2364575619], length 1552
03:13:55.048867 IP 198.211.111.194.51520 > 159.203.1.214.22: Flags [.], ack 69584, win 1842, options [nop,nop,TS val 2364575718 ecr 120291103], length 0
03:13:55.057873 IP 159.203.1.214.22 > 201.163.239.150.32645: Flags [.], ack 999, win 502, options [nop,nop,TS val 60977925 ecr 3819390711], length 0
03:13:55.115253 IP 201.163.239.150.32645 > 159.203.1.214.22: Flags [.], ack 1154, win 251, options [nop,nop,TS val 3819390810 ecr 60977883], length 0
03:13:55.116566 IP 201.163.239.150.32645 > 159.203.1.214.22: Flags [P.], seq 999:1047, ack 1154, win 251, options [nop,nop,TS val 3819390811 ecr 60977925], length 48
03:13:55.116615 IP 159.203.1.214.22 > 201.163.239.150.32645: Flags [.], ack 1047, win 502, options [nop,nop,TS val 60977983 ecr 3819390811], length 0
03:13:55.126508 IP 159.203.1.214.22 > 201.163.239.150.32645: Flags [P.], seq 1154:1686, ack 1047, win 502, options [nop,nop,TS val 60977993 ecr 3819390811], length 532
03:13:55.138132 IP 159.203.1.214.22 > 198.211.111.194.51520: Flags [P.], seq 69584:70752, ack 1, win 501, options [nop,nop,TS val 120291207 ecr 2364575718], length 1168
03:13:55.162569 IP 198.211.111.194.51520 > 159.203.1.214.22: Flags [.], ack 70752, win 1842, options [nop,nop,TS val 2364575831 ecr 120291207], length 0
03:13:55.185497 IP 201.163.239.150.32645 > 159.203.1.214.22: Flags [.], ack 1686, win 269, options [nop,nop,TS val 3819390880 ecr 60977993], length 0
03:13:55.185553 IP 201.163.239.150.32645 > 159.203.1.214.22: Flags [P.], seq 1047:1063, ack 1686, win 269, options [nop,nop,TS val 3819390880 ecr 60977993], length 16
03:13:55.225872 IP 159.203.1.214.22 > 201.163.239.150.32645: Flags [.], ack 1063, win 502, options [nop,nop,TS val 60978093 ecr 3819390880], length 0
03:13:55.242126 IP 159.203.1.214.22 > 198.211.111.194.51520: Flags [P.], seq 70752:71600, ack 1, win 501, options [nop,nop,TS val 120291311 ecr 2364575831], length 848
03:13:55.266090 IP 198.211.111.194.51520 > 159.203.1.214.22: Flags [.], ack 71600, win 1842, options [nop,nop,TS val 2364575935 ecr 120291311], length 0
03:13:55.284629 IP 201.163.239.150.32645 > 159.203.1.214.22: Flags [P.], seq 1063:1115, ack 1686, win 269, options [nop,nop,TS val 3819390979 ecr 60978093], length 52
03:13:55.284676 IP 159.203.1.214.22 > 201.163.239.150.32645: Flags [.], ack 1115, win 502, options [nop,nop,TS val 60978151 ecr 3819390979], length 0
03:13:55.284809 IP 159.203.1.214.22 > 201.163.239.150.32645: Flags [P.], seq 1686:1738, ack 1115, win 502, options [nop,nop,TS val 60978151 ecr 3819390979], length 52
03:13:55.343710 IP 201.163.239.150.32645 > 159.203.1.214.22: Flags [P.], seq 1115:1199, ack 1738, win 269, options [nop,nop,TS val 3819391038 ecr 60978151], length 84
03:13:55.346041 IP 159.203.1.214.22 > 198.211.111.194.51520: Flags [P.], seq 71600:72640, ack 1, win 501, options [nop,nop,TS val 120291415 ecr 2364575935], length 1040
03:13:55.378592 IP 198.211.111.194.51520 > 159.203.1.214.22: Flags [.], ack 72640, win 1842, options [nop,nop,TS val 2364576047 ecr 120291415], length 0
03:13:55.385867 IP 159.203.1.214.22 > 201.163.239.150.32645: Flags [.], ack 1199, win 502, options [nop,nop,TS val 60978253 ecr 3819391038], length 0
03:13:55.450076 IP 159.203.1.214.22 > 198.211.111.194.51520: Flags [P.], seq 72640:73168, ack 1, win 501, options [nop,nop,TS val 120291519 ecr 2364576047], length 528
03:13:55.473626 IP 198.211.111.194.51520 > 159.203.1.214.22: Flags [.], ack 73168, win 1842, options [nop,nop,TS val 2364576142 ecr 120291519], length 0
03:13:55.554133 IP 159.203.1.214.22 > 198.211.111.194.51520: Flags [P.], seq 73168:73552, ack 1, win 501, options [nop,nop,TS val 120291623 ecr 2364576142], length 384
03:13:55.574124 IP 198.211.111.194.51520 > 159.203.1.214.22: Flags [.], ack 73552, win 1842, options [nop,nop,TS val 2364576243 ecr 120291623], length 0
03:13:55.589494 IP 79.110.62.88.55989 > 159.203.1.214.11475: Flags [S], seq 4245196150, win 1024, length 0
03:13:55.658160 IP 159.203.1.214.22 > 198.211.111.194.51520: Flags [P.], seq 73552:74048, ack 1, win 501, options [nop,nop,TS val 120291727 ecr 2364576243], length 496
03:13:55.680828 IP 198.211.111.194.51520 > 159.203.1.214.22: Flags [.], ack 74048, win 1842, options [nop,nop,TS val 2364576350 ecr 120291727], length 0
03:13:55.762108 IP 159.203.1.214.22 > 198.211.111.194.51520: Flags [P.], seq 74048:74432, ack 1, win 501, options [nop,nop,TS val 120291831 ecr 2364576350], length 384
03:13:55.782586 IP 198.211.111.194.51520 > 159.203.1.214.22: Flags [.], ack 74432, win 1842, options [nop,nop,TS val 2364576451 ecr 120291831], length 0
03:13:55.866130 IP 159.203.1.214.22 > 198.211.111.194.51520: Flags [P.], seq 74432:74816, ack 1, win 501, options [nop,nop,TS val 120291935 ecr 2364576451], length 384
03:13:55.888362 IP 198.211.111.194.51520 > 159.203.1.214.22: Flags [.], ack 74816, win 1842, options [nop,nop,TS val 2364576557 ecr 120291935], length 0
03:13:55.921077 IP 79.110.62.88.55989 > 159.203.1.214.5169: Flags [S], seq 114005646, win 1024, length 0
03:13:55.970168 IP 159.203.1.214.22 > 198.211.111.194.51520: Flags [P.], seq 74816:75296, ack 1, win 501, options [nop,nop,TS val 120292039 ecr 2364576557], length 480
03:13:55.993178 IP 198.211.111.194.51520 > 159.203.1.214.22: Flags [.], ack 75296, win 1842, options [nop,nop,TS val 2364576662 ecr 120292039], length 0
03:13:56.074153 IP 159.203.1.214.22 > 198.211.111.194.51520: Flags [P.], seq 75296:75680, ack 1, win 501, options [nop,nop,TS val 120292143 ecr 2364576662], length 384
03:13:56.095338 IP 198.211.111.194.51520 > 159.203.1.214.22: Flags [.], ack 75680, win 1842, options [nop,nop,TS val 2364576764 ecr 120292143], length 0
03:13:56.178122 IP 159.203.1.214.22 > 198.211.111.194.51520: Flags [P.], seq 75680:76064, ack 1, win 501, options [nop,nop,TS val 120292247 ecr 2364576764], length 384
03:13:56.199226 IP 198.211.111.194.51520 > 159.203.1.214.22: Flags [.], ack 76064, win 1842, options [nop,nop,TS val 2364576868 ecr 120292247], length 0
03:13:56.282114 IP 159.203.1.214.22 > 198.211.111.194.51520: Flags [P.], seq 76064:76448, ack 1, win 501, options [nop,nop,TS val 120292351 ecr 2364576868], length 384
03:13:56.303347 IP 198.211.111.194.51520 > 159.203.1.214.22: Flags [.], ack 76448, win 1842, options [nop,nop,TS val 2364576972 ecr 120292351], length 0
03:13:56.386091 IP 159.203.1.214.22 > 198.211.111.194.51520: Flags [P.], seq 76448:76832, ack 1, win 501, options [nop,nop,TS val 120292455 ecr 2364576972], length 384
03:13:56.408558 IP 198.211.111.194.51520 > 159.203.1.214.22: Flags [.], ack 76832, win 1842, options [nop,nop,TS val 2364577077 ecr 120292455], length 0
03:13:56.490099 IP 159.203.1.214.22 > 198.211.111.194.51520: Flags [P.], seq 76832:77216, ack 1, win 501, options [nop,nop,TS val 120292559 ecr 2364577077], length 384
03:13:56.509822 IP 198.211.111.194.51520 > 159.203.1.214.22: Flags [.], ack 77216, win 1842, options [nop,nop,TS val 2364577178 ecr 120292559], length 0
03:13:56.594089 IP 159.203.1.214.22 > 198.211.111.194.51520: Flags [P.], seq 77216:77600, ack 1, win 501, options [nop,nop,TS val 120292663 ecr 2364577178], length 384
03:13:56.614754 IP 198.211.111.194.51520 > 159.203.1.214.22: Flags [.], ack 77600, win 1842, options [nop,nop,TS val 2364577283 ecr 120292663], length 0
03:13:56.698157 IP 159.203.1.214.22 > 198.211.111.194.51520: Flags [P.], seq 77600:77984, ack 1, win 501, options [nop,nop,TS val 120292767 ecr 2364577283], length 384
03:13:56.721470 IP 198.211.111.194.51520 > 159.203.1.214.22: Flags [.], ack 77984, win 1842, options [nop,nop,TS val 2364577390 ecr 120292767], length 0
03:13:56.802164 IP 159.203.1.214.22 > 198.211.111.194.51520: Flags [P.], seq 77984:78368, ack 1, win 501, options [nop,nop,TS val 120292871 ecr 2364577390], length 384
03:13:56.820535 IP 198.211.111.194.51520 > 159.203.1.214.22: Flags [.], ack 78368, win 1842, options [nop,nop,TS val 2364577489 ecr 120292871], length 0
03:13:56.906061 IP 159.203.1.214.22 > 198.211.111.194.51520: Flags [P.], seq 78368:78752, ack 1, win 501, options [nop,nop,TS val 120292975 ecr 2364577489], length 384
03:13:56.926968 IP 198.211.111.194.51520 > 159.203.1.214.22: Flags [.], ack 78752, win 1842, options [nop,nop,TS val 2364577596 ecr 120292975], length 0
03:13:57.010134 IP 159.203.1.214.22 > 198.211.111.194.51520: Flags [P.], seq 78752:79136, ack 1, win 501, options [nop,nop,TS val 120293079 ecr 2364577596], length 384
03:13:57.031046 IP 198.211.111.194.51520 > 159.203.1.214.22: Flags [.], ack 79136, win 1842, options [nop,nop,TS val 2364577700 ecr 120293079], length 0
03:13:57.114080 IP 159.203.1.214.22 > 198.211.111.194.51520: Flags [P.], seq 79136:79520, ack 1, win 501, options [nop,nop,TS val 120293183 ecr 2364577700], length 384
03:13:57.133574 IP 198.211.111.194.51520 > 159.203.1.214.22: Flags [.], ack 79520, win 1842, options [nop,nop,TS val 2364577802 ecr 120293183], length 0
03:13:57.218139 IP 159.203.1.214.22 > 198.211.111.194.51520: Flags [P.], seq 79520:79904, ack 1, win 501, options [nop,nop,TS val 120293287 ecr 2364577802], length 384
03:13:57.238179 IP 198.211.111.194.51520 > 159.203.1.214.22: Flags [.], ack 79904, win 1842, options [nop,nop,TS val 2364577907 ecr 120293287], length 0
03:13:57.322083 IP 159.203.1.214.22 > 198.211.111.194.51520: Flags [P.], seq 79904:80288, ack 1, win 501, options [nop,nop,TS val 120293391 ecr 2364577907], length 384
03:13:57.343255 IP 198.211.111.194.51520 > 159.203.1.214.22: Flags [.], ack 80288, win 1842, options [nop,nop,TS val 2364578012 ecr 120293391], length 0
03:13:57.351762 IP 159.203.1.214.22 > 201.163.239.150.32645: Flags [P.], seq 1738:1790, ack 1199, win 502, options [nop,nop,TS val 60980218 ecr 3819391038], length 52
03:13:57.410695 IP 201.163.239.150.32645 > 159.203.1.214.22: Flags [P.], seq 1199:1251, ack 1790, win 269, options [nop,nop,TS val 3819393105 ecr 60980218], length 52
03:13:57.410695 IP 201.163.239.150.32645 > 159.203.1.214.22: Flags [F.], seq 1251, ack 1790, win 269, options [nop,nop,TS val 3819393105 ecr 60980218], length 0
03:13:57.410759 IP 159.203.1.214.22 > 201.163.239.150.32645: Flags [.], ack 1251, win 502, options [nop,nop,TS val 60980277 ecr 3819393105], length 0
03:13:57.412420 IP 159.203.1.214.22 > 201.163.239.150.32645: Flags [F.], seq 1790, ack 1252, win 502, options [nop,nop,TS val 60980279 ecr 3819393105], length 0
03:13:57.426168 IP 159.203.1.214.22 > 198.211.111.194.51520: Flags [P.], seq 80288:81472, ack 1, win 501, options [nop,nop,TS val 120293495 ecr 2364578012], length 1184
03:13:57.462645 IP 198.211.111.194.51520 > 159.203.1.214.22: Flags [.], ack 81472, win 1842, options [nop,nop,TS val 2364578131 ecr 120293495], length 0
03:13:57.471311 IP 201.163.239.150.32645 > 159.203.1.214.22: Flags [.], ack 1791, win 269, options [nop,nop,TS val 3819393166 ecr 60980279], length 0
03:13:57.530089 IP 159.203.1.214.22 > 198.211.111.194.51520: Flags [P.], seq 81472:82000, ack 1, win 501, options [nop,nop,TS val 120293599 ecr 2364578131], length 528
03:13:57.554501 IP 198.211.111.194.51520 > 159.203.1.214.22: Flags [.], ack 82000, win 1842, options [nop,nop,TS val 2364578223 ecr 120293599], length 0
03:13:57.634163 IP 159.203.1.214.22 > 198.211.111.194.51520: Flags [P.], seq 82000:82384, ack 1, win 501, options [nop,nop,TS val 120293703 ecr 2364578223], length 384
03:13:57.654046 IP 198.211.111.194.51520 > 159.203.1.214.22: Flags [.], ack 82384, win 1842, options [nop,nop,TS val 2364578323 ecr 120293703], length 0
03:13:57.738096 IP 159.203.1.214.22 > 198.211.111.194.51520: Flags [P.], seq 82384:82768, ack 1, win 501, options [nop,nop,TS val 120293807 ecr 2364578323], length 384
03:13:57.759935 IP 198.211.111.194.51520 > 159.203.1.214.22: Flags [.], ack 82768, win 1842, options [nop,nop,TS val 2364578429 ecr 120293807], length 0
03:13:57.842105 IP 159.203.1.214.22 > 198.211.111.194.51520: Flags [P.], seq 82768:83152, ack 1, win 501, options [nop,nop,TS val 120293911 ecr 2364578429], length 384
03:13:57.863892 IP 198.211.111.194.51520 > 159.203.1.214.22: Flags [.], ack 83152, win 1842, options [nop,nop,TS val 2364578533 ecr 120293911], length 0
03:13:57.946135 IP 159.203.1.214.22 > 198.211.111.194.51520: Flags [P.], seq 83152:83536, ack 1, win 501, options [nop,nop,TS val 120294015 ecr 2364578533], length 384
03:13:57.967674 IP 198.211.111.194.51520 > 159.203.1.214.22: Flags [.], ack 83536, win 1842, options [nop,nop,TS val 2364578636 ecr 120294015], length 0
03:13:58.050109 IP 159.203.1.214.22 > 198.211.111.194.51520: Flags [P.], seq 83536:83920, ack 1, win 501, options [nop,nop,TS val 120294119 ecr 2364578636], length 384
03:13:58.071801 IP 198.211.111.194.51520 > 159.203.1.214.22: Flags [.], ack 83920, win 1842, options [nop,nop,TS val 2364578741 ecr 120294119], length 0
03:13:58.154115 IP 159.203.1.214.22 > 198.211.111.194.51520: Flags [P.], seq 83920:84304, ack 1, win 501, options [nop,nop,TS val 120294223 ecr 2364578741], length 384
03:13:58.175964 IP 198.211.111.194.51520 > 159.203.1.214.22: Flags [.], ack 84304, win 1842, options [nop,nop,TS val 2364578845 ecr 120294223], length 0
03:13:58.258221 IP 159.203.1.214.22 > 198.211.111.194.51520: Flags [P.], seq 84304:84688, ack 1, win 501, options [nop,nop,TS val 120294327 ecr 2364578845], length 384
03:13:58.277244 IP 198.211.111.194.51520 > 159.203.1.214.22: Flags [.], ack 84688, win 1842, options [nop,nop,TS val 2364578946 ecr 120294327], length 0
03:13:58.362060 IP 159.203.1.214.22 > 198.211.111.194.51520: Flags [P.], seq 84688:85072, ack 1, win 501, options [nop,nop,TS val 120294431 ecr 2364578946], length 384
03:13:58.381778 IP 198.211.111.194.51520 > 159.203.1.214.22: Flags [.], ack 85072, win 1842, options [nop,nop,TS val 2364579050 ecr 120294431], length 0
03:13:58.466146 IP 159.203.1.214.22 > 198.211.111.194.51520: Flags [P.], seq 85072:85456, ack 1, win 501, options [nop,nop,TS val 120294535 ecr 2364579050], length 384
03:13:58.489096 IP 198.211.111.194.51520 > 159.203.1.214.22: Flags [.], ack 85456, win 1842, options [nop,nop,TS val 2364579158 ecr 120294535], length 0
03:13:58.570172 IP 159.203.1.214.22 > 198.211.111.194.51520: Flags [P.], seq 85456:85840, ack 1, win 501, options [nop,nop,TS val 120294639 ecr 2364579158], length 384
03:13:58.591748 IP 198.211.111.194.51520 > 159.203.1.214.22: Flags [.], ack 85840, win 1842, options [nop,nop,TS val 2364579260 ecr 120294639], length 0
03:13:58.674154 IP 159.203.1.214.22 > 198.211.111.194.51520: Flags [P.], seq 85840:86224, ack 1, win 501, options [nop,nop,TS val 120294743 ecr 2364579260], length 384
03:13:58.696550 IP 198.211.111.194.51520 > 159.203.1.214.22: Flags [.], ack 86224, win 1842, options [nop,nop,TS val 2364579365 ecr 120294743], length 0
03:13:58.778089 IP 159.203.1.214.22 > 198.211.111.194.51520: Flags [P.], seq 86224:86608, ack 1, win 501, options [nop,nop,TS val 120294847 ecr 2364579365], length 384
03:13:58.799957 IP 198.211.111.194.51520 > 159.203.1.214.22: Flags [.], ack 86608, win 1842, options [nop,nop,TS val 2364579469 ecr 120294847], length 0
03:13:58.882114 IP 159.203.1.214.22 > 198.211.111.194.51520: Flags [P.], seq 86608:86992, ack 1, win 501, options [nop,nop,TS val 120294951 ecr 2364579469], length 384
03:13:58.904432 IP 198.211.111.194.51520 > 159.203.1.214.22: Flags [.], ack 86992, win 1842, options [nop,nop,TS val 2364579573 ecr 120294951], length 0
03:13:58.986117 IP 159.203.1.214.22 > 198.211.111.194.51520: Flags [P.], seq 86992:87376, ack 1, win 501, options [nop,nop,TS val 120295055 ecr 2364579573], length 384
03:13:59.004862 IP 198.211.111.194.51520 > 159.203.1.214.22: Flags [.], ack 87376, win 1842, options [nop,nop,TS val 2364579674 ecr 120295055], length 0
03:13:59.090073 IP 159.203.1.214.22 > 198.211.111.194.51520: Flags [P.], seq 87376:87760, ack 1, win 501, options [nop,nop,TS val 120295159 ecr 2364579674], length 384
03:13:59.111623 IP 198.211.111.194.51520 > 159.203.1.214.22: Flags [.], ack 87760, win 1842, options [nop,nop,TS val 2364579780 ecr 120295159], length 0
03:13:59.194075 IP 159.203.1.214.22 > 198.211.111.194.51520: Flags [P.], seq 87760:88144, ack 1, win 501, options [nop,nop,TS val 120295263 ecr 2364579780], length 384
03:13:59.215874 IP 198.211.111.194.51520 > 159.203.1.214.22: Flags [.], ack 88144, win 1842, options [nop,nop,TS val 2364579885 ecr 120295263], length 0
03:13:59.298071 IP 159.203.1.214.22 > 198.211.111.194.51520: Flags [P.], seq 88144:88528, ack 1, win 501, options [nop,nop,TS val 120295367 ecr 2364579885], length 384
03:13:59.315942 IP 198.211.111.194.51520 > 159.203.1.214.22: Flags [.], ack 88528, win 1842, options [nop,nop,TS val 2364579985 ecr 120295367], length 0
03:13:59.402130 IP 159.203.1.214.22 > 198.211.111.194.51520: Flags [P.], seq 88528:88912, ack 1, win 501, options [nop,nop,TS val 120295471 ecr 2364579985], length 384
03:13:59.421324 IP 198.211.111.194.51520 > 159.203.1.214.22: Flags [.], ack 88912, win 1842, options [nop,nop,TS val 2364580090 ecr 120295471], length 0
03:13:59.506165 IP 159.203.1.214.22 > 198.211.111.194.51520: Flags [P.], seq 88912:89296, ack 1, win 501, options [nop,nop,TS val 120295575 ecr 2364580090], length 384
03:13:59.526210 IP 198.211.111.194.51520 > 159.203.1.214.22: Flags [.], ack 89296, win 1842, options [nop,nop,TS val 2364580195 ecr 120295575], length 0
03:13:59.610053 IP 159.203.1.214.22 > 198.211.111.194.51520: Flags [P.], seq 89296:89680, ack 1, win 501, options [nop,nop,TS val 120295679 ecr 2364580195], length 384
03:13:59.631009 IP 198.211.111.194.51520 > 159.203.1.214.22: Flags [.], ack 89680, win 1842, options [nop,nop,TS val 2364580300 ecr 120295679], length 0
03:13:59.714108 IP 159.203.1.214.22 > 198.211.111.194.51520: Flags [P.], seq 89680:90064, ack 1, win 501, options [nop,nop,TS val 120295783 ecr 2364580300], length 384
03:13:59.736165 IP 198.211.111.194.51520 > 159.203.1.214.22: Flags [.], ack 90064, win 1842, options [nop,nop,TS val 2364580405 ecr 120295783], length 0
03:13:59.818086 IP 159.203.1.214.22 > 198.211.111.194.51520: Flags [P.], seq 90064:90448, ack 1, win 501, options [nop,nop,TS val 120295887 ecr 2364580405], length 384
03:13:59.839134 IP 198.211.111.194.51520 > 159.203.1.214.22: Flags [.], ack 90448, win 1842, options [nop,nop,TS val 2364580508 ecr 120295887], length 0
03:13:59.922121 IP 159.203.1.214.22 > 198.211.111.194.51520: Flags [P.], seq 90448:90832, ack 1, win 501, options [nop,nop,TS val 120295991 ecr 2364580508], length 384
03:13:59.942694 IP 198.211.111.194.51520 > 159.203.1.214.22: Flags [.], ack 90832, win 1842, options [nop,nop,TS val 2364580611 ecr 120295991], length 0
03:14:00.026067 IP 159.203.1.214.22 > 198.211.111.194.51520: Flags [P.], seq 90832:91216, ack 1, win 501, options [nop,nop,TS val 120296095 ecr 2364580611], length 384
03:14:00.047314 IP 198.211.111.194.51520 > 159.203.1.214.22: Flags [.], ack 91216, win 1842, options [nop,nop,TS val 2364580716 ecr 120296095], length 0
03:14:00.130189 IP 159.203.1.214.22 > 198.211.111.194.51520: Flags [P.], seq 91216:91600, ack 1, win 501, options [nop,nop,TS val 120296199 ecr 2364580716], length 384
03:14:00.152819 IP 198.211.111.194.51520 > 159.203.1.214.22: Flags [.], ack 91600, win 1842, options [nop,nop,TS val 2364580822 ecr 120296199], length 0
03:14:00.234113 IP 159.203.1.214.22 > 198.211.111.194.51520: Flags [P.], seq 91600:91984, ack 1, win 501, options [nop,nop,TS val 120296303 ecr 2364580822], length 384
03:14:00.254218 IP 198.211.111.194.51520 > 159.203.1.214.22: Flags [.], ack 91984, win 1842, options [nop,nop,TS val 2364580923 ecr 120296303], length 0
03:14:00.338117 IP 159.203.1.214.22 > 198.211.111.194.51520: Flags [P.], seq 91984:92368, ack 1, win 501, options [nop,nop,TS val 120296407 ecr 2364580923], length 384
03:14:00.359289 IP 198.211.111.194.51520 > 159.203.1.214.22: Flags [.], ack 92368, win 1842, options [nop,nop,TS val 2364581028 ecr 120296407], length 0
03:14:00.442149 IP 159.203.1.214.22 > 198.211.111.194.51520: Flags [P.], seq 92368:92752, ack 1, win 501, options [nop,nop,TS val 120296511 ecr 2364581028], length 384
03:14:00.463155 IP 198.211.111.194.51520 > 159.203.1.214.22: Flags [.], ack 92752, win 1842, options [nop,nop,TS val 2364581132 ecr 120296511], length 0
03:14:00.546114 IP 159.203.1.214.22 > 198.211.111.194.51520: Flags [P.], seq 92752:93136, ack 1, win 501, options [nop,nop,TS val 120296615 ecr 2364581132], length 384
03:14:00.567671 IP 198.211.111.194.51520 > 159.203.1.214.22: Flags [.], ack 93136, win 1842, options [nop,nop,TS val 2364581236 ecr 120296615], length 0
03:14:00.650178 IP 159.203.1.214.22 > 198.211.111.194.51520: Flags [P.], seq 93136:93520, ack 1, win 501, options [nop,nop,TS val 120296719 ecr 2364581236], length 384
03:14:00.668114 IP 198.211.111.194.51520 > 159.203.1.214.22: Flags [.], ack 93520, win 1842, options [nop,nop,TS val 2364581337 ecr 120296719], length 0
03:14:00.754174 IP 159.203.1.214.22 > 198.211.111.194.51520: Flags [P.], seq 93520:93904, ack 1, win 501, options [nop,nop,TS val 120296823 ecr 2364581337], length 384
03:14:00.775967 IP 198.211.111.194.51520 > 159.203.1.214.22: Flags [.], ack 93904, win 1842, options [nop,nop,TS val 2364581445 ecr 120296823], length 0
03:14:00.858138 IP 159.203.1.214.22 > 198.211.111.194.51520: Flags [P.], seq 93904:94288, ack 1, win 501, options [nop,nop,TS val 120296927 ecr 2364581445], length 384
03:14:00.878079 IP 198.211.111.194.51520 > 159.203.1.214.22: Flags [.], ack 94288, win 1842, options [nop,nop,TS val 2364581547 ecr 120296927], length 0
03:14:00.962170 IP 159.203.1.214.22 > 198.211.111.194.51520: Flags [P.], seq 94288:94672, ack 1, win 501, options [nop,nop,TS val 120297031 ecr 2364581547], length 384
03:14:00.984832 IP 198.211.111.194.51520 > 159.203.1.214.22: Flags [.], ack 94672, win 1842, options [nop,nop,TS val 2364581654 ecr 120297031], length 0
03:14:01.066144 IP 159.203.1.214.22 > 198.211.111.194.51520: Flags [P.], seq 94672:95056, ack 1, win 501, options [nop,nop,TS val 120297135 ecr 2364581654], length 384
03:14:01.088295 IP 198.211.111.194.51520 > 159.203.1.214.22: Flags [.], ack 95056, win 1842, options [nop,nop,TS val 2364581757 ecr 120297135], length 0
03:14:01.170181 IP 159.203.1.214.22 > 198.211.111.194.51520: Flags [P.], seq 95056:95440, ack 1, win 501, options [nop,nop,TS val 120297239 ecr 2364581757], length 384
03:14:01.194881 IP 198.211.111.194.51520 > 159.203.1.214.22: Flags [.], ack 95440, win 1842, options [nop,nop,TS val 2364581864 ecr 120297239], length 0
03:14:01.274252 IP 159.203.1.214.22 > 198.211.111.194.51520: Flags [P.], seq 95440:95824, ack 1, win 501, options [nop,nop,TS val 120297343 ecr 2364581864], length 384
03:14:01.294289 IP 198.211.111.194.51520 > 159.203.1.214.22: Flags [.], ack 95824, win 1842, options [nop,nop,TS val 2364581963 ecr 120297343], length 0
03:14:01.378164 IP 159.203.1.214.22 > 198.211.111.194.51520: Flags [P.], seq 95824:96208, ack 1, win 501, options [nop,nop,TS val 120297447 ecr 2364581963], length 384
03:14:01.399816 IP 198.211.111.194.51520 > 159.203.1.214.22: Flags [.], ack 96208, win 1842, options [nop,nop,TS val 2364582069 ecr 120297447], length 0
03:14:01.482267 IP 159.203.1.214.22 > 198.211.111.194.51520: Flags [P.], seq 96208:96592, ack 1, win 501, options [nop,nop,TS val 120297551 ecr 2364582069], length 384
03:14:01.501467 IP 198.211.111.194.51520 > 159.203.1.214.22: Flags [.], ack 96592, win 1842, options [nop,nop,TS val 2364582170 ecr 120297551], length 0
03:14:01.586159 IP 159.203.1.214.22 > 198.211.111.194.51520: Flags [P.], seq 96592:96976, ack 1, win 501, options [nop,nop,TS val 120297655 ecr 2364582170], length 384
03:14:01.608681 IP 198.211.111.194.51520 > 159.203.1.214.22: Flags [.], ack 96976, win 1842, options [nop,nop,TS val 2364582277 ecr 120297655], length 0
03:14:01.690230 IP 159.203.1.214.22 > 198.211.111.194.51520: Flags [P.], seq 96976:97360, ack 1, win 501, options [nop,nop,TS val 120297759 ecr 2364582277], length 384
03:14:01.708175 IP 198.211.111.194.51520 > 159.203.1.214.22: Flags [.], ack 97360, win 1842, options [nop,nop,TS val 2364582377 ecr 120297759], length 0
03:14:01.794182 IP 159.203.1.214.22 > 198.211.111.194.51520: Flags [P.], seq 97360:97744, ack 1, win 501, options [nop,nop,TS val 120297863 ecr 2364582377], length 384
03:14:01.812509 IP 198.211.111.194.51520 > 159.203.1.214.22: Flags [.], ack 97744, win 1842, options [nop,nop,TS val 2364582481 ecr 120297863], length 0
03:14:01.899793 IP 159.203.1.214.22 > 198.211.111.194.51520: Flags [P.], seq 97744:98128, ack 1, win 501, options [nop,nop,TS val 120297968 ecr 2364582481], length 384
03:14:01.925787 IP 198.211.111.194.51520 > 159.203.1.214.22: Flags [.], ack 98128, win 1842, options [nop,nop,TS val 2364582590 ecr 120297968], length 0
03:14:02.004016 IP 159.203.1.214.22 > 198.211.111.194.51520: Flags [P.], seq 98128:98512, ack 1, win 501, options [nop,nop,TS val 120298073 ecr 2364582590], length 384
03:14:02.025789 IP 198.211.111.194.51520 > 159.203.1.214.22: Flags [.], ack 98512, win 1842, options [nop,nop,TS val 2364582693 ecr 120298073], length 0
03:14:02.106191 IP 159.203.1.214.22 > 198.211.111.194.51520: Flags [P.], seq 98512:98896, ack 1, win 501, options [nop,nop,TS val 120298175 ecr 2364582693], length 384
03:14:02.127230 IP 198.211.111.194.51520 > 159.203.1.214.22: Flags [.], ack 98896, win 1842, options [nop,nop,TS val 2364582796 ecr 120298175], length 0
03:14:02.217447 IP 159.203.1.214.22 > 198.211.111.194.51520: Flags [P.], seq 98896:99280, ack 1, win 501, options [nop,nop,TS val 120298286 ecr 2364582796], length 384
03:14:02.238356 IP 198.211.111.194.51520 > 159.203.1.214.22: Flags [.], ack 99280, win 1842, options [nop,nop,TS val 2364582907 ecr 120298286], length 0
03:14:02.318276 IP 159.203.1.214.22 > 198.211.111.194.51520: Flags [P.], seq 99280:99664, ack 1, win 501, options [nop,nop,TS val 120298387 ecr 2364582907], length 384
03:14:02.339777 IP 198.211.111.194.51520 > 159.203.1.214.22: Flags [.], ack 99664, win 1842, options [nop,nop,TS val 2364583009 ecr 120298387], length 0
03:14:02.422144 IP 159.203.1.214.22 > 198.211.111.194.51520: Flags [P.], seq 99664:100048, ack 1, win 501, options [nop,nop,TS val 120298491 ecr 2364583009], length 384
03:14:02.443343 IP 198.211.111.194.51520 > 159.203.1.214.22: Flags [.], ack 100048, win 1842, options [nop,nop,TS val 2364583112 ecr 120298491], length 0
03:14:02.526240 IP 159.203.1.214.22 > 198.211.111.194.51520: Flags [P.], seq 100048:100432, ack 1, win 501, options [nop,nop,TS val 120298595 ecr 2364583112], length 384
03:14:02.546311 IP 198.211.111.194.51520 > 159.203.1.214.22: Flags [.], ack 100432, win 1842, options [nop,nop,TS val 2364583215 ecr 120298595], length 0
03:14:02.630321 IP 159.203.1.214.22 > 198.211.111.194.51520: Flags [P.], seq 100432:100816, ack 1, win 501, options [nop,nop,TS val 120298699 ecr 2364583215], length 384
03:14:02.652872 IP 198.211.111.194.51520 > 159.203.1.214.22: Flags [.], ack 100816, win 1842, options [nop,nop,TS val 2364583322 ecr 120298699], length 0
03:14:02.734302 IP 159.203.1.214.22 > 198.211.111.194.51520: Flags [P.], seq 100816:101200, ack 1, win 501, options [nop,nop,TS val 120298803 ecr 2364583322], length 384
03:14:02.752840 IP 198.211.111.194.51520 > 159.203.1.214.22: Flags [.], ack 101200, win 1842, options [nop,nop,TS val 2364583421 ecr 120298803], length 0
03:14:02.838211 IP 159.203.1.214.22 > 198.211.111.194.51520: Flags [P.], seq 101200:101584, ack 1, win 501, options [nop,nop,TS val 120298907 ecr 2364583421], length 384
03:14:02.859236 IP 198.211.111.194.51520 > 159.203.1.214.22: Flags [.], ack 101584, win 1842, options [nop,nop,TS val 2364583528 ecr 120298907], length 0
03:14:02.942187 IP 159.203.1.214.22 > 198.211.111.194.51520: Flags [P.], seq 101584:101968, ack 1, win 501, options [nop,nop,TS val 120299011 ecr 2364583528], length 384
03:14:02.964233 IP 198.211.111.194.51520 > 159.203.1.214.22: Flags [.], ack 101968, win 1842, options [nop,nop,TS val 2364583633 ecr 120299011], length 0
03:14:03.046189 IP 159.203.1.214.22 > 198.211.111.194.51520: Flags [P.], seq 101968:102352, ack 1, win 501, options [nop,nop,TS val 120299115 ecr 2364583633], length 384
03:14:03.068091 IP 198.211.111.194.51520 > 159.203.1.214.22: Flags [.], ack 102352, win 1842, options [nop,nop,TS val 2364583737 ecr 120299115], length 0
03:14:03.150212 IP 159.203.1.214.22 > 198.211.111.194.51520: Flags [P.], seq 102352:102736, ack 1, win 501, options [nop,nop,TS val 120299219 ecr 2364583737], length 384
03:14:03.169613 IP 198.211.111.194.51520 > 159.203.1.214.22: Flags [.], ack 102736, win 1842, options [nop,nop,TS val 2364583838 ecr 120299219], length 0
03:14:03.254423 IP 159.203.1.214.22 > 198.211.111.194.51520: Flags [P.], seq 102736:103120, ack 1, win 501, options [nop,nop,TS val 120299323 ecr 2364583838], length 384
03:14:03.274768 IP 198.211.111.194.51520 > 159.203.1.214.22: Flags [.], ack 103120, win 1842, options [nop,nop,TS val 2364583944 ecr 120299323], length 0
03:14:03.358173 IP 159.203.1.214.22 > 198.211.111.194.51520: Flags [P.], seq 103120:103504, ack 1, win 501, options [nop,nop,TS val 120299427 ecr 2364583944], length 384
03:14:03.381582 IP 198.211.111.194.51520 > 159.203.1.214.22: Flags [.], ack 103504, win 1842, options [nop,nop,TS val 2364584050 ecr 120299427], length 0
03:14:03.462091 IP 159.203.1.214.22 > 198.211.111.194.51520: Flags [P.], seq 103504:103888, ack 1, win 501, options [nop,nop,TS val 120299531 ecr 2364584050], length 384
03:14:03.482061 IP 198.211.111.194.51520 > 159.203.1.214.22: Flags [.], ack 103888, win 1842, options [nop,nop,TS val 2364584151 ecr 120299531], length 0
03:14:03.566160 IP 159.203.1.214.22 > 198.211.111.194.51520: Flags [P.], seq 103888:104272, ack 1, win 501, options [nop,nop,TS val 120299635 ecr 2364584151], length 384
03:14:03.586934 IP 198.211.111.194.51520 > 159.203.1.214.22: Flags [.], ack 104272, win 1842, options [nop,nop,TS val 2364584256 ecr 120299635], length 0
03:14:03.670164 IP 159.203.1.214.22 > 198.211.111.194.51520: Flags [P.], seq 104272:104656, ack 1, win 501, options [nop,nop,TS val 120299739 ecr 2364584256], length 384
03:14:03.692205 IP 198.211.111.194.51520 > 159.203.1.214.22: Flags [.], ack 104656, win 1842, options [nop,nop,TS val 2364584361 ecr 120299739], length 0
03:14:03.774244 IP 159.203.1.214.22 > 198.211.111.194.51520: Flags [P.], seq 104656:105040, ack 1, win 501, options [nop,nop,TS val 120299843 ecr 2364584361], length 384
03:14:03.795489 IP 198.211.111.194.51520 > 159.203.1.214.22: Flags [.], ack 105040, win 1842, options [nop,nop,TS val 2364584464 ecr 120299843], length 0
03:14:03.878174 IP 159.203.1.214.22 > 198.211.111.194.51520: Flags [P.], seq 105040:105424, ack 1, win 501, options [nop,nop,TS val 120299947 ecr 2364584464], length 384
03:14:03.900854 IP 198.211.111.194.51520 > 159.203.1.214.22: Flags [.], ack 105424, win 1842, options [nop,nop,TS val 2364584569 ecr 120299947], length 0
03:14:03.982164 IP 159.203.1.214.22 > 198.211.111.194.51520: Flags [P.], seq 105424:105808, ack 1, win 501, options [nop,nop,TS val 120300051 ecr 2364584569], length 384
03:14:03.998664 IP 198.211.111.194.51520 > 159.203.1.214.22: Flags [.], ack 105808, win 1842, options [nop,nop,TS val 2364584667 ecr 120300051], length 0
03:14:04.086247 IP 159.203.1.214.22 > 198.211.111.194.51520: Flags [P.], seq 105808:106192, ack 1, win 501, options [nop,nop,TS val 120300155 ecr 2364584667], length 384
03:14:04.108622 IP 198.211.111.194.51520 > 159.203.1.214.22: Flags [.], ack 106192, win 1842, options [nop,nop,TS val 2364584777 ecr 120300155], length 0
03:14:04.190156 IP 159.203.1.214.22 > 198.211.111.194.51520: Flags [P.], seq 106192:106576, ack 1, win 501, options [nop,nop,TS val 120300259 ecr 2364584777], length 384
03:14:04.209615 IP 198.211.111.194.51520 > 159.203.1.214.22: Flags [.], ack 106576, win 1842, options [nop,nop,TS val 2364584878 ecr 120300259], length 0
03:14:04.294155 IP 159.203.1.214.22 > 198.211.111.194.51520: Flags [P.], seq 106576:106960, ack 1, win 501, options [nop,nop,TS val 120300363 ecr 2364584878], length 384
03:14:04.313650 IP 198.211.111.194.51520 > 159.203.1.214.22: Flags [.], ack 106960, win 1842, options [nop,nop,TS val 2364584982 ecr 120300363], length 0
03:14:04.398216 IP 159.203.1.214.22 > 198.211.111.194.51520: Flags [P.], seq 106960:107344, ack 1, win 501, options [nop,nop,TS val 120300467 ecr 2364584982], length 384
03:14:04.420766 IP 198.211.111.194.51520 > 159.203.1.214.22: Flags [.], ack 107344, win 1842, options [nop,nop,TS val 2364585089 ecr 120300467], length 0
03:14:04.502174 IP 159.203.1.214.22 > 198.211.111.194.51520: Flags [P.], seq 107344:107728, ack 1, win 501, options [nop,nop,TS val 120300571 ecr 2364585089], length 384
03:14:04.524292 IP 198.211.111.194.51520 > 159.203.1.214.22: Flags [.], ack 107728, win 1842, options [nop,nop,TS val 2364585193 ecr 120300571], length 0
03:14:04.606100 IP 159.203.1.214.22 > 198.211.111.194.51520: Flags [P.], seq 107728:108112, ack 1, win 501, options [nop,nop,TS val 120300675 ecr 2364585193], length 384
03:14:04.627371 IP 198.211.111.194.51520 > 159.203.1.214.22: Flags [.], ack 108112, win 1842, options [nop,nop,TS val 2364585296 ecr 120300675], length 0
03:14:04.710077 IP 159.203.1.214.22 > 198.211.111.194.51520: Flags [P.], seq 108112:108496, ack 1, win 501, options [nop,nop,TS val 120300779 ecr 2364585296], length 384
03:14:04.732500 IP 198.211.111.194.51520 > 159.203.1.214.22: Flags [.], ack 108496, win 1842, options [nop,nop,TS val 2364585401 ecr 120300779], length 0
03:14:04.814184 IP 159.203.1.214.22 > 198.211.111.194.51520: Flags [P.], seq 108496:108880, ack 1, win 501, options [nop,nop,TS val 120300883 ecr 2364585401], length 384
03:14:04.836160 IP 198.211.111.194.51520 > 159.203.1.214.22: Flags [.], ack 108880, win 1842, options [nop,nop,TS val 2364585505 ecr 120300883], length 0
03:14:04.918147 IP 159.203.1.214.22 > 198.211.111.194.51520: Flags [P.], seq 108880:109264, ack 1, win 501, options [nop,nop,TS val 120300987 ecr 2364585505], length 384
03:14:04.938842 IP 198.211.111.194.51520 > 159.203.1.214.22: Flags [.], ack 109264, win 1842, options [nop,nop,TS val 2364585607 ecr 120300987], length 0
03:14:05.022090 IP 159.203.1.214.22 > 198.211.111.194.51520: Flags [P.], seq 109264:109648, ack 1, win 501, options [nop,nop,TS val 120301091 ecr 2364585607], length 384
03:14:05.043095 IP 198.211.111.194.51520 > 159.203.1.214.22: Flags [.], ack 109648, win 1842, options [nop,nop,TS val 2364585712 ecr 120301091], length 0
03:14:05.126146 IP 159.203.1.214.22 > 198.211.111.194.51520: Flags [P.], seq 109648:110032, ack 1, win 501, options [nop,nop,TS val 120301195 ecr 2364585712], length 384
03:14:05.147123 IP 198.211.111.194.51520 > 159.203.1.214.22: Flags [.], ack 110032, win 1842, options [nop,nop,TS val 2364585816 ecr 120301195], length 0
03:14:05.230243 IP 159.203.1.214.22 > 198.211.111.194.51520: Flags [P.], seq 110032:110416, ack 1, win 501, options [nop,nop,TS val 120301299 ecr 2364585816], length 384
03:14:05.249391 IP 198.211.111.194.51520 > 159.203.1.214.22: Flags [.], ack 110416, win 1842, options [nop,nop,TS val 2364585918 ecr 120301299], length 0
03:14:05.334123 IP 159.203.1.214.22 > 198.211.111.194.51520: Flags [P.], seq 110416:110800, ack 1, win 501, options [nop,nop,TS val 120301403 ecr 2364585918], length 384
03:14:05.353086 IP 198.211.111.194.51520 > 159.203.1.214.22: Flags [.], ack 110800, win 1842, options [nop,nop,TS val 2364586022 ecr 120301403], length 0
03:14:05.438090 IP 159.203.1.214.22 > 198.211.111.194.51520: Flags [P.], seq 110800:111184, ack 1, win 501, options [nop,nop,TS val 120301507 ecr 2364586022], length 384
03:14:05.458465 IP 198.211.111.194.51520 > 159.203.1.214.22: Flags [.], ack 111184, win 1842, options [nop,nop,TS val 2364586127 ecr 120301507], length 0
03:14:05.542175 IP 159.203.1.214.22 > 198.211.111.194.51520: Flags [P.], seq 111184:111568, ack 1, win 501, options [nop,nop,TS val 120301611 ecr 2364586127], length 384
03:14:05.560566 IP 198.211.111.194.51520 > 159.203.1.214.22: Flags [.], ack 111568, win 1842, options [nop,nop,TS val 2364586229 ecr 120301611], length 0
03:14:05.646106 IP 159.203.1.214.22 > 198.211.111.194.51520: Flags [P.], seq 111568:111952, ack 1, win 501, options [nop,nop,TS val 120301715 ecr 2364586229], length 384
03:14:05.668947 IP 198.211.111.194.51520 > 159.203.1.214.22: Flags [.], ack 111952, win 1842, options [nop,nop,TS val 2364586338 ecr 120301715], length 0
03:14:05.750124 IP 159.203.1.214.22 > 198.211.111.194.51520: Flags [P.], seq 111952:112336, ack 1, win 501, options [nop,nop,TS val 120301819 ecr 2364586338], length 384
03:14:05.773351 IP 198.211.111.194.51520 > 159.203.1.214.22: Flags [.], ack 112336, win 1842, options [nop,nop,TS val 2364586442 ecr 120301819], length 0
03:14:05.854123 IP 159.203.1.214.22 > 198.211.111.194.51520: Flags [P.], seq 112336:112720, ack 1, win 501, options [nop,nop,TS val 120301923 ecr 2364586442], length 384
03:14:05.876428 IP 198.211.111.194.51520 > 159.203.1.214.22: Flags [.], ack 112720, win 1842, options [nop,nop,TS val 2364586545 ecr 120301923], length 0
03:14:05.958166 IP 159.203.1.214.22 > 198.211.111.194.51520: Flags [P.], seq 112720:113104, ack 1, win 501, options [nop,nop,TS val 120302027 ecr 2364586545], length 384
03:14:05.978570 IP 198.211.111.194.51520 > 159.203.1.214.22: Flags [.], ack 113104, win 1842, options [nop,nop,TS val 2364586647 ecr 120302027], length 0
03:14:06.062135 IP 159.203.1.214.22 > 198.211.111.194.51520: Flags [P.], seq 113104:113488, ack 1, win 501, options [nop,nop,TS val 120302131 ecr 2364586647], length 384
03:14:06.079204 IP 198.211.111.194.51520 > 159.203.1.214.22: Flags [.], ack 113488, win 1842, options [nop,nop,TS val 2364586748 ecr 120302131], length 0
^C
579 packets captured
585 packets received by filter