03:15:44.284461 IP karldrop.ssh > 198.211.111.194.51520: Flags [P.], seq 198608:198800, ack 1, win 501, options [nop,nop,TS val 120400353 ecr 2364684902], length 192
03:15:44.285982 IP karldrop.ssh > 185.161.248.247.19498: Flags [.], ack 1721, win 501, length 0
03:15:44.301657 IP 198.211.111.194.51520 > karldrop.ssh: Flags [.], ack 198800, win 5813, options [nop,nop,TS val 2364684970 ecr 120400351], length 0
03:15:44.326434 IP 67.207.67.2.domain > karldrop.55274: Flags [.], ack 96, win 128, options [nop,nop,TS val 1041477763 ecr 2264414659], length 0
03:15:44.386295 IP karldrop.ssh > 198.211.111.194.51520: Flags [P.], seq 198800:199792, ack 1, win 501, options [nop,nop,TS val 120400455 ecr 2364684970], length 992
03:15:44.406407 IP 67.207.67.2.domain > karldrop.55274: Flags [P.], seq 109:193, ack 96, win 128, options [nop,nop,TS val 1041477843 ecr 2264414659], length 84 29534 1/0/0 PTR security.criminalip.com. (82)
03:15:44.406455 IP karldrop.55274 > 67.207.67.2.domain: Flags [.], ack 193, win 502, options [nop,nop,TS val 2264414783 ecr 1041477843], length 0
03:15:44.445629 IP 198.211.111.194.51520 > karldrop.ssh: Flags [.], ack 199792, win 5813, options [nop,nop,TS val 2364685114 ecr 120400455], length 0
03:15:44.490233 IP karldrop.ssh > 198.211.111.194.51520: Flags [P.], seq 199792:200528, ack 1, win 501, options [nop,nop,TS val 120400559 ecr 2364685114], length 736
03:15:44.512571 IP 198.211.111.194.51520 > karldrop.ssh: Flags [.], ack 200528, win 5813, options [nop,nop,TS val 2364685181 ecr 120400559], length 0
03:15:44.594237 IP karldrop.ssh > 198.211.111.194.51520: Flags [P.], seq 200528:200896, ack 1, win 501, options [nop,nop,TS val 120400663 ecr 2364685181], length 368
03:15:44.612739 IP 198.211.111.194.51520 > karldrop.ssh: Flags [.], ack 200896, win 5813, options [nop,nop,TS val 2364685281 ecr 120400663], length 0
03:15:44.698267 IP karldrop.ssh > 198.211.111.194.51520: Flags [P.], seq 200896:201264, ack 1, win 501, options [nop,nop,TS val 120400767 ecr 2364685281], length 368
03:15:44.719946 IP 198.211.111.194.51520 > karldrop.ssh: Flags [.], ack 201264, win 5813, options [nop,nop,TS val 2364685389 ecr 120400767], length 0
03:15:44.802255 IP karldrop.ssh > 198.211.111.194.51520: Flags [P.], seq 201264:201632, ack 1, win 501, options [nop,nop,TS val 120400871 ecr 2364685389], length 368
03:15:44.822455 IP 198.211.111.194.51520 > karldrop.ssh: Flags [.], ack 201632, win 5813, options [nop,nop,TS val 2364685491 ecr 120400871], length 0
03:15:44.906232 IP karldrop.ssh > 198.211.111.194.51520: Flags [P.], seq 201632:202000, ack 1, win 501, options [nop,nop,TS val 120400975 ecr 2364685491], length 368
03:15:44.926648 IP 198.211.111.194.51520 > karldrop.ssh: Flags [.], ack 202000, win 5813, options [nop,nop,TS val 2364685595 ecr 120400975], length 0
03:15:45.010307 IP karldrop.ssh > 198.211.111.194.51520: Flags [P.], seq 202000:202368, ack 1, win 501, options [nop,nop,TS val 120401079 ecr 2364685595], length 368
03:15:45.031955 IP 198.211.111.194.51520 > karldrop.ssh: Flags [.], ack 202368, win 5813, options [nop,nop,TS val 2364685701 ecr 120401079], length 0
03:15:45.114156 IP karldrop.ssh > 198.211.111.194.51520: Flags [P.], seq 202368:202736, ack 1, win 501, options [nop,nop,TS val 120401183 ecr 2364685701], length 368
03:15:45.131118 IP 198.211.111.194.51520 > karldrop.ssh: Flags [.], ack 202736, win 5813, options [nop,nop,TS val 2364685800 ecr 120401183], length 0
03:15:45.218303 IP karldrop.ssh > 198.211.111.194.51520: Flags [P.], seq 202736:203104, ack 1, win 501, options [nop,nop,TS val 120401287 ecr 2364685800], length 368
03:15:45.235618 IP 198.211.111.194.51520 > karldrop.ssh: Flags [.], ack 203104, win 5813, options [nop,nop,TS val 2364685904 ecr 120401287], length 0
03:15:45.322165 IP karldrop.ssh > 198.211.111.194.51520: Flags [P.], seq 203104:203472, ack 1, win 501, options [nop,nop,TS val 120401391 ecr 2364685904], length 368
03:15:45.339233 IP 198.211.111.194.51520 > karldrop.ssh: Flags [.], ack 203472, win 5813, options [nop,nop,TS val 2364686008 ecr 120401391], length 0
03:15:45.426274 IP karldrop.ssh > 198.211.111.194.51520: Flags [P.], seq 203472:203840, ack 1, win 501, options [nop,nop,TS val 120401495 ecr 2364686008], length 368
03:15:45.443573 IP 198.211.111.194.51520 > karldrop.ssh: Flags [.], ack 203840, win 5813, options [nop,nop,TS val 2364686112 ecr 120401495], length 0
03:15:45.530187 IP karldrop.ssh > 198.211.111.194.51520: Flags [P.], seq 203840:204208, ack 1, win 501, options [nop,nop,TS val 120401599 ecr 2364686112], length 368
03:15:45.552259 IP 198.211.111.194.51520 > karldrop.ssh: Flags [.], ack 204208, win 5813, options [nop,nop,TS val 2364686221 ecr 120401599], length 0
03:15:45.634352 IP karldrop.ssh > 198.211.111.194.51520: Flags [P.], seq 204208:204576, ack 1, win 501, options [nop,nop,TS val 120401703 ecr 2364686221], length 368
03:15:45.655654 IP 198.211.111.194.51520 > karldrop.ssh: Flags [.], ack 204576, win 5813, options [nop,nop,TS val 2364686324 ecr 120401703], length 0
03:15:45.728997 IP 119.28.111.112.56616 > karldrop.ssh: Flags [S], seq 1572750065, win 29200, options [mss 1424,sackOK,TS val 510343890 ecr 0,nop,wscale 7], length 0
03:15:45.729072 IP karldrop.ssh > 119.28.111.112.56616: Flags [S.], seq 4088132638, ack 1572750066, win 65160, options [mss 1460,sackOK,TS val 2948223040 ecr 510343890,nop,wscale 7], length 0
03:15:45.738324 IP karldrop.ssh > 198.211.111.194.51520: Flags [P.], seq 204576:204944, ack 1, win 501, options [nop,nop,TS val 120401807 ecr 2364686324], length 368
03:15:45.738706 IP karldrop.55274 > 67.207.67.2.domain: Flags [P.], seq 96:143, ack 193, win 502, options [nop,nop,TS val 2264416115 ecr 1041477843], length 47 55182+ PTR? 112.111.28.119.in-addr.arpa. (45)
03:15:45.739973 IP 67.207.67.2.domain > karldrop.55274: Flags [.], ack 143, win 128, options [nop,nop,TS val 1041479177 ecr 2264416115], length 0
03:15:45.758706 IP 198.211.111.194.51520 > karldrop.ssh: Flags [.], ack 204944, win 5813, options [nop,nop,TS val 2364686427 ecr 120401807], length 0
03:15:45.798527 IP 67.207.67.2.domain > karldrop.55274: Flags [P.], seq 193:240, ack 143, win 128, options [nop,nop,TS val 1041479236 ecr 2264416115], length 47 55182 NXDomain 0/0/0 (45)
03:15:45.798569 IP karldrop.55274 > 67.207.67.2.domain: Flags [.], ack 240, win 502, options [nop,nop,TS val 2264416175 ecr 1041479236], length 0
03:15:45.863091 IP karldrop.ssh > 198.211.111.194.51520: Flags [P.], seq 204944:206368, ack 1, win 501, options [nop,nop,TS val 120401932 ecr 2364686427], length 1424
03:15:45.921636 IP 198.211.111.194.51520 > karldrop.ssh: Flags [.], ack 206368, win 5813, options [nop,nop,TS val 2364686590 ecr 120401932], length 0
03:15:45.946261 IP karldrop.ssh > 198.211.111.194.51520: Flags [P.], seq 206368:206752, ack 1, win 501, options [nop,nop,TS val 120402015 ecr 2364686590], length 384
03:15:45.965176 IP 198.211.111.194.51520 > karldrop.ssh: Flags [.], ack 206752, win 5813, options [nop,nop,TS val 2364686634 ecr 120402015], length 0
03:15:45.967525 IP 119.28.111.112.56616 > karldrop.ssh: Flags [.], ack 1, win 229, options [nop,nop,TS val 510344129 ecr 2948223040], length 0
03:15:45.969052 IP 119.28.111.112.56616 > karldrop.ssh: Flags [P.], seq 1:23, ack 1, win 229, options [nop,nop,TS val 510344131 ecr 2948223040], length 22: SSH: SSH-2.0-libssh_0.9.6
03:15:45.969087 IP karldrop.ssh > 119.28.111.112.56616: Flags [.], ack 23, win 509, options [nop,nop,TS val 2948223280 ecr 510344131], length 0
03:15:45.978510 IP karldrop.ssh > 119.28.111.112.56616: Flags [P.], seq 1:42, ack 23, win 509, options [nop,nop,TS val 2948223289 ecr 510344131], length 41: SSH: SSH-2.0-OpenSSH_8.9p1 Ubuntu-3ubuntu0.6
03:15:46.050249 IP karldrop.ssh > 198.211.111.194.51520: Flags [P.], seq 206752:207808, ack 1, win 501, options [nop,nop,TS val 120402119 ecr 2364686634], length 1056
03:15:46.070190 IP 198.211.111.194.51520 > karldrop.ssh: Flags [.], ack 207808, win 5813, options [nop,nop,TS val 2364686739 ecr 120402119], length 0
03:15:46.154226 IP karldrop.ssh > 198.211.111.194.51520: Flags [P.], seq 207808:208192, ack 1, win 501, options [nop,nop,TS val 120402223 ecr 2364686739], length 384
03:15:46.175469 IP 198.211.111.194.51520 > karldrop.ssh: Flags [.], ack 208192, win 5813, options [nop,nop,TS val 2364686844 ecr 120402223], length 0
03:15:46.216331 IP 119.28.111.112.56616 > karldrop.ssh: Flags [.], ack 42, win 229, options [nop,nop,TS val 510344378 ecr 2948223289], length 0
03:15:46.216390 IP karldrop.ssh > 119.28.111.112.56616: Flags [P.], seq 42:1154, ack 23, win 509, options [nop,nop,TS val 2948223527 ecr 510344378], length 1112
03:15:46.217771 IP 119.28.111.112.56616 > karldrop.ssh: Flags [P.], seq 23:999, ack 42, win 229, options [nop,nop,TS val 510344380 ecr 2948223289], length 976
03:15:46.258003 IP karldrop.ssh > 119.28.111.112.56616: Flags [.], ack 999, win 502, options [nop,nop,TS val 2948223569 ecr 510344380], length 0
03:15:46.258344 IP karldrop.ssh > 198.211.111.194.51520: Flags [P.], seq 208192:209184, ack 1, win 501, options [nop,nop,TS val 120402327 ecr 2364686844], length 992
03:15:46.288591 IP 198.211.111.194.51520 > karldrop.ssh: Flags [.], ack 209184, win 5813, options [nop,nop,TS val 2364686957 ecr 120402327], length 0
03:15:46.362189 IP karldrop.ssh > 198.211.111.194.51520: Flags [P.], seq 209184:209552, ack 1, win 501, options [nop,nop,TS val 120402431 ecr 2364686957], length 368
03:15:46.380035 IP 198.211.111.194.51520 > karldrop.ssh: Flags [.], ack 209552, win 5813, options [nop,nop,TS val 2364687049 ecr 120402431], length 0
03:15:46.466250 IP karldrop.ssh > 198.211.111.194.51520: Flags [P.], seq 209552:209920, ack 1, win 501, options [nop,nop,TS val 120402535 ecr 2364687049], length 368
03:15:46.487110 IP 198.211.111.194.51520 > karldrop.ssh: Flags [.], ack 209920, win 5813, options [nop,nop,TS val 2364687155 ecr 120402535], length 0
03:15:46.493548 IP 119.28.111.112.56616 > karldrop.ssh: Flags [.], ack 1154, win 246, options [nop,nop,TS val 510344656 ecr 2948223527], length 0
03:15:46.495840 IP 119.28.111.112.56616 > karldrop.ssh: Flags [P.], seq 999:1047, ack 1154, win 246, options [nop,nop,TS val 510344658 ecr 2948223569], length 48
03:15:46.495894 IP karldrop.ssh > 119.28.111.112.56616: Flags [.], ack 1047, win 502, options [nop,nop,TS val 2948223807 ecr 510344658], length 0
03:15:46.502633 IP karldrop.ssh > 119.28.111.112.56616: Flags [P.], seq 1154:1686, ack 1047, win 502, options [nop,nop,TS val 2948223813 ecr 510344658], length 532
03:15:46.570240 IP karldrop.ssh > 198.211.111.194.51520: Flags [P.], seq 209920:210912, ack 1, win 501, options [nop,nop,TS val 120402639 ecr 2364687155], length 992
03:15:46.602460 IP 198.211.111.194.51520 > karldrop.ssh: Flags [.], ack 210912, win 5813, options [nop,nop,TS val 2364687271 ecr 120402639], length 0
03:15:46.674179 IP karldrop.ssh > 198.211.111.194.51520: Flags [P.], seq 210912:211280, ack 1, win 501, options [nop,nop,TS val 120402743 ecr 2364687271], length 368
03:15:46.696183 IP 198.211.111.194.51520 > karldrop.ssh: Flags [.], ack 211280, win 5813, options [nop,nop,TS val 2364687365 ecr 120402743], length 0
03:15:46.740441 IP 119.28.111.112.56616 > karldrop.ssh: Flags [.], ack 1686, win 263, options [nop,nop,TS val 510344902 ecr 2948223813], length 0
03:15:46.740875 IP 119.28.111.112.56616 > karldrop.ssh: Flags [P.], seq 1047:1063, ack 1686, win 263, options [nop,nop,TS val 510344903 ecr 2948223813], length 16
^C
1090 packets captured
1097 packets received by filter
0 packets dropped by kernel
root@karldrop:~# tcpdump -i eth0 port 22
tcpdump: verbose output suppressed, use -v[v]... for full protocol decode
listening on eth0, link-type EN10MB (Ethernet), snapshot length 262144 bytes
03:16:29.283781 IP karldrop.ssh > 198.211.111.194.51520: Flags [P.], seq 3379673670:3379673798, ack 3314002728, win 501, options [nop,nop,TS val 120445352 ecr 2364729945], length 128
03:16:29.283853 IP karldrop.ssh > 198.211.111.194.51520: Flags [P.], seq 128:192, ack 1, win 501, options [nop,nop,TS val 120445353 ecr 2364729945], length 64
03:16:29.283899 IP karldrop.ssh > 198.211.111.194.51520: Flags [P.], seq 192:272, ack 1, win 501, options [nop,nop,TS val 120445353 ecr 2364729945], length 80
03:16:29.283941 IP karldrop.ssh > 198.211.111.194.51520: Flags [P.], seq 272:352, ack 1, win 501, options [nop,nop,TS val 120445353 ecr 2364729945], length 80
03:16:29.283975 IP karldrop.ssh > 198.211.111.194.51520: Flags [P.], seq 352:432, ack 1, win 501, options [nop,nop,TS val 120445353 ecr 2364729945], length 80
03:16:29.284006 IP karldrop.ssh > 198.211.111.194.51520: Flags [P.], seq 432:496, ack 1, win 501, options [nop,nop,TS val 120445353 ecr 2364729945], length 64
03:16:29.292853 IP 198.211.111.194.51520 > karldrop.ssh: Flags [.], ack 0, win 5813, options [nop,nop,TS val 2364729961 ecr 120445347], length 0
03:16:29.298413 IP 198.211.111.194.51520 > karldrop.ssh: Flags [.], ack 128, win 5813, options [nop,nop,TS val 2364729967 ecr 120445352], length 0
03:16:29.298481 IP 198.211.111.194.51520 > karldrop.ssh: Flags [.], ack 192, win 5813, options [nop,nop,TS val 2364729967 ecr 120445353], length 0
03:16:29.298481 IP 198.211.111.194.51520 > karldrop.ssh: Flags [.], ack 272, win 5813, options [nop,nop,TS val 2364729967 ecr 120445353], length 0
03:16:29.298481 IP 198.211.111.194.51520 > karldrop.ssh: Flags [.], ack 352, win 5813, options [nop,nop,TS val 2364729967 ecr 120445353], length 0
03:16:29.298552 IP 198.211.111.194.51520 > karldrop.ssh: Flags [.], ack 432, win 5813, options [nop,nop,TS val 2364729967 ecr 120445353], length 0
03:16:29.298596 IP 198.211.111.194.51520 > karldrop.ssh: Flags [.], ack 496, win 5813, options [nop,nop,TS val 2364729967 ecr 120445353], length 0
03:16:29.390765 IP karldrop.ssh > 198.211.111.194.51520: Flags [P.], seq 496:736, ack 1, win 501, options [nop,nop,TS val 120445459 ecr 2364729967], length 240
03:16:29.390854 IP karldrop.ssh > 198.211.111.194.51520: Flags [P.], seq 736:800, ack 1, win 501, options [nop,nop,TS val 120445460 ecr 2364729967], length 64
03:16:29.390962 IP karldrop.ssh > 198.211.111.194.51520: Flags [P.], seq 800:1008, ack 1, win 501, options [nop,nop,TS val 120445460 ecr 2364729967], length 208
03:16:29.391010 IP karldrop.ssh > 198.211.111.194.51520: Flags [P.], seq 1008:1072, ack 1, win 501, options [nop,nop,TS val 120445460 ecr 2364729967], length 64
03:16:29.391080 IP karldrop.ssh > 198.211.111.194.51520: Flags [P.], seq 1072:1280, ack 1, win 501, options [nop,nop,TS val 120445460 ecr 2364729967], length 208
03:16:29.391125 IP karldrop.ssh > 198.211.111.194.51520: Flags [P.], seq 1280:1344, ack 1, win 501, options [nop,nop,TS val 120445460 ecr 2364729967], length 64
03:16:29.391188 IP karldrop.ssh > 198.211.111.194.51520: Flags [P.], seq 1344:1552, ack 1, win 501, options [nop,nop,TS val 120445460 ecr 2364729967], length 208
03:16:29.391232 IP karldrop.ssh > 198.211.111.194.51520: Flags [P.], seq 1552:1616, ack 1, win 501, options [nop,nop,TS val 120445460 ecr 2364729967], length 64
03:16:29.391292 IP karldrop.ssh > 198.211.111.194.51520: Flags [P.], seq 1616:1824, ack 1, win 501, options [nop,nop,TS val 120445460 ecr 2364729967], length 208
03:16:29.391362 IP karldrop.ssh > 198.211.111.194.51520: Flags [P.], seq 1824:1888, ack 1, win 501, options [nop,nop,TS val 120445460 ecr 2364729967], length 64
03:16:29.391403 IP karldrop.ssh > 198.211.111.194.51520: Flags [P.], seq 1888:2096, ack 1, win 501, options [nop,nop,TS val 120445460 ecr 2364729967], length 208
03:16:29.391445 IP karldrop.ssh > 198.211.111.194.51520: Flags [P.], seq 2096:2160, ack 1, win 501, options [nop,nop,TS val 120445460 ecr 2364729967], length 64
03:16:29.391512 IP karldrop.ssh > 198.211.111.194.51520: Flags [P.], seq 2160:2368, ack 1, win 501, options [nop,nop,TS val 120445460 ecr 2364729967], length 208
03:16:29.391555 IP karldrop.ssh > 198.211.111.194.51520: Flags [P.], seq 2368:2432, ack 1, win 501, options [nop,nop,TS val 120445460 ecr 2364729967], length 64
03:16:29.405397 IP 198.211.111.194.51520 > karldrop.ssh: Flags [.], ack 736, win 5813, options [nop,nop,TS val 2364730074 ecr 120445459], length 0
03:16:29.405397 IP 198.211.111.194.51520 > karldrop.ssh: Flags [.], ack 800, win 5813, options [nop,nop,TS val 2364730074 ecr 120445460], length 0
03:16:29.405459 IP karldrop.ssh > 198.211.111.194.51520: Flags [P.], seq 2432:4064, ack 1, win 501, options [nop,nop,TS val 120445474 ecr 2364730074], length 1632
03:16:29.405551 IP 198.211.111.194.51520 > karldrop.ssh: Flags [.], ack 1008, win 5812, options [nop,nop,TS val 2364730074 ecr 120445460], length 0
03:16:29.405637 IP 198.211.111.194.51520 > karldrop.ssh: Flags [.], ack 1072, win 5812, options [nop,nop,TS val 2364730074 ecr 120445460], length 0
03:16:29.405637 IP 198.211.111.194.51520 > karldrop.ssh: Flags [.], ack 1280, win 5811, options [nop,nop,TS val 2364730074 ecr 120445460], length 0
03:16:29.405667 IP 198.211.111.194.51520 > karldrop.ssh: Flags [.], ack 1344, win 5811, options [nop,nop,TS val 2364730074 ecr 120445460], length 0
03:16:29.405711 IP 198.211.111.194.51520 > karldrop.ssh: Flags [.], ack 1552, win 5810, options [nop,nop,TS val 2364730074 ecr 120445460], length 0
03:16:29.405774 IP 198.211.111.194.51520 > karldrop.ssh: Flags [.], ack 1616, win 5810, options [nop,nop,TS val 2364730074 ecr 120445460], length 0
03:16:29.406035 IP 198.211.111.194.51520 > karldrop.ssh: Flags [.], ack 1824, win 5809, options [nop,nop,TS val 2364730075 ecr 120445460], length 0
03:16:29.420102 IP 198.211.111.194.51520 > karldrop.ssh: Flags [.], ack 4064, win 5792, options [nop,nop,TS val 2364730089 ecr 120445460], length 0
03:16:29.486285 IP karldrop.ssh > 198.211.111.194.51520: Flags [P.], seq 4064:4288, ack 1, win 501, options [nop,nop,TS val 120445555 ecr 2364730089], length 224
03:16:29.486349 IP karldrop.ssh > 198.211.111.194.51520: Flags [P.], seq 4288:4352, ack 1, win 501, options [nop,nop,TS val 120445555 ecr 2364730089], length 64
03:16:29.486396 IP karldrop.ssh > 198.211.111.194.51520: Flags [P.], seq 4352:4560, ack 1, win 501, options [nop,nop,TS val 120445555 ecr 2364730089], length 208
03:16:29.486424 IP karldrop.ssh > 198.211.111.194.51520: Flags [P.], seq 4560:4624, ack 1, win 501, options [nop,nop,TS val 120445555 ecr 2364730089], length 64
03:16:29.486479 IP karldrop.ssh > 198.211.111.194.51520: Flags [P.], seq 4624:4848, ack 1, win 501, options [nop,nop,TS val 120445555 ecr 2364730089], length 224
03:16:29.486530 IP karldrop.ssh > 198.211.111.194.51520: Flags [P.], seq 4848:5136, ack 1, win 501, options [nop,nop,TS val 120445555 ecr 2364730089], length 288
03:16:29.486559 IP karldrop.ssh > 198.211.111.194.51520: Flags [P.], seq 5136:5200, ack 1, win 501, options [nop,nop,TS val 120445555 ecr 2364730089], length 64
03:16:29.486596 IP karldrop.ssh > 198.211.111.194.51520: Flags [P.], seq 5200:5424, ack 1, win 501, options [nop,nop,TS val 120445555 ecr 2364730089], length 224
03:16:29.486624 IP karldrop.ssh > 198.211.111.194.51520: Flags [P.], seq 5424:5488, ack 1, win 501, options [nop,nop,TS val 120445555 ecr 2364730089], length 64
03:16:29.486661 IP karldrop.ssh > 198.211.111.194.51520: Flags [P.], seq 5488:5712, ack 1, win 501, options [nop,nop,TS val 120445555 ecr 2364730089], length 224
03:16:29.486688 IP karldrop.ssh > 198.211.111.194.51520: Flags [P.], seq 5712:5776, ack 1, win 501, options [nop,nop,TS val 120445555 ecr 2364730089], length 64
03:16:29.486732 IP karldrop.ssh > 198.211.111.194.51520: Flags [P.], seq 5776:6000, ack 1, win 501, options [nop,nop,TS val 120445555 ecr 2364730089], length 224
03:16:29.486770 IP karldrop.ssh > 198.211.111.194.51520: Flags [P.], seq 6000:6064, ack 1, win 501, options [nop,nop,TS val 120445555 ecr 2364730089], length 64
03:16:29.486850 IP karldrop.ssh > 198.211.111.194.51520: Flags [P.], seq 6064:6288, ack 1, win 501, options [nop,nop,TS val 120445556 ecr 2364730089], length 224
03:16:29.486891 IP karldrop.ssh > 198.211.111.194.51520: Flags [P.], seq 6288:6352, ack 1, win 501, options [nop,nop,TS val 120445556 ecr 2364730089], length 64
03:16:29.486934 IP karldrop.ssh > 198.211.111.194.51520: Flags [P.], seq 6352:6576, ack 1, win 501, options [nop,nop,TS val 120445556 ecr 2364730089], length 224
03:16:29.486962 IP karldrop.ssh > 198.211.111.194.51520: Flags [P.], seq 6576:6640, ack 1, win 501, options [nop,nop,TS val 120445556 ecr 2364730089], length 64
03:16:29.487020 IP karldrop.ssh > 198.211.111.194.51520: Flags [P.], seq 6640:6864, ack 1, win 501, options [nop,nop,TS val 120445556 ecr 2364730089], length 224
03:16:29.487087 IP karldrop.ssh > 198.211.111.194.51520: Flags [P.], seq 6864:6928, ack 1, win 501, options [nop,nop,TS val 120445556 ecr 2364730089], length 64
03:16:29.487138 IP karldrop.ssh > 198.211.111.194.51520: Flags [P.], seq 6928:7152, ack 1, win 501, options [nop,nop,TS val 120445556 ecr 2364730089], length 224
03:16:29.487173 IP karldrop.ssh > 198.211.111.194.51520: Flags [P.], seq 7152:7216, ack 1, win 501, options [nop,nop,TS val 120445556 ecr 2364730089], length 64
03:16:29.487221 IP karldrop.ssh > 198.211.111.194.51520: Flags [P.], seq 7216:7440, ack 1, win 501, options [nop,nop,TS val 120445556 ecr 2364730089], length 224
03:16:29.487270 IP karldrop.ssh > 198.211.111.194.51520: Flags [P.], seq 7440:7504, ack 1, win 501, options [nop,nop,TS val 120445556 ecr 2364730089], length 64
03:16:29.487333 IP karldrop.ssh > 198.211.111.194.51520: Flags [P.], seq 7504:7728, ack 1, win 501, options [nop,nop,TS val 120445556 ecr 2364730089], length 224
03:16:29.487388 IP karldrop.ssh > 198.211.111.194.51520: Flags [P.], seq 7728:7792, ack 1, win 501, options [nop,nop,TS val 120445556 ecr 2364730089], length 64
03:16:29.487446 IP karldrop.ssh > 198.211.111.194.51520: Flags [P.], seq 7792:8016, ack 1, win 501, options [nop,nop,TS val 120445556 ecr 2364730089], length 224
03:16:29.487530 IP karldrop.ssh > 198.211.111.194.51520: Flags [P.], seq 8016:8352, ack 1, win 501, options [nop,nop,TS val 120445556 ecr 2364730089], length 336
03:16:29.487582 IP karldrop.ssh > 198.211.111.194.51520: Flags [P.], seq 8352:8560, ack 1, win 501, options [nop,nop,TS val 120445556 ecr 2364730089], length 208
03:16:29.487618 IP karldrop.ssh > 198.211.111.194.51520: Flags [P.], seq 8560:8624, ack 1, win 501, options [nop,nop,TS val 120445556 ecr 2364730089], length 64
03:16:29.487667 IP karldrop.ssh > 198.211.111.194.51520: Flags [P.], seq 8624:8848, ack 1, win 501, options [nop,nop,TS val 120445556 ecr 2364730089], length 224
03:16:29.501266 IP 198.211.111.194.51520 > karldrop.ssh: Flags [.], ack 5712, win 5790, options [nop,nop,TS val 2364730170 ecr 120445555], length 0
03:16:29.501324 IP karldrop.ssh > 198.211.111.194.51520: Flags [P.], seq 8848:11088, ack 1, win 501, options [nop,nop,TS val 120445570 ecr 2364730170], length 2240
03:16:29.501763 IP 198.211.111.194.51520 > karldrop.ssh: Flags [.], ack 7216, win 5779, options [nop,nop,TS val 2364730170 ecr 120445555], length 0
03:16:29.502456 IP 198.211.111.194.51520 > karldrop.ssh: Flags [.], ack 8848, win 5767, options [nop,nop,TS val 2364730171 ecr 120445556], length 0
03:16:29.516054 IP 198.211.111.194.51520 > karldrop.ssh: Flags [.], ack 11088, win 5750, options [nop,nop,TS val 2364730185 ecr 120445570], length 0
03:16:29.590217 IP karldrop.ssh > 198.211.111.194.51520: Flags [P.], seq 11088:11312, ack 1, win 501, options [nop,nop,TS val 120445659 ecr 2364730185], length 224
03:16:29.590333 IP karldrop.ssh > 198.211.111.194.51520: Flags [P.], seq 11312:11376, ack 1, win 501, options [nop,nop,TS val 120445659 ecr 2364730185], length 64
03:16:29.590354 IP karldrop.ssh > 198.211.111.194.51520: Flags [P.], seq 11376:11600, ack 1, win 501, options [nop,nop,TS val 120445659 ecr 2364730185], length 224
03:16:29.590405 IP karldrop.ssh > 198.211.111.194.51520: Flags [P.], seq 11600:11664, ack 1, win 501, options [nop,nop,TS val 120445659 ecr 2364730185], length 64
03:16:29.590460 IP karldrop.ssh > 198.211.111.194.51520: Flags [P.], seq 11664:11888, ack 1, win 501, options [nop,nop,TS val 120445659 ecr 2364730185], length 224
03:16:29.590497 IP karldrop.ssh > 198.211.111.194.51520: Flags [P.], seq 11888:11952, ack 1, win 501, options [nop,nop,TS val 120445659 ecr 2364730185], length 64
03:16:29.590549 IP karldrop.ssh > 198.211.111.194.51520: Flags [P.], seq 11952:12176, ack 1, win 501, options [nop,nop,TS val 120445659 ecr 2364730185], length 224
03:16:29.590586 IP karldrop.ssh > 198.211.111.194.51520: Flags [P.], seq 12176:12240, ack 1, win 501, options [nop,nop,TS val 120445659 ecr 2364730185], length 64
03:16:29.590638 IP karldrop.ssh > 198.211.111.194.51520: Flags [P.], seq 12240:12464, ack 1, win 501, options [nop,nop,TS val 120445659 ecr 2364730185], length 224
03:16:29.590675 IP karldrop.ssh > 198.211.111.194.51520: Flags [P.], seq 12464:12528, ack 1, win 501, options [nop,nop,TS val 120445659 ecr 2364730185], length 64
03:16:29.590726 IP karldrop.ssh > 198.211.111.194.51520: Flags [P.], seq 12528:12752, ack 1, win 501, options [nop,nop,TS val 120445659 ecr 2364730185], length 224
03:16:29.590763 IP karldrop.ssh > 198.211.111.194.51520: Flags [P.], seq 12752:12816, ack 1, win 501, options [nop,nop,TS val 120445659 ecr 2364730185], length 64
03:16:29.590813 IP karldrop.ssh > 198.211.111.194.51520: Flags [P.], seq 12816:13040, ack 1, win 501, options [nop,nop,TS val 120445660 ecr 2364730185], length 224
03:16:29.590889 IP karldrop.ssh > 198.211.111.194.51520: Flags [P.], seq 13040:13328, ack 1, win 501, options [nop,nop,TS val 120445660 ecr 2364730185], length 288
03:16:29.590929 IP karldrop.ssh > 198.211.111.194.51520: Flags [P.], seq 13328:13392, ack 1, win 501, options [nop,nop,TS val 120445660 ecr 2364730185], length 64
03:16:29.590980 IP karldrop.ssh > 198.211.111.194.51520: Flags [P.], seq 13392:13616, ack 1, win 501, options [nop,nop,TS val 120445660 ecr 2364730185], length 224
03:16:29.591016 IP karldrop.ssh > 198.211.111.194.51520: Flags [P.], seq 13616:13680, ack 1, win 501, options [nop,nop,TS val 120445660 ecr 2364730185], length 64
03:16:29.591068 IP karldrop.ssh > 198.211.111.194.51520: Flags [P.], seq 13680:13904, ack 1, win 501, options [nop,nop,TS val 120445660 ecr 2364730185], length 224
03:16:29.591134 IP karldrop.ssh > 198.211.111.194.51520: Flags [P.], seq 13904:13968, ack 1, win 501, options [nop,nop,TS val 120445660 ecr 2364730185], length 64
03:16:29.591159 IP karldrop.ssh > 198.211.111.194.51520: Flags [P.], seq 13968:14192, ack 1, win 501, options [nop,nop,TS val 120445660 ecr 2364730185], length 224
03:16:29.591194 IP karldrop.ssh > 198.211.111.194.51520: Flags [P.], seq 14192:14256, ack 1, win 501, options [nop,nop,TS val 120445660 ecr 2364730185], length 64
03:16:29.591244 IP karldrop.ssh > 198.211.111.194.51520: Flags [P.], seq 14256:14480, ack 1, win 501, options [nop,nop,TS val 120445660 ecr 2364730185], length 224
03:16:29.591281 IP karldrop.ssh > 198.211.111.194.51520: Flags [P.], seq 14480:14544, ack 1, win 501, options [nop,nop,TS val 120445660 ecr 2364730185], length 64
03:16:29.591331 IP karldrop.ssh > 198.211.111.194.51520: Flags [P.], seq 14544:14768, ack 1, win 501, options [nop,nop,TS val 120445660 ecr 2364730185], length 224
03:16:29.591367 IP karldrop.ssh > 198.211.111.194.51520: Flags [P.], seq 14768:14832, ack 1, win 501, options [nop,nop,TS val 120445660 ecr 2364730185], length 64
03:16:29.591418 IP karldrop.ssh > 198.211.111.194.51520: Flags [P.], seq 14832:15056, ack 1, win 501, options [nop,nop,TS val 120445660 ecr 2364730185], length 224
03:16:29.591454 IP karldrop.ssh > 198.211.111.194.51520: Flags [P.], seq 15056:15120, ack 1, win 501, options [nop,nop,TS val 120445660 ecr 2364730185], length 64
03:16:29.591503 IP karldrop.ssh > 198.211.111.194.51520: Flags [P.], seq 15120:15344, ack 1, win 501, options [nop,nop,TS val 120445660 ecr 2364730185], length 224
03:16:29.591543 IP karldrop.ssh > 198.211.111.194.51520: Flags [P.], seq 15344:15408, ack 1, win 501, options [nop,nop,TS val 120445660 ecr 2364730185], length 64
03:16:29.591596 IP karldrop.ssh > 198.211.111.194.51520: Flags [P.], seq 15408:15632, ack 1, win 501, options [nop,nop,TS val 120445660 ecr 2364730185], length 224
03:16:29.591633 IP karldrop.ssh > 198.211.111.194.51520: Flags [P.], seq 15632:15696, ack 1, win 501, options [nop,nop,TS val 120445660 ecr 2364730185], length 64
03:16:29.591684 IP karldrop.ssh > 198.211.111.194.51520: Flags [P.], seq 15696:15920, ack 1, win 501, options [nop,nop,TS val 120445660 ecr 2364730185], length 224
03:16:29.591719 IP karldrop.ssh > 198.211.111.194.51520: Flags [P.], seq 15920:15984, ack 1, win 501, options [nop,nop,TS val 120445660 ecr 2364730185], length 64
03:16:29.591775 IP karldrop.ssh > 198.211.111.194.51520: Flags [P.], seq 15984:16208, ack 1, win 501, options [nop,nop,TS val 120445660 ecr 2364730185], length 224
03:16:29.591812 IP karldrop.ssh > 198.211.111.194.51520: Flags [P.], seq 16208:16272, ack 1, win 501, options [nop,nop,TS val 120445661 ecr 2364730185], length 64
03:16:29.591861 IP karldrop.ssh > 198.211.111.194.51520: Flags [P.], seq 16272:16496, ack 1, win 501, options [nop,nop,TS val 120445661 ecr 2364730185], length 224
03:16:29.591960 IP karldrop.ssh > 198.211.111.194.51520: Flags [P.], seq 16496:16848, ack 1, win 501, options [nop,nop,TS val 120445661 ecr 2364730185], length 352
03:16:29.591995 IP karldrop.ssh > 198.211.111.194.51520: Flags [P.], seq 16848:17072, ack 1, win 501, options [nop,nop,TS val 120445661 ecr 2364730185], length 224
03:16:29.592031 IP karldrop.ssh > 198.211.111.194.51520: Flags [P.], seq 17072:17136, ack 1, win 501, options [nop,nop,TS val 120445661 ecr 2364730185], length 64
03:16:29.592083 IP karldrop.ssh > 198.211.111.194.51520: Flags [P.], seq 17136:17360, ack 1, win 501, options [nop,nop,TS val 120445661 ecr 2364730185], length 224
03:16:29.592119 IP karldrop.ssh > 198.211.111.194.51520: Flags [P.], seq 17360:17424, ack 1, win 501, options [nop,nop,TS val 120445661 ecr 2364730185], length 64
03:16:29.592170 IP karldrop.ssh > 198.211.111.194.51520: Flags [P.], seq 17424:17648, ack 1, win 501, options [nop,nop,TS val 120445661 ecr 2364730185], length 224
03:16:29.592207 IP karldrop.ssh > 198.211.111.194.51520: Flags [P.], seq 17648:17712, ack 1, win 501, options [nop,nop,TS val 120445661 ecr 2364730185], length 64
03:16:29.592256 IP karldrop.ssh > 198.211.111.194.51520: Flags [P.], seq 17712:17936, ack 1, win 501, options [nop,nop,TS val 120445661 ecr 2364730185], length 224
03:16:29.592289 IP karldrop.ssh > 198.211.111.194.51520: Flags [P.], seq 17936:18000, ack 1, win 501, options [nop,nop,TS val 120445661 ecr 2364730185], length 64
03:16:29.592335 IP karldrop.ssh > 198.211.111.194.51520: Flags [P.], seq 18000:18224, ack 1, win 501, options [nop,nop,TS val 120445661 ecr 2364730185], length 224
03:16:29.592371 IP karldrop.ssh > 198.211.111.194.51520: Flags [P.], seq 18224:18288, ack 1, win 501, options [nop,nop,TS val 120445661 ecr 2364730185], length 64
03:16:29.592420 IP karldrop.ssh > 198.211.111.194.51520: Flags [P.], seq 18288:18512, ack 1, win 501, options [nop,nop,TS val 120445661 ecr 2364730185], length 224
03:16:29.592456 IP karldrop.ssh > 198.211.111.194.51520: Flags [P.], seq 18512:18576, ack 1, win 501, options [nop,nop,TS val 120445661 ecr 2364730185], length 64
03:16:29.592510 IP karldrop.ssh > 198.211.111.194.51520: Flags [P.], seq 18576:18800, ack 1, win 501, options [nop,nop,TS val 120445661 ecr 2364730185], length 224
03:16:29.592547 IP karldrop.ssh > 198.211.111.194.51520: Flags [P.], seq 18800:18864, ack 1, win 501, options [nop,nop,TS val 120445661 ecr 2364730185], length 64
03:16:29.592597 IP karldrop.ssh > 198.211.111.194.51520: Flags [P.], seq 18864:19088, ack 1, win 501, options [nop,nop,TS val 120445661 ecr 2364730185], length 224
03:16:29.592633 IP karldrop.ssh > 198.211.111.194.51520: Flags [P.], seq 19088:19152, ack 1, win 501, options [nop,nop,TS val 120445661 ecr 2364730185], length 64
03:16:29.592681 IP karldrop.ssh > 198.211.111.194.51520: Flags [P.], seq 19152:19376, ack 1, win 501, options [nop,nop,TS val 120445661 ecr 2364730185], length 224
03:16:29.592719 IP karldrop.ssh > 198.211.111.194.51520: Flags [P.], seq 19376:19440, ack 1, win 501, options [nop,nop,TS val 120445661 ecr 2364730185], length 64
03:16:29.592766 IP karldrop.ssh > 198.211.111.194.51520: Flags [P.], seq 19440:19664, ack 1, win 501, options [nop,nop,TS val 120445661 ecr 2364730185], length 224
03:16:29.592794 IP karldrop.ssh > 198.211.111.194.51520: Flags [P.], seq 19664:19728, ack 1, win 501, options [nop,nop,TS val 120445661 ecr 2364730185], length 64
03:16:29.592832 IP karldrop.ssh > 198.211.111.194.51520: Flags [P.], seq 19728:19936, ack 1, win 501, options [nop,nop,TS val 120445662 ecr 2364730185], length 208
03:16:29.592867 IP karldrop.ssh > 198.211.111.194.51520: Flags [P.], seq 19936:20000, ack 1, win 501, options [nop,nop,TS val 120445662 ecr 2364730185], length 64
03:16:29.592905 IP karldrop.ssh > 198.211.111.194.51520: Flags [P.], seq 20000:20224, ack 1, win 501, options [nop,nop,TS val 120445662 ecr 2364730185], length 224
03:16:29.592932 IP karldrop.ssh > 198.211.111.194.51520: Flags [P.], seq 20224:20288, ack 1, win 501, options [nop,nop,TS val 120445662 ecr 2364730185], length 64
03:16:29.592967 IP karldrop.ssh > 198.211.111.194.51520: Flags [P.], seq 20288:20496, ack 1, win 501, options [nop,nop,TS val 120445662 ecr 2364730185], length 208
03:16:29.605361 IP 198.211.111.194.51520 > karldrop.ssh: Flags [.], ack 12752, win 5788, options [nop,nop,TS val 2364730274 ecr 120445659], length 0
03:16:29.605436 IP karldrop.ssh > 198.211.111.194.51520: Flags [P.], seq 20496:21104, ack 1, win 501, options [nop,nop,TS val 120445674 ecr 2364730274], length 608
03:16:29.605689 IP 198.211.111.194.51520 > karldrop.ssh: Flags [.], ack 14256, win 5777, options [nop,nop,TS val 2364730274 ecr 120445659], length 0
03:16:29.606243 IP 198.211.111.194.51520 > karldrop.ssh: Flags [.], ack 15984, win 5764, options [nop,nop,TS val 2364730275 ecr 120445660], length 0
03:16:29.606699 IP 198.211.111.194.51520 > karldrop.ssh: Flags [.], ack 17648, win 5751, options [nop,nop,TS val 2364730275 ecr 120445660], length 0
03:16:29.607284 IP 198.211.111.194.51520 > karldrop.ssh: Flags [.], ack 19152, win 5740, options [nop,nop,TS val 2364730276 ecr 120445661], length 0
03:16:29.620091 IP 198.211.111.194.51520 > karldrop.ssh: Flags [.], ack 21104, win 5725, options [nop,nop,TS val 2364730289 ecr 120445661], length 0
03:16:29.694246 IP karldrop.ssh > 198.211.111.194.51520: Flags [P.], seq 21104:21328, ack 1, win 501, options [nop,nop,TS val 120445763 ecr 2364730289], length 224
03:16:29.694317 IP karldrop.ssh > 198.211.111.194.51520: Flags [P.], seq 21328:21392, ack 1, win 501, options [nop,nop,TS val 120445763 ecr 2364730289], length 64
03:16:29.694377 IP karldrop.ssh > 198.211.111.194.51520: Flags [P.], seq 21392:21616, ack 1, win 501, options [nop,nop,TS val 120445763 ecr 2364730289], length 224
03:16:29.694414 IP karldrop.ssh > 198.211.111.194.51520: Flags [P.], seq 21616:21680, ack 1, win 501, options [nop,nop,TS val 120445763 ecr 2364730289], length 64
03:16:29.694473 IP karldrop.ssh > 198.211.111.194.51520: Flags [P.], seq 21680:21904, ack 1, win 501, options [nop,nop,TS val 120445763 ecr 2364730289], length 224
03:16:29.694505 IP karldrop.ssh > 198.211.111.194.51520: Flags [P.], seq 21904:21968, ack 1, win 501, options [nop,nop,TS val 120445763 ecr 2364730289], length 64
03:16:29.694545 IP karldrop.ssh > 198.211.111.194.51520: Flags [P.], seq 21968:22192, ack 1, win 501, options [nop,nop,TS val 120445763 ecr 2364730289], length 224
03:16:29.694573 IP karldrop.ssh > 198.211.111.194.51520: Flags [P.], seq 22192:22256, ack 1, win 501, options [nop,nop,TS val 120445763 ecr 2364730289], length 64
03:16:29.694612 IP karldrop.ssh > 198.211.111.194.51520: Flags [P.], seq 22256:22480, ack 1, win 501, options [nop,nop,TS val 120445763 ecr 2364730289], length 224
03:16:29.694639 IP karldrop.ssh > 198.211.111.194.51520: Flags [P.], seq 22480:22544, ack 1, win 501, options [nop,nop,TS val 120445763 ecr 2364730289], length 64
03:16:29.694675 IP karldrop.ssh > 198.211.111.194.51520: Flags [P.], seq 22544:22768, ack 1, win 501, options [nop,nop,TS val 120445763 ecr 2364730289], length 224
03:16:29.694704 IP karldrop.ssh > 198.211.111.194.51520: Flags [P.], seq 22768:22832, ack 1, win 501, options [nop,nop,TS val 120445763 ecr 2364730289], length 64
03:16:29.694758 IP karldrop.ssh > 198.211.111.194.51520: Flags [P.], seq 22832:23056, ack 1, win 501, options [nop,nop,TS val 120445763 ecr 2364730289], length 224
03:16:29.694794 IP karldrop.ssh > 198.211.111.194.51520: Flags [P.], seq 23056:23120, ack 1, win 501, options [nop,nop,TS val 120445763 ecr 2364730289], length 64
03:16:29.694850 IP karldrop.ssh > 198.211.111.194.51520: Flags [P.], seq 23120:23344, ack 1, win 501, options [nop,nop,TS val 120445764 ecr 2364730289], length 224
03:16:29.694893 IP karldrop.ssh > 198.211.111.194.51520: Flags [P.], seq 23344:23408, ack 1, win 501, options [nop,nop,TS val 120445764 ecr 2364730289], length 64
03:16:29.694940 IP karldrop.ssh > 198.211.111.194.51520: Flags [P.], seq 23408:23632, ack 1, win 501, options [nop,nop,TS val 120445764 ecr 2364730289], length 224
03:16:29.694968 IP karldrop.ssh > 198.211.111.194.51520: Flags [P.], seq 23632:23696, ack 1, win 501, options [nop,nop,TS val 120445764 ecr 2364730289], length 64
03:16:29.695008 IP karldrop.ssh > 198.211.111.194.51520: Flags [P.], seq 23696:23920, ack 1, win 501, options [nop,nop,TS val 120445764 ecr 2364730289], length 224
03:16:29.695046 IP karldrop.ssh > 198.211.111.194.51520: Flags [P.], seq 23920:23984, ack 1, win 501, options [nop,nop,TS val 120445764 ecr 2364730289], length 64
03:16:29.695098 IP karldrop.ssh > 198.211.111.194.51520: Flags [P.], seq 23984:24208, ack 1, win 501, options [nop,nop,TS val 120445764 ecr 2364730289], length 224
03:16:29.695132 IP karldrop.ssh > 198.211.111.194.51520: Flags [P.], seq 24208:24272, ack 1, win 501, options [nop,nop,TS val 120445764 ecr 2364730289], length 64
03:16:29.695184 IP karldrop.ssh > 198.211.111.194.51520: Flags [P.], seq 24272:24496, ack 1, win 501, options [nop,nop,TS val 120445764 ecr 2364730289], length 224
03:16:29.695263 IP karldrop.ssh > 198.211.111.194.51520: Flags [P.], seq 24496:24784, ack 1, win 501, options [nop,nop,TS val 120445764 ecr 2364730289], length 288
03:16:29.695322 IP karldrop.ssh > 198.211.111.194.51520: Flags [P.], seq 24784:25072, ack 1, win 501, options [nop,nop,TS val 120445764 ecr 2364730289], length 288
03:16:29.695342 IP karldrop.ssh > 198.211.111.194.51520: Flags [P.], seq 25072:25136, ack 1, win 501, options [nop,nop,TS val 120445764 ecr 2364730289], length 64
03:16:29.695380 IP karldrop.ssh > 198.211.111.194.51520: Flags [P.], seq 25136:25360, ack 1, win 501, options [nop,nop,TS val 120445764 ecr 2364730289], length 224
03:16:29.695407 IP karldrop.ssh > 198.211.111.194.51520: Flags [P.], seq 25360:25424, ack 1, win 501, options [nop,nop,TS val 120445764 ecr 2364730289], length 64
03:16:29.695465 IP karldrop.ssh > 198.211.111.194.51520: Flags [P.], seq 25424:25648, ack 1, win 501, options [nop,nop,TS val 120445764 ecr 2364730289], length 224
03:16:29.695504 IP karldrop.ssh > 198.211.111.194.51520: Flags [P.], seq 25648:25712, ack 1, win 501, options [nop,nop,TS val 120445764 ecr 2364730289], length 64
03:16:29.695549 IP karldrop.ssh > 198.211.111.194.51520: Flags [P.], seq 25712:25936, ack 1, win 501, options [nop,nop,TS val 120445764 ecr 2364730289], length 224
03:16:29.695578 IP karldrop.ssh > 198.211.111.194.51520: Flags [P.], seq 25936:26000, ack 1, win 501, options [nop,nop,TS val 120445764 ecr 2364730289], length 64
03:16:29.695617 IP karldrop.ssh > 198.211.111.194.51520: Flags [P.], seq 26000:26224, ack 1, win 501, options [nop,nop,TS val 120445764 ecr 2364730289], length 224
03:16:29.695644 IP karldrop.ssh > 198.211.111.194.51520: Flags [P.], seq 26224:26288, ack 1, win 501, options [nop,nop,TS val 120445764 ecr 2364730289], length 64
03:16:29.695681 IP karldrop.ssh > 198.211.111.194.51520: Flags [P.], seq 26288:26512, ack 1, win 501, options [nop,nop,TS val 120445764 ecr 2364730289], length 224
03:16:29.695708 IP karldrop.ssh > 198.211.111.194.51520: Flags [P.], seq 26512:26576, ack 1, win 501, options [nop,nop,TS val 120445764 ecr 2364730289], length 64
03:16:29.695745 IP karldrop.ssh > 198.211.111.194.51520: Flags [P.], seq 26576:26800, ack 1, win 501, options [nop,nop,TS val 120445764 ecr 2364730289], length 224
03:16:29.695787 IP karldrop.ssh > 198.211.111.194.51520: Flags [P.], seq 26800:26864, ack 1, win 501, options [nop,nop,TS val 120445764 ecr 2364730289], length 64
03:16:29.695846 IP karldrop.ssh > 198.211.111.194.51520: Flags [P.], seq 26864:27088, ack 1, win 501, options [nop,nop,TS val 120445765 ecr 2364730289], length 224
03:16:29.695884 IP karldrop.ssh > 198.211.111.194.51520: Flags [P.], seq 27088:27152, ack 1, win 501, options [nop,nop,TS val 120445765 ecr 2364730289], length 64
03:16:29.695931 IP karldrop.ssh > 198.211.111.194.51520: Flags [P.], seq 27152:27376, ack 1, win 501, options [nop,nop,TS val 120445765 ecr 2364730289], length 224
03:16:29.695960 IP karldrop.ssh > 198.211.111.194.51520: Flags [P.], seq 27376:27440, ack 1, win 501, options [nop,nop,TS val 120445765 ecr 2364730289], length 64
03:16:29.695997 IP karldrop.ssh > 198.211.111.194.51520: Flags [P.], seq 27440:27664, ack 1, win 501, options [nop,nop,TS val 120445765 ecr 2364730289], length 224
03:16:29.696025 IP karldrop.ssh > 198.211.111.194.51520: Flags [P.], seq 27664:27728, ack 1, win 501, options [nop,nop,TS val 120445765 ecr 2364730289], length 64
03:16:29.696077 IP karldrop.ssh > 198.211.111.194.51520: Flags [P.], seq 27728:27952, ack 1, win 501, options [nop,nop,TS val 120445765 ecr 2364730289], length 224
03:16:29.696113 IP karldrop.ssh > 198.211.111.194.51520: Flags [P.], seq 27952:28016, ack 1, win 501, options [nop,nop,TS val 120445765 ecr 2364730289], length 64
03:16:29.696153 IP karldrop.ssh > 198.211.111.194.51520: Flags [P.], seq 28016:28240, ack 1, win 501, options [nop,nop,TS val 120445765 ecr 2364730289], length 224
03:16:29.696179 IP karldrop.ssh > 198.211.111.194.51520: Flags [P.], seq 28240:28304, ack 1, win 501, options [nop,nop,TS val 120445765 ecr 2364730289], length 64
03:16:29.696217 IP karldrop.ssh > 198.211.111.194.51520: Flags [P.], seq 28304:28528, ack 1, win 501, options [nop,nop,TS val 120445765 ecr 2364730289], length 224
03:16:29.696245 IP karldrop.ssh > 198.211.111.194.51520: Flags [P.], seq 28528:28592, ack 1, win 501, options [nop,nop,TS val 120445765 ecr 2364730289], length 64
03:16:29.696280 IP karldrop.ssh > 198.211.111.194.51520: Flags [P.], seq 28592:28816, ack 1, win 501, options [nop,nop,TS val 120445765 ecr 2364730289], length 224
03:16:29.696307 IP karldrop.ssh > 198.211.111.194.51520: Flags [P.], seq 28816:28880, ack 1, win 501, options [nop,nop,TS val 120445765 ecr 2364730289], length 64
03:16:29.696343 IP karldrop.ssh > 198.211.111.194.51520: Flags [P.], seq 28880:29104, ack 1, win 501, options [nop,nop,TS val 120445765 ecr 2364730289], length 224
03:16:29.696371 IP karldrop.ssh > 198.211.111.194.51520: Flags [P.], seq 29104:29168, ack 1, win 501, options [nop,nop,TS val 120445765 ecr 2364730289], length 64
03:16:29.696421 IP karldrop.ssh > 198.211.111.194.51520: Flags [P.], seq 29168:29392, ack 1, win 501, options [nop,nop,TS val 120445765 ecr 2364730289], length 224
03:16:29.696454 IP karldrop.ssh > 198.211.111.194.51520: Flags [P.], seq 29392:29456, ack 1, win 501, options [nop,nop,TS val 120445765 ecr 2364730289], length 64
03:16:29.696494 IP karldrop.ssh > 198.211.111.194.51520: Flags [P.], seq 29456:29680, ack 1, win 501, options [nop,nop,TS val 120445765 ecr 2364730289], length 224
03:16:29.696537 IP karldrop.ssh > 198.211.111.194.51520: Flags [P.], seq 29680:29904, ack 1, win 501, options [nop,nop,TS val 120445765 ecr 2364730289], length 224
03:16:29.696592 IP karldrop.ssh > 198.211.111.194.51520: Flags [P.], seq 29904:30288, ack 1, win 501, options [nop,nop,TS val 120445765 ecr 2364730289], length 384
03:16:29.696671 IP karldrop.ssh > 198.211.111.194.51520: Flags [P.], seq 30288:30672, ack 1, win 501, options [nop,nop,TS val 120445765 ecr 2364730289], length 384
03:16:29.696751 IP karldrop.ssh > 198.211.111.194.51520: Flags [P.], seq 30672:31232, ack 1, win 501, options [nop,nop,TS val 120445765 ecr 2364730289], length 560
03:16:29.696833 IP karldrop.ssh > 198.211.111.194.51520: Flags [P.], seq 31232:31456, ack 1, win 501, options [nop,nop,TS val 120445766 ecr 2364730289], length 224
03:16:29.696911 IP karldrop.ssh > 198.211.111.194.51520: Flags [P.], seq 31456:32176, ack 1, win 501, options [nop,nop,TS val 120445766 ecr 2364730289], length 720
03:16:29.696988 IP karldrop.ssh > 198.211.111.194.51520: Flags [P.], seq 32176:32720, ack 1, win 501, options [nop,nop,TS val 120445766 ecr 2364730289], length 544
03:16:29.697065 IP karldrop.ssh > 198.211.111.194.51520: Flags [P.], seq 32720:33104, ack 1, win 501, options [nop,nop,TS val 120445766 ecr 2364730289], length 384
03:16:29.697139 IP karldrop.ssh > 198.211.111.194.51520: Flags [P.], seq 33104:33488, ack 1, win 501, options [nop,nop,TS val 120445766 ecr 2364730289], length 384
03:16:29.697231 IP karldrop.ssh > 198.211.111.194.51520: Flags [P.], seq 33488:34032, ack 1, win 501, options [nop,nop,TS val 120445766 ecr 2364730289], length 544
03:16:29.697309 IP karldrop.ssh > 198.211.111.194.51520: Flags [P.], seq 34032:34416, ack 1, win 501, options [nop,nop,TS val 120445766 ecr 2364730289], length 384
03:16:29.697389 IP karldrop.ssh > 198.211.111.194.51520: Flags [P.], seq 34416:34800, ack 1, win 501, options [nop,nop,TS val 120445766 ecr 2364730289], length 384
03:16:29.697465 IP karldrop.ssh > 198.211.111.194.51520: Flags [P.], seq 34800:35520, ack 1, win 501, options [nop,nop,TS val 120445766 ecr 2364730289], length 720
03:16:29.697538 IP karldrop.ssh > 198.211.111.194.51520: Flags [P.], seq 35520:36064, ack 1, win 501, options [nop,nop,TS val 120445766 ecr 2364730289], length 544
03:16:29.697616 IP karldrop.ssh > 198.211.111.194.51520: Flags [P.], seq 36064:36576, ack 1, win 501, options [nop,nop,TS val 120445766 ecr 2364730289], length 512
03:16:29.697673 IP karldrop.ssh > 198.211.111.194.51520: Flags [P.], seq 36576:36928, ack 1, win 501, options [nop,nop,TS val 120445766 ecr 2364730289], length 352
03:16:29.709397 IP 198.211.111.194.51520 > karldrop.ssh: Flags [.], ack 22768, win 5788, options [nop,nop,TS val 2364730378 ecr 120445763], length 0
03:16:29.709761 IP 198.211.111.194.51520 > karldrop.ssh: Flags [.], ack 24272, win 5777, options [nop,nop,TS val 2364730378 ecr 120445763], length 0
03:16:29.710094 IP 198.211.111.194.51520 > karldrop.ssh: Flags [.], ack 25936, win 5764, options [nop,nop,TS val 2364730379 ecr 120445764], length 0
03:16:29.710456 IP 198.211.111.194.51520 > karldrop.ssh: Flags [.], ack 27440, win 5753, options [nop,nop,TS val 2364730379 ecr 120445764], length 0
03:16:29.710896 IP 198.211.111.194.51520 > karldrop.ssh: Flags [.], ack 29104, win 5740, options [nop,nop,TS val 2364730380 ecr 120445765], length 0
03:16:29.711248 IP 198.211.111.194.51520 > karldrop.ssh: Flags [.], ack 30672, win 5728, options [nop,nop,TS val 2364730380 ecr 120445765], length 0
03:16:29.711405 IP 198.211.111.194.51520 > karldrop.ssh: Flags [.], ack 32176, win 5717, options [nop,nop,TS val 2364730380 ecr 120445765], length 0
03:16:29.711812 IP 198.211.111.194.51520 > karldrop.ssh: Flags [.], ack 34032, win 5703, options [nop,nop,TS val 2364730380 ecr 120445766], length 0
03:16:29.711981 IP 198.211.111.194.51520 > karldrop.ssh: Flags [.], ack 35520, win 5692, options [nop,nop,TS val 2364730381 ecr 120445766], length 0
03:16:29.750063 IP karldrop.ssh > 198.211.111.194.51520: Flags [P.], seq 36576:36928, ack 1, win 501, options [nop,nop,TS val 120445819 ecr 2364730381], length 352
03:16:29.753606 IP 198.211.111.194.51520 > karldrop.ssh: Flags [.], ack 36928, win 5748, options [nop,nop,TS val 2364730422 ecr 120445766], length 0
03:16:29.764714 IP 198.211.111.194.51520 > karldrop.ssh: Flags [.], ack 36928, win 5748, options [nop,nop,TS val 2364730433 ecr 120445819,nop,nop,sack 1 {36576:36928}], length 0
03:16:29.798264 IP karldrop.ssh > 198.211.111.194.51520: Flags [P.], seq 36928:37152, ack 1, win 501, options [nop,nop,TS val 120445867 ecr 2364730433], length 224
03:16:29.798367 IP karldrop.ssh > 198.211.111.194.51520: Flags [P.], seq 37152:37376, ack 1, win 501, options [nop,nop,TS val 120445867 ecr 2364730433], length 224
03:16:29.798401 IP karldrop.ssh > 198.211.111.194.51520: Flags [P.], seq 37376:37600, ack 1, win 501, options [nop,nop,TS val 120445867 ecr 2364730433], length 224
03:16:29.798459 IP karldrop.ssh > 198.211.111.194.51520: Flags [P.], seq 37600:37824, ack 1, win 501, options [nop,nop,TS val 120445867 ecr 2364730433], length 224
03:16:29.798517 IP karldrop.ssh > 198.211.111.194.51520: Flags [P.], seq 37824:38208, ack 1, win 501, options [nop,nop,TS val 120445867 ecr 2364730433], length 384
03:16:29.798571 IP karldrop.ssh > 198.211.111.194.51520: Flags [P.], seq 38208:38592, ack 1, win 501, options [nop,nop,TS val 120445867 ecr 2364730433], length 384
03:16:29.798627 IP karldrop.ssh > 198.211.111.194.51520: Flags [P.], seq 38592:38976, ack 1, win 501, options [nop,nop,TS val 120445867 ecr 2364730433], length 384
03:16:29.798689 IP karldrop.ssh > 198.211.111.194.51520: Flags [P.], seq 38976:39520, ack 1, win 501, options [nop,nop,TS val 120445867 ecr 2364730433], length 544
03:16:29.798742 IP karldrop.ssh > 198.211.111.194.51520: Flags [P.], seq 39520:39904, ack 1, win 501, options [nop,nop,TS val 120445867 ecr 2364730433], length 384
03:16:29.798795 IP karldrop.ssh > 198.211.111.194.51520: Flags [P.], seq 39904:40288, ack 1, win 501, options [nop,nop,TS val 120445867 ecr 2364730433], length 384
03:16:29.798863 IP karldrop.ssh > 198.211.111.194.51520: Flags [P.], seq 40288:40832, ack 1, win 501, options [nop,nop,TS val 120445868 ecr 2364730433], length 544
03:16:29.798929 IP karldrop.ssh > 198.211.111.194.51520: Flags [P.], seq 40832:41376, ack 1, win 501, options [nop,nop,TS val 120445868 ecr 2364730433], length 544
03:16:29.798984 IP karldrop.ssh > 198.211.111.194.51520: Flags [P.], seq 41376:41760, ack 1, win 501, options [nop,nop,TS val 120445868 ecr 2364730433], length 384
03:16:29.799049 IP karldrop.ssh > 198.211.111.194.51520: Flags [P.], seq 41760:42304, ack 1, win 501, options [nop,nop,TS val 120445868 ecr 2364730433], length 544
03:16:29.799101 IP karldrop.ssh > 198.211.111.194.51520: Flags [P.], seq 42304:42688, ack 1, win 501, options [nop,nop,TS val 120445868 ecr 2364730433], length 384
03:16:29.799169 IP karldrop.ssh > 198.211.111.194.51520: Flags [P.], seq 42688:43072, ack 1, win 501, options [nop,nop,TS val 120445868 ecr 2364730433], length 384
03:16:29.799241 IP karldrop.ssh > 198.211.111.194.51520: Flags [P.], seq 43072:43456, ack 1, win 501, options [nop,nop,TS val 120445868 ecr 2364730433], length 384
03:16:29.799318 IP karldrop.ssh > 198.211.111.194.51520: Flags [P.], seq 43456:43840, ack 1, win 501, options [nop,nop,TS val 120445868 ecr 2364730433], length 384
03:16:29.799396 IP karldrop.ssh > 198.211.111.194.51520: Flags [P.], seq 43840:44224, ack 1, win 501, options [nop,nop,TS val 120445868 ecr 2364730433], length 384
03:16:29.799492 IP karldrop.ssh > 198.211.111.194.51520: Flags [P.], seq 44224:44768, ack 1, win 501, options [nop,nop,TS val 120445868 ecr 2364730433], length 544
03:16:29.799584 IP karldrop.ssh > 198.211.111.194.51520: Flags [P.], seq 44768:45488, ack 1, win 501, options [nop,nop,TS val 120445868 ecr 2364730433], length 720
03:16:29.799654 IP karldrop.ssh > 198.211.111.194.51520: Flags [P.], seq 45488:45872, ack 1, win 501, options [nop,nop,TS val 120445868 ecr 2364730433], length 384
03:16:29.799728 IP karldrop.ssh > 198.211.111.194.51520: Flags [P.], seq 45872:46416, ack 1, win 501, options [nop,nop,TS val 120445868 ecr 2364730433], length 544
03:16:29.799796 IP karldrop.ssh > 198.211.111.194.51520: Flags [P.], seq 46416:46800, ack 1, win 501, options [nop,nop,TS val 120445868 ecr 2364730433], length 384
03:16:29.799878 IP karldrop.ssh > 198.211.111.194.51520: Flags [P.], seq 46800:47184, ack 1, win 501, options [nop,nop,TS val 120445869 ecr 2364730433], length 384
03:16:29.799946 IP karldrop.ssh > 198.211.111.194.51520: Flags [P.], seq 47184:47728, ack 1, win 501, options [nop,nop,TS val 120445869 ecr 2364730433], length 544
03:16:29.800016 IP karldrop.ssh > 198.211.111.194.51520: Flags [P.], seq 47728:48112, ack 1, win 501, options [nop,nop,TS val 120445869 ecr 2364730433], length 384
03:16:29.800083 IP karldrop.ssh > 198.211.111.194.51520: Flags [P.], seq 48112:48672, ack 1, win 501, options [nop,nop,TS val 120445869 ecr 2364730433], length 560
03:16:29.800159 IP karldrop.ssh > 198.211.111.194.51520: Flags [P.], seq 48672:49056, ack 1, win 501, options [nop,nop,TS val 120445869 ecr 2364730433], length 384
03:16:29.800221 IP karldrop.ssh > 198.211.111.194.51520: Flags [P.], seq 49056:49440, ack 1, win 501, options [nop,nop,TS val 120445869 ecr 2364730433], length 384
03:16:29.800278 IP karldrop.ssh > 198.211.111.194.51520: Flags [P.], seq 49440:49824, ack 1, win 501, options [nop,nop,TS val 120445869 ecr 2364730433], length 384
03:16:29.800338 IP karldrop.ssh > 198.211.111.194.51520: Flags [P.], seq 49824:50208, ack 1, win 501, options [nop,nop,TS val 120445869 ecr 2364730433], length 384
03:16:29.800405 IP karldrop.ssh > 198.211.111.194.51520: Flags [P.], seq 50208:50768, ack 1, win 501, options [nop,nop,TS val 120445869 ecr 2364730433], length 560
03:16:29.800461 IP karldrop.ssh > 198.211.111.194.51520: Flags [P.], seq 50768:51120, ack 1, win 501, options [nop,nop,TS val 120445869 ecr 2364730433], length 352
03:16:29.800519 IP karldrop.ssh > 198.211.111.194.51520: Flags [P.], seq 51120:51472, ack 1, win 501, options [nop,nop,TS val 120445869 ecr 2364730433], length 352
03:16:29.800571 IP karldrop.ssh > 198.211.111.194.51520: Flags [P.], seq 51472:51824, ack 1, win 501, options [nop,nop,TS val 120445869 ecr 2364730433], length 352
03:16:29.800626 IP karldrop.ssh > 198.211.111.194.51520: Flags [P.], seq 51824:52176, ack 1, win 501, options [nop,nop,TS val 120445869 ecr 2364730433], length 352
03:16:29.800692 IP karldrop.ssh > 198.211.111.194.51520: Flags [P.], seq 52176:52704, ack 1, win 501, options [nop,nop,TS val 120445869 ecr 2364730433], length 528
03:16:29.800747 IP karldrop.ssh > 198.211.111.194.51520: Flags [P.], seq 52704:52944, ack 1, win 501, options [nop,nop,TS val 120445869 ecr 2364730433], length 240
03:16:29.812935 IP 198.211.111.194.51520 > karldrop.ssh: Flags [.], ack 37152, win 5813, options [nop,nop,TS val 2364730482 ecr 120445867], length 0
03:16:29.812995 IP 198.211.111.194.51520 > karldrop.ssh: Flags [.], ack 37376, win 5812, options [nop,nop,TS val 2364730482 ecr 120445867], length 0
03:16:29.812995 IP 198.211.111.194.51520 > karldrop.ssh: Flags [.], ack 37600, win 5811, options [nop,nop,TS val 2364730482 ecr 120445867], length 0
03:16:29.813037 IP 198.211.111.194.51520 > karldrop.ssh: Flags [.], ack 37824, win 5810, options [nop,nop,TS val 2364730482 ecr 120445867], length 0
03:16:29.813069 IP 198.211.111.194.51520 > karldrop.ssh: Flags [.], ack 38208, win 5807, options [nop,nop,TS val 2364730482 ecr 120445867], length 0
03:16:29.813184 IP 198.211.111.194.51520 > karldrop.ssh: Flags [.], ack 38592, win 5804, options [nop,nop,TS val 2364730482 ecr 120445867], length 0
03:16:29.813184 IP 198.211.111.194.51520 > karldrop.ssh: Flags [.], ack 38976, win 5801, options [nop,nop,TS val 2364730482 ecr 120445867], length 0
03:16:29.813252 IP 198.211.111.194.51520 > karldrop.ssh: Flags [.], ack 39520, win 5797, options [nop,nop,TS val 2364730482 ecr 120445867], length 0
03:16:29.813252 IP 198.211.111.194.51520 > karldrop.ssh: Flags [.], ack 39904, win 5794, options [nop,nop,TS val 2364730482 ecr 120445867], length 0
03:16:29.813317 IP 198.211.111.194.51520 > karldrop.ssh: Flags [.], ack 40288, win 5791, options [nop,nop,TS val 2364730482 ecr 120445867], length 0
03:16:29.813347 IP 198.211.111.194.51520 > karldrop.ssh: Flags [.], ack 40832, win 5787, options [nop,nop,TS val 2364730482 ecr 120445868], length 0
03:16:29.813434 IP 198.211.111.194.51520 > karldrop.ssh: Flags [.], ack 41376, win 5783, options [nop,nop,TS val 2364730482 ecr 120445868], length 0
03:16:29.813473 IP 198.211.111.194.51520 > karldrop.ssh: Flags [.], ack 41760, win 5780, options [nop,nop,TS val 2364730482 ecr 120445868], length 0
03:16:29.813548 IP 198.211.111.194.51520 > karldrop.ssh: Flags [.], ack 42304, win 5776, options [nop,nop,TS val 2364730482 ecr 120445868], length 0
03:16:29.813591 IP 198.211.111.194.51520 > karldrop.ssh: Flags [.], ack 42688, win 5773, options [nop,nop,TS val 2364730482 ecr 120445868], length 0
03:16:29.813719 IP 198.211.111.194.51520 > karldrop.ssh: Flags [.], ack 43456, win 5767, options [nop,nop,TS val 2364730482 ecr 120445868], length 0
03:16:29.814007 IP 198.211.111.194.51520 > karldrop.ssh: Flags [.], ack 44224, win 5761, options [nop,nop,TS val 2364730483 ecr 120445868], length 0
03:16:29.814132 IP 198.211.111.194.51520 > karldrop.ssh: Flags [.], ack 45488, win 5752, options [nop,nop,TS val 2364730483 ecr 120445868], length 0
03:16:29.814235 IP 198.211.111.194.51520 > karldrop.ssh: Flags [.], ack 46416, win 5745, options [nop,nop,TS val 2364730483 ecr 120445868], length 0
03:16:29.814422 IP 198.211.111.194.51520 > karldrop.ssh: Flags [.], ack 47184, win 5739, options [nop,nop,TS val 2364730483 ecr 120445868], length 0
03:16:29.814525 IP 198.211.111.194.51520 > karldrop.ssh: Flags [.], ack 48112, win 5732, options [nop,nop,TS val 2364730483 ecr 120445869], length 0
03:16:29.814638 IP 198.211.111.194.51520 > karldrop.ssh: Flags [.], ack 49056, win 5725, options [nop,nop,TS val 2364730483 ecr 120445869], length 0
03:16:29.814751 IP 198.211.111.194.51520 > karldrop.ssh: Flags [.], ack 49824, win 5719, options [nop,nop,TS val 2364730483 ecr 120445869], length 0
03:16:29.814883 IP 198.211.111.194.51520 > karldrop.ssh: Flags [.], ack 50768, win 5712, options [nop,nop,TS val 2364730484 ecr 120445869], length 0
03:16:29.815123 IP 198.211.111.194.51520 > karldrop.ssh: Flags [.], ack 51824, win 5704, options [nop,nop,TS val 2364730484 ecr 120445869], length 0
03:16:29.815203 IP 198.211.111.194.51520 > karldrop.ssh: Flags [.], ack 52704, win 5698, options [nop,nop,TS val 2364730484 ecr 120445869], length 0
03:16:29.857551 IP 198.211.111.194.51520 > karldrop.ssh: Flags [.], ack 52944, win 5697, options [nop,nop,TS val 2364730526 ecr 120445869], length 0
03:16:29.902354 IP karldrop.ssh > 198.211.111.194.51520: Flags [P.], seq 52944:53168, ack 1, win 501, options [nop,nop,TS val 120445971 ecr 2364730526], length 224
03:16:29.902549 IP karldrop.ssh > 198.211.111.194.51520: Flags [P.], seq 53168:53552, ack 1, win 501, options [nop,nop,TS val 120445971 ecr 2364730526], length 384
03:16:29.902684 IP karldrop.ssh > 198.211.111.194.51520: Flags [P.], seq 53552:54272, ack 1, win 501, options [nop,nop,TS val 120445971 ecr 2364730526], length 720
03:16:29.903050 IP karldrop.ssh > 198.211.111.194.51520: Flags [P.], seq 54272:56704, ack 1, win 501, options [nop,nop,TS val 120445972 ecr 2364730526], length 2432
03:16:29.904038 IP karldrop.ssh > 198.211.111.194.51520: Flags [P.], seq 56704:62864, ack 1, win 501, options [nop,nop,TS val 120445973 ecr 2364730526], length 6160
03:16:29.905240 IP karldrop.ssh > 198.211.111.194.51520: Flags [P.], seq 62864:66368, ack 1, win 501, options [nop,nop,TS val 120445974 ecr 2364730526], length 3504
03:16:29.919954 IP 198.211.111.194.51520 > karldrop.ssh: Flags [.], ack 54272, win 5795, options [nop,nop,TS val 2364730588 ecr 120445971], length 0
03:16:29.919954 IP 198.211.111.194.51520 > karldrop.ssh: Flags [.], ack 62864, win 5748, options [nop,nop,TS val 2364730588 ecr 120445972], length 0
03:16:29.919954 IP 198.211.111.194.51520 > karldrop.ssh: Flags [.], ack 66368, win 5729, options [nop,nop,TS val 2364730589 ecr 120445974], length 0
03:16:30.006128 IP karldrop.ssh > 198.211.111.194.51520: Flags [P.], seq 66368:66592, ack 1, win 501, options [nop,nop,TS val 120446075 ecr 2364730589], length 224
03:16:30.006253 IP karldrop.ssh > 198.211.111.194.51520: Flags [P.], seq 66592:66816, ack 1, win 501, options [nop,nop,TS val 120446075 ecr 2364730589], length 224
03:16:30.006387 IP karldrop.ssh > 198.211.111.194.51520: Flags [P.], seq 66816:67200, ack 1, win 501, options [nop,nop,TS val 120446075 ecr 2364730589], length 384
03:16:30.006494 IP karldrop.ssh > 198.211.111.194.51520: Flags [P.], seq 67200:67744, ack 1, win 501, options [nop,nop,TS val 120446075 ecr 2364730589], length 544
03:16:30.006594 IP karldrop.ssh > 198.211.111.194.51520: Flags [P.], seq 67744:68096, ack 1, win 501, options [nop,nop,TS val 120446075 ecr 2364730589], length 352
03:16:30.021185 IP 198.211.111.194.51520 > karldrop.ssh: Flags [.], ack 68096, win 5800, options [nop,nop,TS val 2364730690 ecr 120446075], length 0
03:16:30.110267 IP karldrop.ssh > 198.211.111.194.51520: Flags [P.], seq 68096:68320, ack 1, win 501, options [nop,nop,TS val 120446179 ecr 2364730690], length 224
03:16:30.110379 IP karldrop.ssh > 198.211.111.194.51520: Flags [P.], seq 68320:68384, ack 1, win 501, options [nop,nop,TS val 120446179 ecr 2364730690], length 64
03:16:30.110448 IP karldrop.ssh > 198.211.111.194.51520: Flags [P.], seq 68384:68608, ack 1, win 501, options [nop,nop,TS val 120446179 ecr 2364730690], length 224
03:16:30.110511 IP karldrop.ssh > 198.211.111.194.51520: Flags [P.], seq 68608:68672, ack 1, win 501, options [nop,nop,TS val 120446179 ecr 2364730690], length 64
03:16:30.110531 IP karldrop.ssh > 198.211.111.194.51520: Flags [P.], seq 68672:68896, ack 1, win 501, options [nop,nop,TS val 120446179 ecr 2364730690], length 224
03:16:30.110729 IP karldrop.ssh > 198.211.111.194.51520: Flags [P.], seq 68896:69808, ack 1, win 501, options [nop,nop,TS val 120446179 ecr 2364730690], length 912
03:16:30.125375 IP 198.211.111.194.51520 > karldrop.ssh: Flags [.], ack 69808, win 5798, options [nop,nop,TS val 2364730794 ecr 120446179], length 0
03:16:30.214308 IP karldrop.ssh > 198.211.111.194.51520: Flags [P.], seq 69808:70032, ack 1, win 501, options [nop,nop,TS val 120446283 ecr 2364730794], length 224
03:16:30.214373 IP karldrop.ssh > 198.211.111.194.51520: Flags [P.], seq 70032:70096, ack 1, win 501, options [nop,nop,TS val 120446283 ecr 2364730794], length 64
03:16:30.214422 IP karldrop.ssh > 198.211.111.194.51520: Flags [P.], seq 70096:70320, ack 1, win 501, options [nop,nop,TS val 120446283 ecr 2364730794], length 224
03:16:30.214450 IP karldrop.ssh > 198.211.111.194.51520: Flags [P.], seq 70320:70384, ack 1, win 501, options [nop,nop,TS val 120446283 ecr 2364730794], length 64
03:16:30.214492 IP karldrop.ssh > 198.211.111.194.51520: Flags [P.], seq 70384:70608, ack 1, win 501, options [nop,nop,TS val 120446283 ecr 2364730794], length 224
03:16:30.214520 IP karldrop.ssh > 198.211.111.194.51520: Flags [P.], seq 70608:70672, ack 1, win 501, options [nop,nop,TS val 120446283 ecr 2364730794], length 64
03:16:30.214558 IP karldrop.ssh > 198.211.111.194.51520: Flags [P.], seq 70672:70896, ack 1, win 501, options [nop,nop,TS val 120446283 ecr 2364730794], length 224
03:16:30.214585 IP karldrop.ssh > 198.211.111.194.51520: Flags [P.], seq 70896:70960, ack 1, win 501, options [nop,nop,TS val 120446283 ecr 2364730794], length 64
03:16:30.214622 IP karldrop.ssh > 198.211.111.194.51520: Flags [P.], seq 70960:71184, ack 1, win 501, options [nop,nop,TS val 120446283 ecr 2364730794], length 224
03:16:30.214650 IP karldrop.ssh > 198.211.111.194.51520: Flags [P.], seq 71184:71248, ack 1, win 501, options [nop,nop,TS val 120446283 ecr 2364730794], length 64
03:16:30.214688 IP karldrop.ssh > 198.211.111.194.51520: Flags [P.], seq 71248:71472, ack 1, win 501, options [nop,nop,TS val 120446283 ecr 2364730794], length 224
03:16:30.214716 IP karldrop.ssh > 198.211.111.194.51520: Flags [P.], seq 71472:71536, ack 1, win 501, options [nop,nop,TS val 120446283 ecr 2364730794], length 64
03:16:30.214753 IP karldrop.ssh > 198.211.111.194.51520: Flags [P.], seq 71536:71744, ack 1, win 501, options [nop,nop,TS val 120446283 ecr 2364730794], length 208
03:16:30.214780 IP karldrop.ssh > 198.211.111.194.51520: Flags [P.], seq 71744:71808, ack 1, win 501, options [nop,nop,TS val 120446283 ecr 2364730794], length 64
03:16:30.229302 IP 198.211.111.194.51520 > karldrop.ssh: Flags [.], ack 71472, win 5788, options [nop,nop,TS val 2364730898 ecr 120446283], length 0
03:16:30.246049 IP 198.211.111.194.51520 > karldrop.ssh: Flags [.], ack 71808, win 5813, options [nop,nop,TS val 2364730915 ecr 120446283], length 0
03:16:30.318222 IP karldrop.ssh > 198.211.111.194.51520: Flags [P.], seq 71808:72032, ack 1, win 501, options [nop,nop,TS val 120446387 ecr 2364730915], length 224
03:16:30.318315 IP karldrop.ssh > 198.211.111.194.51520: Flags [P.], seq 72032:72096, ack 1, win 501, options [nop,nop,TS val 120446387 ecr 2364730915], length 64
03:16:30.318340 IP karldrop.ssh > 198.211.111.194.51520: Flags [P.], seq 72096:72320, ack 1, win 501, options [nop,nop,TS val 120446387 ecr 2364730915], length 224
03:16:30.318367 IP karldrop.ssh > 198.211.111.194.51520: Flags [P.], seq 72320:72384, ack 1, win 501, options [nop,nop,TS val 120446387 ecr 2364730915], length 64
03:16:30.318407 IP karldrop.ssh > 198.211.111.194.51520: Flags [P.], seq 72384:72608, ack 1, win 501, options [nop,nop,TS val 120446387 ecr 2364730915], length 224
03:16:30.318434 IP karldrop.ssh > 198.211.111.194.51520: Flags [P.], seq 72608:72672, ack 1, win 501, options [nop,nop,TS val 120446387 ecr 2364730915], length 64
03:16:30.318471 IP karldrop.ssh > 198.211.111.194.51520: Flags [P.], seq 72672:72896, ack 1, win 501, options [nop,nop,TS val 120446387 ecr 2364730915], length 224
03:16:30.318507 IP karldrop.ssh > 198.211.111.194.51520: Flags [P.], seq 72896:72960, ack 1, win 501, options [nop,nop,TS val 120446387 ecr 2364730915], length 64
03:16:30.318561 IP karldrop.ssh > 198.211.111.194.51520: Flags [P.], seq 72960:73184, ack 1, win 501, options [nop,nop,TS val 120446387 ecr 2364730915], length 224
03:16:30.318756 IP karldrop.ssh > 198.211.111.194.51520: Flags [P.], seq 73184:73728, ack 1, win 501, options [nop,nop,TS val 120446387 ecr 2364730915], length 544
03:16:30.318795 IP karldrop.ssh > 198.211.111.194.51520: Flags [P.], seq 73728:73952, ack 1, win 501, options [nop,nop,TS val 120446387 ecr 2364730915], length 224
03:16:30.318921 IP karldrop.ssh > 198.211.111.194.51520: Flags [P.], seq 73952:74672, ack 1, win 501, options [nop,nop,TS val 120446388 ecr 2364730915], length 720
03:16:30.319007 IP karldrop.ssh > 198.211.111.194.51520: Flags [P.], seq 74672:74896, ack 1, win 501, options [nop,nop,TS val 120446388 ecr 2364730915], length 224
03:16:30.319094 IP karldrop.ssh > 198.211.111.194.51520: Flags [P.], seq 74896:75248, ack 1, win 501, options [nop,nop,TS val 120446388 ecr 2364730915], length 352
03:16:30.333342 IP 198.211.111.194.51520 > karldrop.ssh: Flags [.], ack 73728, win 5798, options [nop,nop,TS val 2364731002 ecr 120446387], length 0
03:16:30.333615 IP 198.211.111.194.51520 > karldrop.ssh: Flags [.], ack 75248, win 5787, options [nop,nop,TS val 2364731002 ecr 120446387], length 0
03:16:30.422151 IP karldrop.ssh > 198.211.111.194.51520: Flags [P.], seq 75248:75472, ack 1, win 501, options [nop,nop,TS val 120446491 ecr 2364731002], length 224
03:16:30.422238 IP karldrop.ssh > 198.211.111.194.51520: Flags [P.], seq 75472:75760, ack 1, win 501, options [nop,nop,TS val 120446491 ecr 2364731002], length 288
03:16:30.422292 IP karldrop.ssh > 198.211.111.194.51520: Flags [P.], seq 75760:75824, ack 1, win 501, options [nop,nop,TS val 120446491 ecr 2364731002], length 64
03:16:30.422332 IP karldrop.ssh > 198.211.111.194.51520: Flags [P.], seq 75824:76048, ack 1, win 501, options [nop,nop,TS val 120446491 ecr 2364731002], length 224
03:16:30.422360 IP karldrop.ssh > 198.211.111.194.51520: Flags [P.], seq 76048:76112, ack 1, win 501, options [nop,nop,TS val 120446491 ecr 2364731002], length 64
03:16:30.422413 IP karldrop.ssh > 198.211.111.194.51520: Flags [P.], seq 76112:76496, ack 1, win 501, options [nop,nop,TS val 120446491 ecr 2364731002], length 384
03:16:30.422465 IP karldrop.ssh > 198.211.111.194.51520: Flags [P.], seq 76496:76880, ack 1, win 501, options [nop,nop,TS val 120446491 ecr 2364731002], length 384
03:16:30.422519 IP karldrop.ssh > 198.211.111.194.51520: Flags [P.], seq 76880:77264, ack 1, win 501, options [nop,nop,TS val 120446491 ecr 2364731002], length 384
03:16:30.422582 IP karldrop.ssh > 198.211.111.194.51520: Flags [P.], seq 77264:77808, ack 1, win 501, options [nop,nop,TS val 120446491 ecr 2364731002], length 544
03:16:30.422639 IP karldrop.ssh > 198.211.111.194.51520: Flags [P.], seq 77808:78192, ack 1, win 501, options [nop,nop,TS val 120446491 ecr 2364731002], length 384
03:16:30.422721 IP karldrop.ssh > 198.211.111.194.51520: Flags [P.], seq 78192:78544, ack 1, win 501, options [nop,nop,TS val 120446491 ecr 2364731002], length 352
03:16:30.422756 IP karldrop.ssh > 198.211.111.194.51520: Flags [P.], seq 78544:78608, ack 1, win 501, options [nop,nop,TS val 120446491 ecr 2364731002], length 64
03:16:30.437214 IP 198.211.111.194.51520 > karldrop.ssh: Flags [.], ack 76880, win 5796, options [nop,nop,TS val 2364731106 ecr 120446491], length 0
03:16:30.437315 IP 198.211.111.194.51520 > karldrop.ssh: Flags [.], ack 78544, win 5783, options [nop,nop,TS val 2364731106 ecr 120446491], length 0
03:16:30.477796 IP 198.211.111.194.51520 > karldrop.ssh: Flags [.], ack 78608, win 5783, options [nop,nop,TS val 2364731146 ecr 120446491], length 0
03:16:30.526169 IP karldrop.ssh > 198.211.111.194.51520: Flags [P.], seq 78608:78832, ack 1, win 501, options [nop,nop,TS val 120446595 ecr 2364731146], length 224
03:16:30.526233 IP karldrop.ssh > 198.211.111.194.51520: Flags [P.], seq 78832:78896, ack 1, win 501, options [nop,nop,TS val 120446595 ecr 2364731146], length 64
03:16:30.526280 IP karldrop.ssh > 198.211.111.194.51520: Flags [P.], seq 78896:79120, ack 1, win 501, options [nop,nop,TS val 120446595 ecr 2364731146], length 224
03:16:30.526320 IP karldrop.ssh > 198.211.111.194.51520: Flags [P.], seq 79120:79184, ack 1, win 501, options [nop,nop,TS val 120446595 ecr 2364731146], length 64
03:16:30.526376 IP karldrop.ssh > 198.211.111.194.51520: Flags [P.], seq 79184:79408, ack 1, win 501, options [nop,nop,TS val 120446595 ecr 2364731146], length 224
03:16:30.526418 IP karldrop.ssh > 198.211.111.194.51520: Flags [P.], seq 79408:79632, ack 1, win 501, options [nop,nop,TS val 120446595 ecr 2364731146], length 224
03:16:30.526458 IP karldrop.ssh > 198.211.111.194.51520: Flags [P.], seq 79632:79856, ack 1, win 501, options [nop,nop,TS val 120446595 ecr 2364731146], length 224
03:16:30.526514 IP karldrop.ssh > 198.211.111.194.51520: Flags [P.], seq 79856:80240, ack 1, win 501, options [nop,nop,TS val 120446595 ecr 2364731146], length 384
03:16:30.526578 IP karldrop.ssh > 198.211.111.194.51520: Flags [P.], seq 80240:80784, ack 1, win 501, options [nop,nop,TS val 120446595 ecr 2364731146], length 544
03:16:30.526631 IP karldrop.ssh > 198.211.111.194.51520: Flags [P.], seq 80784:81168, ack 1, win 501, options [nop,nop,TS val 120446595 ecr 2364731146], length 384
03:16:30.526686 IP karldrop.ssh > 198.211.111.194.51520: Flags [P.], seq 81168:81520, ack 1, win 501, options [nop,nop,TS val 120446595 ecr 2364731146], length 352
03:16:30.526745 IP karldrop.ssh > 198.211.111.194.51520: Flags [P.], seq 81520:81728, ack 1, win 501, options [nop,nop,TS val 120446595 ecr 2364731146], length 208
03:16:30.541094 IP 198.211.111.194.51520 > karldrop.ssh: Flags [.], ack 80240, win 5794, options [nop,nop,TS val 2364731210 ecr 120446595], length 0
03:16:30.541261 IP 198.211.111.194.51520 > karldrop.ssh: Flags [.], ack 81728, win 5783, options [nop,nop,TS val 2364731210 ecr 120446595], length 0
03:16:30.630224 IP karldrop.ssh > 198.211.111.194.51520: Flags [P.], seq 81728:81952, ack 1, win 501, options [nop,nop,TS val 120446699 ecr 2364731210], length 224
03:16:30.630373 IP karldrop.ssh > 198.211.111.194.51520: Flags [P.], seq 81952:82496, ack 1, win 501, options [nop,nop,TS val 120446699 ecr 2364731210], length 544
03:16:30.630466 IP karldrop.ssh > 198.211.111.194.51520: Flags [P.], seq 82496:83216, ack 1, win 501, options [nop,nop,TS val 120446699 ecr 2364731210], length 720
03:16:30.630540 IP karldrop.ssh > 198.211.111.194.51520: Flags [P.], seq 83216:83776, ack 1, win 501, options [nop,nop,TS val 120446699 ecr 2364731210], length 560
03:16:30.630611 IP karldrop.ssh > 198.211.111.194.51520: Flags [P.], seq 83776:84304, ack 1, win 501, options [nop,nop,TS val 120446699 ecr 2364731210], length 528
03:16:30.630647 IP karldrop.ssh > 198.211.111.194.51520: Flags [P.], seq 84304:84368, ack 1, win 501, options [nop,nop,TS val 120446699 ecr 2364731210], length 64
03:16:30.645043 IP 198.211.111.194.51520 > karldrop.ssh: Flags [.], ack 83216, win 5804, options [nop,nop,TS val 2364731314 ecr 120446699], length 0
03:16:30.665415 IP 198.211.111.194.51520 > karldrop.ssh: Flags [.], ack 84368, win 5813, options [nop,nop,TS val 2364731334 ecr 120446699], length 0
03:16:30.734205 IP karldrop.ssh > 198.211.111.194.51520: Flags [P.], seq 84368:84592, ack 1, win 501, options [nop,nop,TS val 120446803 ecr 2364731334], length 224
03:16:30.734364 IP karldrop.ssh > 198.211.111.194.51520: Flags [P.], seq 84592:85152, ack 1, win 501, options [nop,nop,TS val 120446803 ecr 2364731334], length 560
03:16:30.734481 IP karldrop.ssh > 198.211.111.194.51520: Flags [P.], seq 85152:85696, ack 1, win 501, options [nop,nop,TS val 120446803 ecr 2364731334], length 544
03:16:30.734554 IP karldrop.ssh > 198.211.111.194.51520: Flags [P.], seq 85696:85904, ack 1, win 501, options [nop,nop,TS val 120446803 ecr 2364731334], length 208
03:16:30.749633 IP 198.211.111.194.51520 > karldrop.ssh: Flags [.], ack 85904, win 5802, options [nop,nop,TS val 2364731418 ecr 120446803], length 0
03:16:30.838205 IP karldrop.ssh > 198.211.111.194.51520: Flags [P.], seq 85904:86128, ack 1, win 501, options [nop,nop,TS val 120446907 ecr 2364731418], length 224
03:16:30.838308 IP karldrop.ssh > 198.211.111.194.51520: Flags [P.], seq 86128:86416, ack 1, win 501, options [nop,nop,TS val 120446907 ecr 2364731418], length 288
03:16:30.838340 IP karldrop.ssh > 198.211.111.194.51520: Flags [P.], seq 86416:86480, ack 1, win 501, options [nop,nop,TS val 120446907 ecr 2364731418], length 64
03:16:30.838387 IP karldrop.ssh > 198.211.111.194.51520: Flags [P.], seq 86480:86704, ack 1, win 501, options [nop,nop,TS val 120446907 ecr 2364731418], length 224
03:16:30.838430 IP karldrop.ssh > 198.211.111.194.51520: Flags [P.], seq 86704:86928, ack 1, win 501, options [nop,nop,TS val 120446907 ecr 2364731418], length 224
03:16:30.838479 IP karldrop.ssh > 198.211.111.194.51520: Flags [P.], seq 86928:87136, ack 1, win 501, options [nop,nop,TS val 120446907 ecr 2364731418], length 208
03:16:30.872500 IP 198.211.111.194.51520 > karldrop.ssh: Flags [.], ack 87136, win 5813, options [nop,nop,TS val 2364731541 ecr 120446907], length 0
03:16:30.942192 IP karldrop.ssh > 198.211.111.194.51520: Flags [P.], seq 87136:87360, ack 1, win 501, options [nop,nop,TS val 120447011 ecr 2364731541], length 224
03:16:30.942319 IP karldrop.ssh > 198.211.111.194.51520: Flags [P.], seq 87360:88080, ack 1, win 501, options [nop,nop,TS val 120447011 ecr 2364731541], length 720
03:16:30.942380 IP karldrop.ssh > 198.211.111.194.51520: Flags [P.], seq 88080:88448, ack 1, win 501, options [nop,nop,TS val 120447011 ecr 2364731541], length 368
03:16:30.942414 IP karldrop.ssh > 198.211.111.194.51520: Flags [P.], seq 88448:88512, ack 1, win 501, options [nop,nop,TS val 120447011 ecr 2364731541], length 64
03:16:30.976200 IP 198.211.111.194.51520 > karldrop.ssh: Flags [.], ack 88512, win 5813, options [nop,nop,TS val 2364731645 ecr 120447011], length 0
03:16:31.046145 IP karldrop.ssh > 198.211.111.194.51520: Flags [P.], seq 88512:88736, ack 1, win 501, options [nop,nop,TS val 120447115 ecr 2364731645], length 224
03:16:31.046278 IP karldrop.ssh > 198.211.111.194.51520: Flags [P.], seq 88736:89120, ack 1, win 501, options [nop,nop,TS val 120447115 ecr 2364731645], length 384
03:16:31.046373 IP karldrop.ssh > 198.211.111.194.51520: Flags [P.], seq 89120:89344, ack 1, win 501, options [nop,nop,TS val 120447115 ecr 2364731645], length 224
03:16:31.046441 IP karldrop.ssh > 198.211.111.194.51520: Flags [P.], seq 89344:89552, ack 1, win 501, options [nop,nop,TS val 120447115 ecr 2364731645], length 208
03:16:31.076546 IP 198.211.111.194.51520 > karldrop.ssh: Flags [.], ack 89552, win 5813, options [nop,nop,TS val 2364731745 ecr 120447115], length 0
03:16:31.150219 IP karldrop.ssh > 198.211.111.194.51520: Flags [P.], seq 89552:89776, ack 1, win 501, options [nop,nop,TS val 120447219 ecr 2364731745], length 224
03:16:31.150348 IP karldrop.ssh > 198.211.111.194.51520: Flags [P.], seq 89776:90480, ack 1, win 501, options [nop,nop,TS val 120447219 ecr 2364731745], length 704
03:16:31.172827 IP 198.211.111.194.51520 > karldrop.ssh: Flags [.], ack 90480, win 5813, options [nop,nop,TS val 2364731841 ecr 120447219], length 0
03:16:31.254304 IP karldrop.ssh > 198.211.111.194.51520: Flags [P.], seq 90480:90704, ack 1, win 501, options [nop,nop,TS val 120447323 ecr 2364731841], length 224
03:16:31.254411 IP karldrop.ssh > 198.211.111.194.51520: Flags [P.], seq 90704:91072, ack 1, win 501, options [nop,nop,TS val 120447323 ecr 2364731841], length 368
03:16:31.273493 IP 198.211.111.194.51520 > karldrop.ssh: Flags [.], ack 91072, win 5813, options [nop,nop,TS val 2364731942 ecr 120447323], length 0
03:16:31.358247 IP karldrop.ssh > 198.211.111.194.51520: Flags [P.], seq 91072:91296, ack 1, win 501, options [nop,nop,TS val 120447427 ecr 2364731942], length 224
03:16:31.358376 IP karldrop.ssh > 198.211.111.194.51520: Flags [P.], seq 91296:91664, ack 1, win 501, options [nop,nop,TS val 120447427 ecr 2364731942], length 368
03:16:31.380034 IP 198.211.111.194.51520 > karldrop.ssh: Flags [.], ack 91664, win 5813, options [nop,nop,TS val 2364732048 ecr 120447427], length 0
03:16:31.462268 IP karldrop.ssh > 198.211.111.194.51520: Flags [P.], seq 91664:91888, ack 1, win 501, options [nop,nop,TS val 120447531 ecr 2364732048], length 224
03:16:31.462389 IP karldrop.ssh > 198.211.111.194.51520: Flags [P.], seq 91888:92256, ack 1, win 501, options [nop,nop,TS val 120447531 ecr 2364732048], length 368
03:16:31.486254 IP 198.211.111.194.51520 > karldrop.ssh: Flags [.], ack 92256, win 5813, options [nop,nop,TS val 2364732155 ecr 120447531], length 0
03:16:31.566113 IP karldrop.ssh > 198.211.111.194.51520: Flags [P.], seq 92256:92640, ack 1, win 501, options [nop,nop,TS val 120447635 ecr 2364732155], length 384
03:16:31.566193 IP karldrop.ssh > 198.211.111.194.51520: Flags [P.], seq 92640:92848, ack 1, win 501, options [nop,nop,TS val 120447635 ecr 2364732155], length 208
03:16:31.592709 IP 198.211.111.194.51520 > karldrop.ssh: Flags [.], ack 92848, win 5813, options [nop,nop,TS val 2364732261 ecr 120447635], length 0
03:16:31.670173 IP karldrop.ssh > 198.211.111.194.51520: Flags [P.], seq 92848:93072, ack 1, win 501, options [nop,nop,TS val 120447739 ecr 2364732261], length 224
03:16:31.670268 IP karldrop.ssh > 198.211.111.194.51520: Flags [P.], seq 93072:93296, ack 1, win 501, options [nop,nop,TS val 120447739 ecr 2364732261], length 224
03:16:31.670338 IP karldrop.ssh > 198.211.111.194.51520: Flags [P.], seq 93296:93504, ack 1, win 501, options [nop,nop,TS val 120447739 ecr 2364732261], length 208
03:16:31.692362 IP 198.211.111.194.51520 > karldrop.ssh: Flags [.], ack 93504, win 5813, options [nop,nop,TS val 2364732361 ecr 120447739], length 0
03:16:31.774316 IP karldrop.ssh > 198.211.111.194.51520: Flags [P.], seq 93504:94208, ack 1, win 501, options [nop,nop,TS val 120447843 ecr 2364732361], length 704
03:16:31.798778 IP 198.211.111.194.51520 > karldrop.ssh: Flags [.], ack 94208, win 5813, options [nop,nop,TS val 2364732467 ecr 120447843], length 0
03:16:31.878251 IP karldrop.ssh > 198.211.111.194.51520: Flags [P.], seq 94208:94576, ack 1, win 501, options [nop,nop,TS val 120447947 ecr 2364732467], length 368
03:16:31.896038 IP 198.211.111.194.51520 > karldrop.ssh: Flags [.], ack 94576, win 5813, options [nop,nop,TS val 2364732565 ecr 120447947], length 0
03:16:31.982223 IP karldrop.ssh > 198.211.111.194.51520: Flags [P.], seq 94576:94944, ack 1, win 501, options [nop,nop,TS val 120448051 ecr 2364732565], length 368
03:16:32.000006 IP 198.211.111.194.51520 > karldrop.ssh: Flags [.], ack 94944, win 5813, options [nop,nop,TS val 2364732668 ecr 120448051], length 0
03:16:32.086238 IP karldrop.ssh > 198.211.111.194.51520: Flags [P.], seq 94944:95312, ack 1, win 501, options [nop,nop,TS val 120448155 ecr 2364732668], length 368
03:16:32.107420 IP 198.211.111.194.51520 > karldrop.ssh: Flags [.], ack 95312, win 5813, options [nop,nop,TS val 2364732776 ecr 120448155], length 0
03:16:32.190216 IP karldrop.ssh > 198.211.111.194.51520: Flags [P.], seq 95312:95680, ack 1, win 501, options [nop,nop,TS val 120448259 ecr 2364732776], length 368
03:16:32.206499 IP 198.211.111.194.51520 > karldrop.ssh: Flags [.], ack 95680, win 5813, options [nop,nop,TS val 2364732875 ecr 120448259], length 0
03:16:32.294367 IP karldrop.ssh > 198.211.111.194.51520: Flags [P.], seq 95680:96048, ack 1, win 501, options [nop,nop,TS val 120448363 ecr 2364732875], length 368
03:16:32.313784 IP 198.211.111.194.51520 > karldrop.ssh: Flags [.], ack 96048, win 5813, options [nop,nop,TS val 2364732982 ecr 120448363], length 0
03:16:32.398205 IP karldrop.ssh > 198.211.111.194.51520: Flags [P.], seq 96048:96416, ack 1, win 501, options [nop,nop,TS val 120448467 ecr 2364732982], length 368
03:16:32.418187 IP 198.211.111.194.51520 > karldrop.ssh: Flags [.], ack 96416, win 5813, options [nop,nop,TS val 2364733087 ecr 120448467], length 0
03:16:32.502309 IP karldrop.ssh > 198.211.111.194.51520: Flags [P.], seq 96416:96784, ack 1, win 501, options [nop,nop,TS val 120448571 ecr 2364733087], length 368
03:16:32.523171 IP 198.211.111.194.51520 > karldrop.ssh: Flags [.], ack 96784, win 5813, options [nop,nop,TS val 2364733192 ecr 120448571], length 0
03:16:32.606288 IP karldrop.ssh > 198.211.111.194.51520: Flags [P.], seq 96784:97152, ack 1, win 501, options [nop,nop,TS val 120448675 ecr 2364733192], length 368
03:16:32.624495 IP 198.211.111.194.51520 > karldrop.ssh: Flags [.], ack 97152, win 5813, options [nop,nop,TS val 2364733293 ecr 120448675], length 0
03:16:32.710207 IP karldrop.ssh > 198.211.111.194.51520: Flags [P.], seq 97152:97520, ack 1, win 501, options [nop,nop,TS val 120448779 ecr 2364733293], length 368
03:16:32.732242 IP 198.211.111.194.51520 > karldrop.ssh: Flags [.], ack 97520, win 5813, options [nop,nop,TS val 2364733401 ecr 120448779], length 0
^C
445 packets captured
451 packets received by filter