02:59:17.198091 IP karldrop.ssh > 198.211.111.194.51520: Flags [P.], seq 342016:342400, ack 1121, win 501, options [nop,nop,TS val 119413267 ecr 2363697790], length 384
02:59:17.218085 IP 198.211.111.194.51520 > karldrop.ssh: Flags [.], ack 342400, win 1838, options [nop,nop,TS val 2363697889 ecr 119413267], length 0
02:59:17.302102 IP karldrop.ssh > 198.211.111.194.51520: Flags [P.], seq 342400:342784, ack 1121, win 501, options [nop,nop,TS val 119413371 ecr 2363697889], length 384
02:59:17.322678 IP 198.211.111.194.51520 > karldrop.ssh: Flags [.], ack 342784, win 1838, options [nop,nop,TS val 2363697994 ecr 119413371], length 0
02:59:17.406083 IP karldrop.ssh > 198.211.111.194.51520: Flags [P.], seq 342784:343168, ack 1121, win 501, options [nop,nop,TS val 119413475 ecr 2363697994], length 384
02:59:17.428311 IP 198.211.111.194.51520 > karldrop.ssh: Flags [.], ack 343168, win 1838, options [nop,nop,TS val 2363698100 ecr 119413475], length 0
02:59:17.510094 IP karldrop.ssh > 198.211.111.194.51520: Flags [P.], seq 343168:343552, ack 1121, win 501, options [nop,nop,TS val 119413579 ecr 2363698100], length 384
02:59:17.531940 IP 198.211.111.194.51520 > karldrop.ssh: Flags [.], ack 343552, win 1838, options [nop,nop,TS val 2363698203 ecr 119413579], length 0
02:59:17.614128 IP karldrop.ssh > 198.211.111.194.51520: Flags [P.], seq 343552:343936, ack 1121, win 501, options [nop,nop,TS val 119413683 ecr 2363698203], length 384
02:59:17.635521 IP 198.211.111.194.51520 > karldrop.ssh: Flags [.], ack 343936, win 1838, options [nop,nop,TS val 2363698307 ecr 119413683], length 0
02:59:17.718103 IP karldrop.ssh > 198.211.111.194.51520: Flags [P.], seq 343936:344320, ack 1121, win 501, options [nop,nop,TS val 119413787 ecr 2363698307], length 384
02:59:17.738865 IP 198.211.111.194.51520 > karldrop.ssh: Flags [.], ack 344320, win 1838, options [nop,nop,TS val 2363698410 ecr 119413787], length 0
02:59:17.822086 IP karldrop.ssh > 198.211.111.194.51520: Flags [P.], seq 344320:344704, ack 1121, win 501, options [nop,nop,TS val 119413891 ecr 2363698410], length 384
02:59:17.843079 IP 198.211.111.194.51520 > karldrop.ssh: Flags [.], ack 344704, win 1838, options [nop,nop,TS val 2363698514 ecr 119413891], length 0
02:59:17.926072 IP karldrop.ssh > 198.211.111.194.51520: Flags [P.], seq 344704:345088, ack 1121, win 501, options [nop,nop,TS val 119413995 ecr 2363698514], length 384
02:59:17.948096 IP 198.211.111.194.51520 > karldrop.ssh: Flags [.], ack 345088, win 1838, options [nop,nop,TS val 2363698619 ecr 119413995], length 0
02:59:18.030100 IP karldrop.ssh > 198.211.111.194.51520: Flags [P.], seq 345088:345472, ack 1121, win 501, options [nop,nop,TS val 119414099 ecr 2363698619], length 384
02:59:18.052869 IP 198.211.111.194.51520 > karldrop.ssh: Flags [.], ack 345472, win 1838, options [nop,nop,TS val 2363698724 ecr 119414099], length 0
02:59:18.134082 IP karldrop.ssh > 198.211.111.194.51520: Flags [P.], seq 345472:345856, ack 1121, win 501, options [nop,nop,TS val 119414203 ecr 2363698724], length 384
02:59:18.154351 IP 198.211.111.194.51520 > karldrop.ssh: Flags [.], ack 345856, win 1838, options [nop,nop,TS val 2363698826 ecr 119414203], length 0
02:59:18.238149 IP karldrop.ssh > 198.211.111.194.51520: Flags [P.], seq 345856:346240, ack 1121, win 501, options [nop,nop,TS val 119414307 ecr 2363698826], length 384
02:59:18.257657 IP 198.211.111.194.51520 > karldrop.ssh: Flags [.], ack 346240, win 1838, options [nop,nop,TS val 2363698929 ecr 119414307], length 0
02:59:18.342094 IP karldrop.ssh > 198.211.111.194.51520: Flags [P.], seq 346240:346624, ack 1121, win 501, options [nop,nop,TS val 119414411 ecr 2363698929], length 384
02:59:18.362775 IP 198.211.111.194.51520 > karldrop.ssh: Flags [.], ack 346624, win 1838, options [nop,nop,TS val 2363699034 ecr 119414411], length 0
02:59:18.446117 IP karldrop.ssh > 198.211.111.194.51520: Flags [P.], seq 346624:347008, ack 1121, win 501, options [nop,nop,TS val 119414515 ecr 2363699034], length 384
02:59:18.469207 IP 198.211.111.194.51520 > karldrop.ssh: Flags [.], ack 347008, win 1838, options [nop,nop,TS val 2363699140 ecr 119414515], length 0
02:59:18.550121 IP karldrop.ssh > 198.211.111.194.51520: Flags [P.], seq 347008:347392, ack 1121, win 501, options [nop,nop,TS val 119414619 ecr 2363699140], length 384
02:59:18.567160 IP 198.211.111.194.51520 > karldrop.ssh: Flags [.], ack 347392, win 1838, options [nop,nop,TS val 2363699238 ecr 119414619], length 0
02:59:18.654097 IP karldrop.ssh > 198.211.111.194.51520: Flags [P.], seq 347392:347776, ack 1121, win 501, options [nop,nop,TS val 119414723 ecr 2363699238], length 384
02:59:18.671414 IP 198.211.111.194.51520 > karldrop.ssh: Flags [.], ack 347776, win 1838, options [nop,nop,TS val 2363699343 ecr 119414723], length 0
02:59:18.758121 IP karldrop.ssh > 198.211.111.194.51520: Flags [P.], seq 347776:348160, ack 1121, win 501, options [nop,nop,TS val 119414827 ecr 2363699343], length 384
02:59:18.776884 IP 198.211.111.194.51520 > karldrop.ssh: Flags [.], ack 348160, win 1838, options [nop,nop,TS val 2363699448 ecr 119414827], length 0
02:59:18.862101 IP karldrop.ssh > 198.211.111.194.51520: Flags [P.], seq 348160:348544, ack 1121, win 501, options [nop,nop,TS val 119414931 ecr 2363699448], length 384
02:59:18.879837 IP 198.211.111.194.51520 > karldrop.ssh: Flags [.], ack 348544, win 1838, options [nop,nop,TS val 2363699551 ecr 119414931], length 0
02:59:18.966073 IP karldrop.ssh > 198.211.111.194.51520: Flags [P.], seq 348544:348928, ack 1121, win 501, options [nop,nop,TS val 119415035 ecr 2363699551], length 384
02:59:18.986620 IP 198.211.111.194.51520 > karldrop.ssh: Flags [.], ack 348928, win 1838, options [nop,nop,TS val 2363699658 ecr 119415035], length 0
02:59:19.070089 IP karldrop.ssh > 198.211.111.194.51520: Flags [P.], seq 348928:349312, ack 1121, win 501, options [nop,nop,TS val 119415139 ecr 2363699658], length 384
02:59:19.091618 IP 198.211.111.194.51520 > karldrop.ssh: Flags [.], ack 349312, win 1838, options [nop,nop,TS val 2363699763 ecr 119415139], length 0
02:59:19.174101 IP karldrop.ssh > 198.211.111.194.51520: Flags [P.], seq 349312:349696, ack 1121, win 501, options [nop,nop,TS val 119415243 ecr 2363699763], length 384
02:59:19.190555 IP 198.211.111.194.51520 > karldrop.ssh: Flags [.], ack 349696, win 1838, options [nop,nop,TS val 2363699862 ecr 119415243], length 0
02:59:19.278169 IP karldrop.ssh > 198.211.111.194.51520: Flags [P.], seq 349696:350080, ack 1121, win 501, options [nop,nop,TS val 119415347 ecr 2363699862], length 384
02:59:19.296806 IP 198.211.111.194.51520 > karldrop.ssh: Flags [.], ack 350080, win 1838, options [nop,nop,TS val 2363699968 ecr 119415347], length 0
02:59:19.382116 IP karldrop.ssh > 198.211.111.194.51520: Flags [P.], seq 350080:350464, ack 1121, win 501, options [nop,nop,TS val 119415451 ecr 2363699968], length 384
02:59:19.399601 IP pool-184-17-207-134.ftwy.in.frontiernet.net.61156 > karldrop.49300: Flags [S], seq 82539516, win 64240, options [mss 1460,nop,wscale 8,nop,nop,sackOK], length 0
02:59:19.399602 IP 198.211.111.194.51520 > karldrop.ssh: Flags [.], ack 350464, win 1838, options [nop,nop,TS val 2363700071 ecr 119415451], length 0
02:59:19.486169 IP karldrop.ssh > 198.211.111.194.51520: Flags [P.], seq 350464:350688, ack 1121, win 501, options [nop,nop,TS val 119415555 ecr 2363700071], length 224
02:59:19.486462 IP karldrop.45993 > 67.207.67.2.domain: 12107+ [1au] PTR? 134.207.17.184.in-addr.arpa. (56)
02:59:19.486542 IP karldrop.39794 > 67.207.67.2.domain: 56433+ [1au] PTR? 134.207.17.184.in-addr.arpa. (56)
02:59:19.486580 IP karldrop.33890 > 67.207.67.3.domain: Flags [S], seq 1007397061, win 64240, options [mss 1460,sackOK,TS val 99353270 ecr 0,nop,wscale 7,tfo  cookiereq,nop,nop], length 0
02:59:19.489058 IP 67.207.67.3.domain > karldrop.33890: Flags [S.], seq 3473812915, ack 1007397062, win 65160, options [mss 1460,sackOK,TS val 1128997537 ecr 99353270,nop,wscale 9], length 0
02:59:19.489118 IP karldrop.33890 > 67.207.67.3.domain: Flags [.], ack 1, win 502, options [nop,nop,TS val 99353273 ecr 1128997537], length 0
02:59:19.489170 IP karldrop.33890 > 67.207.67.3.domain: Flags [P.], seq 1:48, ack 1, win 502, options [nop,nop,TS val 99353273 ecr 1128997537], length 47 60104+ PTR? 134.207.17.184.in-addr.arpa. (45)
02:59:19.490389 IP 67.207.67.3.domain > karldrop.33890: Flags [.], ack 48, win 128, options [nop,nop,TS val 1128997539 ecr 99353273], length 0
02:59:19.502444 IP 198.211.111.194.51520 > karldrop.ssh: Flags [.], ack 350688, win 1838, options [nop,nop,TS val 2363700174 ecr 119415555], length 0
02:59:19.535789 IP 67.207.67.3.domain > karldrop.33890: Flags [P.], seq 1:105, ack 48, win 128, options [nop,nop,TS val 1128997584 ecr 99353273], length 104 60104 1/0/0 PTR pool-184-17-207-134.ftwy.in.frontiernet.net. (102)
02:59:19.535834 IP karldrop.33890 > 67.207.67.3.domain: Flags [.], ack 105, win 502, options [nop,nop,TS val 99353320 ecr 1128997584], length 0
02:59:19.536077 IP 67.207.67.2.domain > karldrop.45993: 12107 1/0/1 PTR pool-184-17-207-134.ftwy.in.frontiernet.net. (113)
02:59:19.536303 IP karldrop.ssh > 198.211.111.194.51520: Flags [P.], seq 350688:351072, ack 1121, win 501, options [nop,nop,TS val 119415605 ecr 2363700174], length 384
02:59:19.540605 IP 67.207.67.2.domain > karldrop.39794: 56433 1/0/1 PTR pool-184-17-207-134.ftwy.in.frontiernet.net. (113)
02:59:19.558074 IP 198.211.111.194.51520 > karldrop.ssh: Flags [.], ack 351072, win 1838, options [nop,nop,TS val 2363700229 ecr 119415605], length 0
02:59:19.590218 IP karldrop.ssh > 198.211.111.194.51520: Flags [P.], seq 351072:353472, ack 1121, win 501, options [nop,nop,TS val 119415659 ecr 2363700229], length 2400
02:59:19.604968 IP 198.211.111.194.51520 > karldrop.ssh: Flags [.], ack 353472, win 1828, options [nop,nop,TS val 2363700276 ecr 119415659], length 0
02:59:19.694294 IP karldrop.ssh > 198.211.111.194.51520: Flags [P.], seq 353472:353856, ack 1121, win 501, options [nop,nop,TS val 119415763 ecr 2363700276], length 384
02:59:19.716869 IP 198.211.111.194.51520 > karldrop.ssh: Flags [.], ack 353856, win 1838, options [nop,nop,TS val 2363700388 ecr 119415763], length 0
02:59:19.798206 IP karldrop.ssh > 198.211.111.194.51520: Flags [P.], seq 353856:354240, ack 1121, win 501, options [nop,nop,TS val 119415867 ecr 2363700388], length 384
02:59:19.820094 IP 198.211.111.194.51520 > karldrop.ssh: Flags [.], ack 354240, win 1838, options [nop,nop,TS val 2363700491 ecr 119415867], length 0
02:59:19.902141 IP karldrop.ssh > 198.211.111.194.51520: Flags [P.], seq 354240:354624, ack 1121, win 501, options [nop,nop,TS val 119415971 ecr 2363700491], length 384
02:59:19.922862 IP 198.211.111.194.51520 > karldrop.ssh: Flags [.], ack 354624, win 1838, options [nop,nop,TS val 2363700594 ecr 119415971], length 0
02:59:20.006086 IP karldrop.ssh > 198.211.111.194.51520: Flags [P.], seq 354624:355008, ack 1121, win 501, options [nop,nop,TS val 119416075 ecr 2363700594], length 384
02:59:20.024356 IP 198.211.111.194.51520 > karldrop.ssh: Flags [.], ack 355008, win 1838, options [nop,nop,TS val 2363700696 ecr 119416075], length 0
02:59:20.110055 IP karldrop.ssh > 198.211.111.194.51520: Flags [P.], seq 355008:355392, ack 1121, win 501, options [nop,nop,TS val 119416179 ecr 2363700696], length 384
02:59:20.131234 IP 198.211.111.194.51520 > karldrop.ssh: Flags [.], ack 355392, win 1838, options [nop,nop,TS val 2363700802 ecr 119416179], length 0
02:59:20.214111 IP karldrop.ssh > 198.211.111.194.51520: Flags [P.], seq 355392:355776, ack 1121, win 501, options [nop,nop,TS val 119416283 ecr 2363700802], length 384
02:59:20.234721 IP 198.211.111.194.51520 > karldrop.ssh: Flags [.], ack 355776, win 1838, options [nop,nop,TS val 2363700906 ecr 119416283], length 0
02:59:20.318119 IP karldrop.ssh > 198.211.111.194.51520: Flags [P.], seq 355776:356160, ack 1121, win 501, options [nop,nop,TS val 119416387 ecr 2363700906], length 384
02:59:20.335556 IP 198.211.111.194.51520 > karldrop.ssh: Flags [.], ack 356160, win 1838, options [nop,nop,TS val 2363701007 ecr 119416387], length 0
02:59:20.422109 IP karldrop.ssh > 198.211.111.194.51520: Flags [P.], seq 356160:356544, ack 1121, win 501, options [nop,nop,TS val 119416491 ecr 2363701007], length 384
02:59:20.443407 IP 198.211.111.194.51520 > karldrop.ssh: Flags [.], ack 356544, win 1838, options [nop,nop,TS val 2363701115 ecr 119416491], length 0
02:59:20.526051 IP karldrop.ssh > 198.211.111.194.51520: Flags [P.], seq 356544:356928, ack 1121, win 501, options [nop,nop,TS val 119416595 ecr 2363701115], length 384
02:59:20.548909 IP 198.211.111.194.51520 > karldrop.ssh: Flags [.], ack 356928, win 1838, options [nop,nop,TS val 2363701220 ecr 119416595], length 0
02:59:20.630086 IP karldrop.ssh > 198.211.111.194.51520: Flags [P.], seq 356928:357312, ack 1121, win 501, options [nop,nop,TS val 119416699 ecr 2363701220], length 384
02:59:20.651491 IP 198.211.111.194.51520 > karldrop.ssh: Flags [.], ack 357312, win 1838, options [nop,nop,TS val 2363701323 ecr 119416699], length 0
02:59:20.734090 IP karldrop.ssh > 198.211.111.194.51520: Flags [P.], seq 357312:357696, ack 1121, win 501, options [nop,nop,TS val 119416803 ecr 2363701323], length 384
02:59:20.754435 IP 198.211.111.194.51520 > karldrop.ssh: Flags [.], ack 357696, win 1838, options [nop,nop,TS val 2363701426 ecr 119416803], length 0
02:59:20.838129 IP karldrop.ssh > 198.211.111.194.51520: Flags [P.], seq 357696:358080, ack 1121, win 501, options [nop,nop,TS val 119416907 ecr 2363701426], length 384
02:59:20.859668 IP 198.211.111.194.51520 > karldrop.ssh: Flags [.], ack 358080, win 1838, options [nop,nop,TS val 2363701531 ecr 119416907], length 0
02:59:20.942097 IP karldrop.ssh > 198.211.111.194.51520: Flags [P.], seq 358080:358464, ack 1121, win 501, options [nop,nop,TS val 119417011 ecr 2363701531], length 384
02:59:20.962961 IP 198.211.111.194.51520 > karldrop.ssh: Flags [.], ack 358464, win 1838, options [nop,nop,TS val 2363701634 ecr 119417011], length 0
02:59:21.046098 IP karldrop.ssh > 198.211.111.194.51520: Flags [P.], seq 358464:358848, ack 1121, win 501, options [nop,nop,TS val 119417115 ecr 2363701634], length 384
02:59:21.051569 IP karldrop.ssh > 129.151.44.205.32790: Flags [P.], seq 1738:1790, ack 1199, win 502, options [nop,nop,TS val 3291021992 ecr 2159586592], length 52
02:59:21.066345 IP 198.211.111.194.51520 > karldrop.ssh: Flags [.], ack 358848, win 1838, options [nop,nop,TS val 2363701738 ecr 119417115], length 0
02:59:21.150121 IP karldrop.ssh > 198.211.111.194.51520: Flags [P.], seq 358848:359392, ack 1121, win 501, options [nop,nop,TS val 119417219 ecr 2363701738], length 544
02:59:21.173841 IP 198.211.111.194.51520 > karldrop.ssh: Flags [.], ack 359392, win 1838, options [nop,nop,TS val 2363701845 ecr 119417219], length 0
02:59:21.252409 IP 129.151.44.205.32790 > karldrop.ssh: Flags [P.], seq 1199:1251, ack 1790, win 478, options [nop,nop,TS val 2159590808 ecr 3291021992], length 52
02:59:21.252409 IP 129.151.44.205.32790 > karldrop.ssh: Flags [F.], seq 1251, ack 1790, win 478, options [nop,nop,TS val 2159590808 ecr 3291021992], length 0
02:59:21.252461 IP karldrop.ssh > 129.151.44.205.32790: Flags [.], ack 1251, win 502, options [nop,nop,TS val 3291022193 ecr 2159590808], length 0
02:59:21.254029 IP karldrop.ssh > 198.211.111.194.51520: Flags [P.], seq 359392:360240, ack 1121, win 501, options [nop,nop,TS val 119417323 ecr 2363701845], length 848
02:59:21.254880 IP karldrop.ssh > 129.151.44.205.32790: Flags [F.], seq 1790, ack 1252, win 502, options [nop,nop,TS val 3291022196 ecr 2159590808], length 0
02:59:21.276459 IP 198.211.111.194.51520 > karldrop.ssh: Flags [.], ack 360240, win 1838, options [nop,nop,TS val 2363701948 ecr 119417323], length 0
02:59:21.358188 IP karldrop.ssh > 198.211.111.194.51520: Flags [P.], seq 360240:360784, ack 1121, win 501, options [nop,nop,TS val 119417427 ecr 2363701948], length 544
02:59:21.382439 IP 198.211.111.194.51520 > karldrop.ssh: Flags [.], ack 360784, win 1838, options [nop,nop,TS val 2363702054 ecr 119417427], length 0
02:59:21.455601 IP 129.151.44.205.32790 > karldrop.ssh: Flags [.], ack 1791, win 478, options [nop,nop,TS val 2159591011 ecr 3291022196], length 0
02:59:21.462111 IP karldrop.ssh > 198.211.111.194.51520: Flags [P.], seq 360784:361312, ack 1121, win 501, options [nop,nop,TS val 119417531 ecr 2363702054], length 528
02:59:21.481556 IP 198.211.111.194.51520 > karldrop.ssh: Flags [.], ack 361312, win 1838, options [nop,nop,TS val 2363702153 ecr 119417531], length 0
02:59:21.566164 IP karldrop.ssh > 198.211.111.194.51520: Flags [P.], seq 361312:361696, ack 1121, win 501, options [nop,nop,TS val 119417635 ecr 2363702153], length 384
02:59:21.587354 IP 198.211.111.194.51520 > karldrop.ssh: Flags [.], ack 361696, win 1838, options [nop,nop,TS val 2363702259 ecr 119417635], length 0
02:59:21.670115 IP karldrop.ssh > 198.211.111.194.51520: Flags [P.], seq 361696:362080, ack 1121, win 501, options [nop,nop,TS val 119417739 ecr 2363702259], length 384
02:59:21.690727 IP 198.211.111.194.51520 > karldrop.ssh: Flags [.], ack 362080, win 1838, options [nop,nop,TS val 2363702362 ecr 119417739], length 0
02:59:21.774105 IP karldrop.ssh > 198.211.111.194.51520: Flags [P.], seq 362080:362464, ack 1121, win 501, options [nop,nop,TS val 119417843 ecr 2363702362], length 384
02:59:21.791748 IP 198.211.111.194.51520 > karldrop.ssh: Flags [.], ack 362464, win 1838, options [nop,nop,TS val 2363702463 ecr 119417843], length 0
02:59:21.842771 IP hosted-by.pfcloud.io.45639 > karldrop.8787: Flags [S], seq 1088165216, win 1024, length 0
02:59:21.878214 IP karldrop.ssh > 198.211.111.194.51520: Flags [P.], seq 362464:362848, ack 1121, win 501, options [nop,nop,TS val 119417947 ecr 2363702463], length 384
02:59:21.878482 IP karldrop.43402 > 67.207.67.2.domain: 61053+ [1au] PTR? 245.51.54.84.in-addr.arpa. (54)
02:59:21.878568 IP karldrop.35945 > 67.207.67.2.domain: 62766+ [1au] PTR? 245.51.54.84.in-addr.arpa. (54)
02:59:21.878610 IP karldrop.33890 > 67.207.67.3.domain: Flags [P.], seq 48:93, ack 105, win 502, options [nop,nop,TS val 99355662 ecr 1128997584], length 45 209+ PTR? 245.51.54.84.in-addr.arpa. (43)
02:59:21.879876 IP 67.207.67.3.domain > karldrop.33890: Flags [.], ack 93, win 128, options [nop,nop,TS val 1128999928 ecr 99355662], length 0
02:59:21.898762 IP 198.211.111.194.51520 > karldrop.ssh: Flags [.], ack 362848, win 1838, options [nop,nop,TS val 2363702570 ecr 119417947], length 0
02:59:21.979798 IP 67.207.67.2.domain > karldrop.43402: 61053 1/0/1 PTR hosted-by.pfcloud.io. (88)
02:59:21.979860 IP 67.207.67.3.domain > karldrop.33890: Flags [P.], seq 105:184, ack 93, win 128, options [nop,nop,TS val 1129000028 ecr 99355662], length 79 209 1/0/0 PTR hosted-by.pfcloud.io. (77)
02:59:21.979889 IP karldrop.33890 > 67.207.67.3.domain: Flags [.], ack 184, win 502, options [nop,nop,TS val 99355764 ecr 1129000028], length 0
02:59:21.980305 IP karldrop.ssh > 198.211.111.194.51520: Flags [P.], seq 362848:363008, ack 1121, win 501, options [nop,nop,TS val 119418049 ecr 2363702570], length 160
02:59:21.982150 IP karldrop.ssh > 198.211.111.194.51520: Flags [P.], seq 363008:364560, ack 1121, win 501, options [nop,nop,TS val 119418051 ecr 2363702570], length 1552
02:59:21.988009 IP 67.207.67.2.domain > karldrop.35945: 62766 1/0/1 PTR hosted-by.pfcloud.io. (88)
02:59:21.995062 IP 198.211.111.194.51520 > karldrop.ssh: Flags [.], ack 363008, win 1839, options [nop,nop,TS val 2363702666 ecr 119418049], length 0
02:59:21.997034 IP 198.211.111.194.51520 > karldrop.ssh: Flags [.], ack 364560, win 1831, options [nop,nop,TS val 2363702668 ecr 119418051], length 0
02:59:22.086200 IP karldrop.ssh > 198.211.111.194.51520: Flags [P.], seq 364560:365184, ack 1121, win 501, options [nop,nop,TS val 119418155 ecr 2363702668], length 624
02:59:22.107094 IP 198.211.111.194.51520 > karldrop.ssh: Flags [.], ack 365184, win 1839, options [nop,nop,TS val 2363702777 ecr 119418155], length 0
02:59:22.190105 IP karldrop.ssh > 198.211.111.194.51520: Flags [P.], seq 365184:365568, ack 1121, win 501, options [nop,nop,TS val 119418259 ecr 2363702777], length 384
02:59:22.207533 IP 198.211.111.194.51520 > karldrop.ssh: Flags [.], ack 365568, win 1839, options [nop,nop,TS val 2363702879 ecr 119418259], length 0
02:59:22.294072 IP karldrop.ssh > 198.211.111.194.51520: Flags [P.], seq 365568:365952, ack 1121, win 501, options [nop,nop,TS val 119418363 ecr 2363702879], length 384
02:59:22.314720 IP 198.211.111.194.51520 > karldrop.ssh: Flags [.], ack 365952, win 1839, options [nop,nop,TS val 2363702986 ecr 119418363], length 0
02:59:22.398127 IP karldrop.ssh > 198.211.111.194.51520: Flags [P.], seq 365952:366336, ack 1121, win 501, options [nop,nop,TS val 119418467 ecr 2363702986], length 384
02:59:22.415934 IP 198.211.111.194.51520 > karldrop.ssh: Flags [.], ack 366336, win 1839, options [nop,nop,TS val 2363703087 ecr 119418467], length 0
02:59:22.502141 IP karldrop.ssh > 198.211.111.194.51520: Flags [P.], seq 366336:366720, ack 1121, win 501, options [nop,nop,TS val 119418571 ecr 2363703087], length 384
02:59:22.519457 IP 198.211.111.194.51520 > karldrop.ssh: Flags [.], ack 366720, win 1839, options [nop,nop,TS val 2363703191 ecr 119418571], length 0
02:59:22.606130 IP karldrop.ssh > 198.211.111.194.51520: Flags [P.], seq 366720:367104, ack 1121, win 501, options [nop,nop,TS val 119418675 ecr 2363703191], length 384
02:59:22.627737 IP 198.211.111.194.51520 > karldrop.ssh: Flags [.], ack 367104, win 1839, options [nop,nop,TS val 2363703299 ecr 119418675], length 0
02:59:22.710102 IP karldrop.ssh > 198.211.111.194.51520: Flags [P.], seq 367104:367488, ack 1121, win 501, options [nop,nop,TS val 119418779 ecr 2363703299], length 384
02:59:22.732390 IP 198.211.111.194.51520 > karldrop.ssh: Flags [.], ack 367488, win 1839, options [nop,nop,TS val 2363703404 ecr 119418779], length 0
02:59:22.814090 IP karldrop.ssh > 198.211.111.194.51520: Flags [P.], seq 367488:367872, ack 1121, win 501, options [nop,nop,TS val 119418883 ecr 2363703404], length 384
02:59:22.834819 IP 198.211.111.194.51520 > karldrop.ssh: Flags [.], ack 367872, win 1839, options [nop,nop,TS val 2363703506 ecr 119418883], length 0
02:59:22.918157 IP karldrop.ssh > 198.211.111.194.51520: Flags [P.], seq 367872:368256, ack 1121, win 501, options [nop,nop,TS val 119418987 ecr 2363703506], length 384
02:59:22.938632 IP 198.211.111.194.51520 > karldrop.ssh: Flags [.], ack 368256, win 1839, options [nop,nop,TS val 2363703610 ecr 119418987], length 0
02:59:23.022101 IP karldrop.ssh > 198.211.111.194.51520: Flags [P.], seq 368256:368640, ack 1121, win 501, options [nop,nop,TS val 119419091 ecr 2363703610], length 384
02:59:23.039008 IP 198.211.111.194.51520 > karldrop.ssh: Flags [.], ack 368640, win 1839, options [nop,nop,TS val 2363703710 ecr 119419091], length 0
02:59:23.126129 IP karldrop.ssh > 198.211.111.194.51520: Flags [P.], seq 368640:369024, ack 1121, win 501, options [nop,nop,TS val 119419195 ecr 2363703710], length 384
02:59:23.148141 IP 198.211.111.194.51520 > karldrop.ssh: Flags [.], ack 369024, win 1839, options [nop,nop,TS val 2363703819 ecr 119419195], length 0
02:59:23.230093 IP karldrop.ssh > 198.211.111.194.51520: Flags [P.], seq 369024:369408, ack 1121, win 501, options [nop,nop,TS val 119419299 ecr 2363703819], length 384
02:59:23.250554 IP 198.211.111.194.51520 > karldrop.ssh: Flags [.], ack 369408, win 1839, options [nop,nop,TS val 2363703922 ecr 119419299], length 0
02:59:23.334178 IP karldrop.ssh > 198.211.111.194.51520: Flags [P.], seq 369408:369792, ack 1121, win 501, options [nop,nop,TS val 119419403 ecr 2363703922], length 384
02:59:23.354045 IP 198.211.111.194.51520 > karldrop.ssh: Flags [.], ack 369792, win 1839, options [nop,nop,TS val 2363704025 ecr 119419403], length 0
02:59:23.438149 IP karldrop.ssh > 198.211.111.194.51520: Flags [P.], seq 369792:370176, ack 1121, win 501, options [nop,nop,TS val 119419507 ecr 2363704025], length 384
02:59:23.458872 IP 198.211.111.194.51520 > karldrop.ssh: Flags [.], ack 370176, win 1839, options [nop,nop,TS val 2363704130 ecr 119419507], length 0
02:59:23.542163 IP karldrop.ssh > 198.211.111.194.51520: Flags [P.], seq 370176:370560, ack 1121, win 501, options [nop,nop,TS val 119419611 ecr 2363704130], length 384
02:59:23.559540 IP 198.211.111.194.51520 > karldrop.ssh: Flags [.], ack 370560, win 1839, options [nop,nop,TS val 2363704231 ecr 119419611], length 0
02:59:23.646159 IP karldrop.ssh > 198.211.111.194.51520: Flags [P.], seq 370560:370944, ack 1121, win 501, options [nop,nop,TS val 119419715 ecr 2363704231], length 384
02:59:23.667192 IP 198.211.111.194.51520 > karldrop.ssh: Flags [.], ack 370944, win 1839, options [nop,nop,TS val 2363704338 ecr 119419715], length 0
02:59:23.750161 IP karldrop.ssh > 198.211.111.194.51520: Flags [P.], seq 370944:371328, ack 1121, win 501, options [nop,nop,TS val 119419819 ecr 2363704338], length 384
02:59:23.771321 IP 198.211.111.194.51520 > karldrop.ssh: Flags [.], ack 371328, win 1839, options [nop,nop,TS val 2363704443 ecr 119419819], length 0
02:59:23.854143 IP karldrop.ssh > 198.211.111.194.51520: Flags [P.], seq 371328:371712, ack 1121, win 501, options [nop,nop,TS val 119419923 ecr 2363704443], length 384
02:59:23.874930 IP 198.211.111.194.51520 > karldrop.ssh: Flags [.], ack 371712, win 1839, options [nop,nop,TS val 2363704546 ecr 119419923], length 0
02:59:23.958113 IP karldrop.ssh > 198.211.111.194.51520: Flags [P.], seq 371712:372096, ack 1121, win 501, options [nop,nop,TS val 119420027 ecr 2363704546], length 384
02:59:23.979248 IP 198.211.111.194.51520 > karldrop.ssh: Flags [.], ack 372096, win 1839, options [nop,nop,TS val 2363704650 ecr 119420027], length 0
02:59:24.062146 IP karldrop.ssh > 198.211.111.194.51520: Flags [P.], seq 372096:372480, ack 1121, win 501, options [nop,nop,TS val 119420131 ecr 2363704650], length 384
02:59:24.082289 IP 198.211.111.194.51520 > karldrop.ssh: Flags [.], ack 372480, win 1839, options [nop,nop,TS val 2363704753 ecr 119420131], length 0
02:59:24.166157 IP karldrop.ssh > 198.211.111.194.51520: Flags [P.], seq 372480:372864, ack 1121, win 501, options [nop,nop,TS val 119420235 ecr 2363704753], length 384
02:59:24.183740 IP 198.211.111.194.51520 > karldrop.ssh: Flags [.], ack 372864, win 1839, options [nop,nop,TS val 2363704855 ecr 119420235], length 0
02:59:24.239903 IP 67.207.67.3.domain > karldrop.33890: Flags [F.], seq 184, ack 93, win 128, options [nop,nop,TS val 1129002288 ecr 99355764], length 0
02:59:24.240034 IP karldrop.33890 > 67.207.67.3.domain: Flags [F.], seq 93, ack 185, win 502, options [nop,nop,TS val 99358024 ecr 1129002288], length 0
02:59:24.241311 IP 67.207.67.3.domain > karldrop.33890: Flags [.], ack 94, win 128, options [nop,nop,TS val 1129002289 ecr 99358024], length 0
02:59:24.270119 IP karldrop.ssh > 198.211.111.194.51520: Flags [P.], seq 372864:373696, ack 1121, win 501, options [nop,nop,TS val 119420339 ecr 2363704855], length 832
02:59:24.299826 IP 198.211.111.194.51520 > karldrop.ssh: Flags [.], ack 373696, win 1839, options [nop,nop,TS val 2363704971 ecr 119420339], length 0
02:59:24.374091 IP karldrop.ssh > 198.211.111.194.51520: Flags [P.], seq 373696:374080, ack 1121, win 501, options [nop,nop,TS val 119420443 ecr 2363704971], length 384
02:59:24.393295 IP 198.211.111.194.51520 > karldrop.ssh: Flags [.], ack 374080, win 1839, options [nop,nop,TS val 2363705065 ecr 119420443], length 0
02:59:24.478057 IP karldrop.ssh > 198.211.111.194.51520: Flags [P.], seq 374080:374464, ack 1121, win 501, options [nop,nop,TS val 119420547 ecr 2363705065], length 384
02:59:24.498593 IP 198.211.111.194.51520 > karldrop.ssh: Flags [.], ack 374464, win 1839, options [nop,nop,TS val 2363705170 ecr 119420547], length 0
02:59:24.582116 IP karldrop.ssh > 198.211.111.194.51520: Flags [P.], seq 374464:374848, ack 1121, win 501, options [nop,nop,TS val 119420651 ecr 2363705170], length 384
02:59:24.603322 IP 198.211.111.194.51520 > karldrop.ssh: Flags [.], ack 374848, win 1839, options [nop,nop,TS val 2363705275 ecr 119420651], length 0
02:59:24.686166 IP karldrop.ssh > 198.211.111.194.51520: Flags [P.], seq 374848:375232, ack 1121, win 501, options [nop,nop,TS val 119420755 ecr 2363705275], length 384
02:59:24.702922 IP 198.211.111.194.51520 > karldrop.ssh: Flags [.], ack 375232, win 1839, options [nop,nop,TS val 2363705374 ecr 119420755], length 0
02:59:24.790122 IP karldrop.ssh > 198.211.111.194.51520: Flags [P.], seq 375232:375616, ack 1121, win 501, options [nop,nop,TS val 119420859 ecr 2363705374], length 384
02:59:24.811737 IP 198.211.111.194.51520 > karldrop.ssh: Flags [.], ack 375616, win 1839, options [nop,nop,TS val 2363705483 ecr 119420859], length 0
02:59:24.894085 IP karldrop.ssh > 198.211.111.194.51520: Flags [P.], seq 375616:376000, ack 1121, win 501, options [nop,nop,TS val 119420963 ecr 2363705483], length 384
02:59:24.914054 IP 198.211.111.194.51520 > karldrop.ssh: Flags [.], ack 376000, win 1839, options [nop,nop,TS val 2363705585 ecr 119420963], length 0
02:59:24.998235 IP karldrop.ssh > 198.211.111.194.51520: Flags [P.], seq 376000:376384, ack 1121, win 501, options [nop,nop,TS val 119421067 ecr 2363705585], length 384
02:59:25.018987 IP 198.211.111.194.51520 > karldrop.ssh: Flags [.], ack 376384, win 1839, options [nop,nop,TS val 2363705690 ecr 119421067], length 0
02:59:25.102105 IP karldrop.ssh > 198.211.111.194.51520: Flags [P.], seq 376384:376768, ack 1121, win 501, options [nop,nop,TS val 119421171 ecr 2363705690], length 384
02:59:25.123388 IP 198.211.111.194.51520 > karldrop.ssh: Flags [.], ack 376768, win 1839, options [nop,nop,TS val 2363705795 ecr 119421171], length 0
02:59:25.206078 IP karldrop.ssh > 198.211.111.194.51520: Flags [P.], seq 376768:377152, ack 1121, win 501, options [nop,nop,TS val 119421275 ecr 2363705795], length 384
02:59:25.224396 IP 198.211.111.194.51520 > karldrop.ssh: Flags [.], ack 377152, win 1839, options [nop,nop,TS val 2363705896 ecr 119421275], length 0
02:59:25.310155 IP karldrop.ssh > 198.211.111.194.51520: Flags [P.], seq 377152:377536, ack 1121, win 501, options [nop,nop,TS val 119421379 ecr 2363705896], length 384
02:59:25.327719 IP 198.211.111.194.51520 > karldrop.ssh: Flags [.], ack 377536, win 1839, options [nop,nop,TS val 2363705999 ecr 119421379], length 0
02:59:25.414113 IP karldrop.ssh > 198.211.111.194.51520: Flags [P.], seq 377536:377920, ack 1121, win 501, options [nop,nop,TS val 119421483 ecr 2363705999], length 384
02:59:25.430491 IP 198.211.111.194.51520 > karldrop.ssh: Flags [.], ack 377920, win 1839, options [nop,nop,TS val 2363706102 ecr 119421483], length 0
02:59:25.518098 IP karldrop.ssh > 198.211.111.194.51520: Flags [P.], seq 377920:378304, ack 1121, win 501, options [nop,nop,TS val 119421587 ecr 2363706102], length 384
02:59:25.536052 IP 198.211.111.194.51520 > karldrop.ssh: Flags [.], ack 378304, win 1839, options [nop,nop,TS val 2363706207 ecr 119421587], length 0
02:59:25.622093 IP karldrop.ssh > 198.211.111.194.51520: Flags [P.], seq 378304:378688, ack 1121, win 501, options [nop,nop,TS val 119421691 ecr 2363706207], length 384
02:59:25.641200 IP 198.211.111.194.51520 > karldrop.ssh: Flags [.], ack 378688, win 1839, options [nop,nop,TS val 2363706312 ecr 119421691], length 0
02:59:25.726107 IP karldrop.ssh > 198.211.111.194.51520: Flags [P.], seq 378688:379072, ack 1121, win 501, options [nop,nop,TS val 119421795 ecr 2363706312], length 384
02:59:25.747763 IP 198.211.111.194.51520 > karldrop.ssh: Flags [.], ack 379072, win 1839, options [nop,nop,TS val 2363706419 ecr 119421795], length 0
02:59:25.830148 IP karldrop.ssh > 198.211.111.194.51520: Flags [P.], seq 379072:379456, ack 1121, win 501, options [nop,nop,TS val 119421899 ecr 2363706419], length 384
02:59:25.850608 IP 198.211.111.194.51520 > karldrop.ssh: Flags [.], ack 379456, win 1839, options [nop,nop,TS val 2363706522 ecr 119421899], length 0
02:59:25.934117 IP karldrop.ssh > 198.211.111.194.51520: Flags [P.], seq 379456:379840, ack 1121, win 501, options [nop,nop,TS val 119422003 ecr 2363706522], length 384
02:59:25.955364 IP 198.211.111.194.51520 > karldrop.ssh: Flags [.], ack 379840, win 1839, options [nop,nop,TS val 2363706627 ecr 119422003], length 0
02:59:26.038123 IP karldrop.ssh > 198.211.111.194.51520: Flags [P.], seq 379840:380224, ack 1121, win 501, options [nop,nop,TS val 119422107 ecr 2363706627], length 384
02:59:26.059930 IP 198.211.111.194.51520 > karldrop.ssh: Flags [.], ack 380224, win 1839, options [nop,nop,TS val 2363706731 ecr 119422107], length 0
02:59:26.142139 IP karldrop.ssh > 198.211.111.194.51520: Flags [P.], seq 380224:380608, ack 1121, win 501, options [nop,nop,TS val 119422211 ecr 2363706731], length 384
02:59:26.162657 IP 198.211.111.194.51520 > karldrop.ssh: Flags [.], ack 380608, win 1839, options [nop,nop,TS val 2363706834 ecr 119422211], length 0
02:59:26.246087 IP karldrop.ssh > 198.211.111.194.51520: Flags [P.], seq 380608:380992, ack 1121, win 501, options [nop,nop,TS val 119422315 ecr 2363706834], length 384
02:59:26.266814 IP 198.211.111.194.51520 > karldrop.ssh: Flags [.], ack 380992, win 1839, options [nop,nop,TS val 2363706938 ecr 119422315], length 0
02:59:26.350157 IP karldrop.ssh > 198.211.111.194.51520: Flags [P.], seq 380992:381376, ack 1121, win 501, options [nop,nop,TS val 119422419 ecr 2363706938], length 384
02:59:26.370919 IP 198.211.111.194.51520 > karldrop.ssh: Flags [.], ack 381376, win 1839, options [nop,nop,TS val 2363707042 ecr 119422419], length 0
02:59:26.454127 IP karldrop.ssh > 198.211.111.194.51520: Flags [P.], seq 381376:381760, ack 1121, win 501, options [nop,nop,TS val 119422523 ecr 2363707042], length 384
02:59:26.476045 IP 198.211.111.194.51520 > karldrop.ssh: Flags [.], ack 381760, win 1839, options [nop,nop,TS val 2363707147 ecr 119422523], length 0
02:59:26.558150 IP karldrop.ssh > 198.211.111.194.51520: Flags [P.], seq 381760:382144, ack 1121, win 501, options [nop,nop,TS val 119422627 ecr 2363707147], length 384
02:59:26.580059 IP 198.211.111.194.51520 > karldrop.ssh: Flags [.], ack 382144, win 1839, options [nop,nop,TS val 2363707251 ecr 119422627], length 0
02:59:26.662068 IP karldrop.ssh > 198.211.111.194.51520: Flags [P.], seq 382144:382528, ack 1121, win 501, options [nop,nop,TS val 119422731 ecr 2363707251], length 384
02:59:26.679547 IP 198.211.111.194.51520 > karldrop.ssh: Flags [.], ack 382528, win 1839, options [nop,nop,TS val 2363707351 ecr 119422731], length 0
02:59:26.766107 IP karldrop.ssh > 198.211.111.194.51520: Flags [P.], seq 382528:382912, ack 1121, win 501, options [nop,nop,TS val 119422835 ecr 2363707351], length 384
02:59:26.786000 IP 198.211.111.194.51520 > karldrop.ssh: Flags [.], ack 382912, win 1839, options [nop,nop,TS val 2363707457 ecr 119422835], length 0
02:59:26.870127 IP karldrop.ssh > 198.211.111.194.51520: Flags [P.], seq 382912:383296, ack 1121, win 501, options [nop,nop,TS val 119422939 ecr 2363707457], length 384
02:59:26.889491 IP 198.211.111.194.51520 > karldrop.ssh: Flags [.], ack 383296, win 1839, options [nop,nop,TS val 2363707561 ecr 119422939], length 0
02:59:26.974143 IP karldrop.ssh > 198.211.111.194.51520: Flags [P.], seq 383296:383680, ack 1121, win 501, options [nop,nop,TS val 119423043 ecr 2363707561], length 384
02:59:26.993239 IP 198.211.111.194.51520 > karldrop.ssh: Flags [.], ack 383680, win 1839, options [nop,nop,TS val 2363707664 ecr 119423043], length 0
02:59:27.078157 IP karldrop.ssh > 198.211.111.194.51520: Flags [P.], seq 383680:384064, ack 1121, win 501, options [nop,nop,TS val 119423147 ecr 2363707664], length 384
02:59:27.099959 IP 198.211.111.194.51520 > karldrop.ssh: Flags [.], ack 384064, win 1839, options [nop,nop,TS val 2363707771 ecr 119423147], length 0
02:59:27.182099 IP karldrop.ssh > 198.211.111.194.51520: Flags [P.], seq 384064:384448, ack 1121, win 501, options [nop,nop,TS val 119423251 ecr 2363707771], length 384
02:59:27.203370 IP 198.211.111.194.51520 > karldrop.ssh: Flags [.], ack 384448, win 1839, options [nop,nop,TS val 2363707875 ecr 119423251], length 0
02:59:27.286158 IP karldrop.ssh > 198.211.111.194.51520: Flags [P.], seq 384448:384832, ack 1121, win 501, options [nop,nop,TS val 119423355 ecr 2363707875], length 384
02:59:27.304054 IP 198.211.111.194.51520 > karldrop.ssh: Flags [.], ack 384832, win 1839, options [nop,nop,TS val 2363707975 ecr 119423355], length 0
02:59:27.390160 IP karldrop.ssh > 198.211.111.194.51520: Flags [P.], seq 384832:385216, ack 1121, win 501, options [nop,nop,TS val 119423459 ecr 2363707975], length 384
02:59:27.410630 IP 198.211.111.194.51520 > karldrop.ssh: Flags [.], ack 385216, win 1839, options [nop,nop,TS val 2363708082 ecr 119423459], length 0
02:59:27.494139 IP karldrop.ssh > 198.211.111.194.51520: Flags [P.], seq 385216:385600, ack 1121, win 501, options [nop,nop,TS val 119423563 ecr 2363708082], length 384
02:59:27.514581 IP 198.211.111.194.51520 > karldrop.ssh: Flags [.], ack 385600, win 1839, options [nop,nop,TS val 2363708186 ecr 119423563], length 0
02:59:27.598153 IP karldrop.ssh > 198.211.111.194.51520: Flags [P.], seq 385600:385984, ack 1121, win 501, options [nop,nop,TS val 119423667 ecr 2363708186], length 384
02:59:27.615177 IP 198.211.111.194.51520 > karldrop.ssh: Flags [.], ack 385984, win 1839, options [nop,nop,TS val 2363708286 ecr 119423667], length 0
02:59:27.702092 IP karldrop.ssh > 198.211.111.194.51520: Flags [P.], seq 385984:386368, ack 1121, win 501, options [nop,nop,TS val 119423771 ecr 2363708286], length 384
02:59:27.718365 IP 198.211.111.194.51520 > karldrop.ssh: Flags [.], ack 386368, win 1839, options [nop,nop,TS val 2363708390 ecr 119423771], length 0
02:59:27.806076 IP karldrop.ssh > 198.211.111.194.51520: Flags [P.], seq 386368:386752, ack 1121, win 501, options [nop,nop,TS val 119423875 ecr 2363708390], length 384
02:59:27.825525 IP 198.211.111.194.51520 > karldrop.ssh: Flags [.], ack 386752, win 1839, options [nop,nop,TS val 2363708497 ecr 119423875], length 0
02:59:27.910092 IP karldrop.ssh > 198.211.111.194.51520: Flags [P.], seq 386752:387136, ack 1121, win 501, options [nop,nop,TS val 119423979 ecr 2363708497], length 384
02:59:27.928562 IP 198.211.111.194.51520 > karldrop.ssh: Flags [.], ack 387136, win 1839, options [nop,nop,TS val 2363708600 ecr 119423979], length 0
02:59:28.014104 IP karldrop.ssh > 198.211.111.194.51520: Flags [P.], seq 387136:387520, ack 1121, win 501, options [nop,nop,TS val 119424083 ecr 2363708600], length 384
02:59:28.034041 IP 198.211.111.194.51520 > karldrop.ssh: Flags [.], ack 387520, win 1839, options [nop,nop,TS val 2363708705 ecr 119424083], length 0
02:59:28.118091 IP karldrop.ssh > 198.211.111.194.51520: Flags [P.], seq 387520:387904, ack 1121, win 501, options [nop,nop,TS val 119424187 ecr 2363708705], length 384
02:59:28.138984 IP 198.211.111.194.51520 > karldrop.ssh: Flags [.], ack 387904, win 1839, options [nop,nop,TS val 2363708810 ecr 119424187], length 0
02:59:28.222189 IP karldrop.ssh > 198.211.111.194.51520: Flags [P.], seq 387904:388288, ack 1121, win 501, options [nop,nop,TS val 119424291 ecr 2363708810], length 384
02:59:28.248872 IP 198.211.111.194.51520 > karldrop.ssh: Flags [.], ack 388288, win 1839, options [nop,nop,TS val 2363708920 ecr 119424291], length 0
02:59:28.326149 IP karldrop.ssh > 198.211.111.194.51520: Flags [P.], seq 388288:388672, ack 1121, win 501, options [nop,nop,TS val 119424395 ecr 2363708920], length 384
02:59:28.346202 IP 198.211.111.194.51520 > karldrop.ssh: Flags [.], ack 388672, win 1839, options [nop,nop,TS val 2363709017 ecr 119424395], length 0
02:59:28.430180 IP karldrop.ssh > 198.211.111.194.51520: Flags [P.], seq 388672:389056, ack 1121, win 501, options [nop,nop,TS val 119424499 ecr 2363709017], length 384
02:59:28.451151 IP 198.211.111.194.51520 > karldrop.ssh: Flags [.], ack 389056, win 1839, options [nop,nop,TS val 2363709122 ecr 119424499], length 0
02:59:28.534147 IP karldrop.ssh > 198.211.111.194.51520: Flags [P.], seq 389056:389440, ack 1121, win 501, options [nop,nop,TS val 119424603 ecr 2363709122], length 384
02:59:28.556510 IP 198.211.111.194.51520 > karldrop.ssh: Flags [.], ack 389440, win 1839, options [nop,nop,TS val 2363709228 ecr 119424603], length 0
02:59:28.638114 IP karldrop.ssh > 198.211.111.194.51520: Flags [P.], seq 389440:389824, ack 1121, win 501, options [nop,nop,TS val 119424707 ecr 2363709228], length 384
02:59:28.655547 IP 198.211.111.194.51520 > karldrop.ssh: Flags [.], ack 389824, win 1839, options [nop,nop,TS val 2363709327 ecr 119424707], length 0
02:59:28.742152 IP karldrop.ssh > 198.211.111.194.51520: Flags [P.], seq 389824:390208, ack 1121, win 501, options [nop,nop,TS val 119424811 ecr 2363709327], length 384
02:59:28.760552 IP 198.211.111.194.51520 > karldrop.ssh: Flags [.], ack 390208, win 1839, options [nop,nop,TS val 2363709432 ecr 119424811], length 0
02:59:28.846081 IP karldrop.ssh > 198.211.111.194.51520: Flags [P.], seq 390208:390592, ack 1121, win 501, options [nop,nop,TS val 119424915 ecr 2363709432], length 384
02:59:28.864575 IP 198.211.111.194.51520 > karldrop.ssh: Flags [.], ack 390592, win 1839, options [nop,nop,TS val 2363709536 ecr 119424915], length 0
02:59:28.950126 IP karldrop.ssh > 198.211.111.194.51520: Flags [P.], seq 390592:390976, ack 1121, win 501, options [nop,nop,TS val 119425019 ecr 2363709536], length 384
02:59:28.971552 IP 198.211.111.194.51520 > karldrop.ssh: Flags [.], ack 390976, win 1839, options [nop,nop,TS val 2363709643 ecr 119425019], length 0
02:59:29.054099 IP karldrop.ssh > 198.211.111.194.51520: Flags [P.], seq 390976:391360, ack 1121, win 501, options [nop,nop,TS val 119425123 ecr 2363709643], length 384
02:59:29.077067 IP 198.211.111.194.51520 > karldrop.ssh: Flags [.], ack 391360, win 1839, options [nop,nop,TS val 2363709748 ecr 119425123], length 0
02:59:29.158098 IP karldrop.ssh > 198.211.111.194.51520: Flags [P.], seq 391360:391744, ack 1121, win 501, options [nop,nop,TS val 119425227 ecr 2363709748], length 384
02:59:29.175212 IP 198.211.111.194.51520 > karldrop.ssh: Flags [.], ack 391744, win 1839, options [nop,nop,TS val 2363709846 ecr 119425227], length 0
02:59:29.262115 IP karldrop.ssh > 198.211.111.194.51520: Flags [P.], seq 391744:392128, ack 1121, win 501, options [nop,nop,TS val 119425331 ecr 2363709846], length 384
02:59:29.282122 IP 198.211.111.194.51520 > karldrop.ssh: Flags [.], ack 392128, win 1839, options [nop,nop,TS val 2363709953 ecr 119425331], length 0
02:59:29.366106 IP karldrop.ssh > 198.211.111.194.51520: Flags [P.], seq 392128:392512, ack 1121, win 501, options [nop,nop,TS val 119425435 ecr 2363709953], length 384
02:59:29.382885 IP 198.211.111.194.51520 > karldrop.ssh: Flags [.], ack 392512, win 1839, options [nop,nop,TS val 2363710054 ecr 119425435], length 0
02:59:29.470153 IP karldrop.ssh > 198.211.111.194.51520: Flags [P.], seq 392512:392896, ack 1121, win 501, options [nop,nop,TS val 119425539 ecr 2363710054], length 384
02:59:29.490915 IP 198.211.111.194.51520 > karldrop.ssh: Flags [.], ack 392896, win 1839, options [nop,nop,TS val 2363710162 ecr 119425539], length 0
02:59:29.574116 IP karldrop.ssh > 198.211.111.194.51520: Flags [P.], seq 392896:393280, ack 1121, win 501, options [nop,nop,TS val 119425643 ecr 2363710162], length 384
02:59:29.593260 IP 198.211.111.194.51520 > karldrop.ssh: Flags [.], ack 393280, win 1839, options [nop,nop,TS val 2363710264 ecr 119425643], length 0
02:59:29.678092 IP karldrop.ssh > 198.211.111.194.51520: Flags [P.], seq 393280:393664, ack 1121, win 501, options [nop,nop,TS val 119425747 ecr 2363710264], length 384
02:59:29.695695 IP 198.211.111.194.51520 > karldrop.ssh: Flags [.], ack 393664, win 1839, options [nop,nop,TS val 2363710367 ecr 119425747], length 0
02:59:29.782106 IP karldrop.ssh > 198.211.111.194.51520: Flags [P.], seq 393664:394048, ack 1121, win 501, options [nop,nop,TS val 119425851 ecr 2363710367], length 384
02:59:29.799046 IP 198.211.111.194.51520 > karldrop.ssh: Flags [.], ack 394048, win 1839, options [nop,nop,TS val 2363710470 ecr 119425851], length 0
02:59:29.886080 IP karldrop.ssh > 198.211.111.194.51520: Flags [P.], seq 394048:394432, ack 1121, win 501, options [nop,nop,TS val 119425955 ecr 2363710470], length 384
02:59:29.902989 IP 198.211.111.194.51520 > karldrop.ssh: Flags [.], ack 394432, win 1839, options [nop,nop,TS val 2363710574 ecr 119425955], length 0
02:59:29.990116 IP karldrop.ssh > 198.211.111.194.51520: Flags [P.], seq 394432:394816, ack 1121, win 501, options [nop,nop,TS val 119426059 ecr 2363710574], length 384
02:59:30.007094 IP 198.211.111.194.51520 > karldrop.ssh: Flags [.], ack 394816, win 1839, options [nop,nop,TS val 2363710678 ecr 119426059], length 0
02:59:30.094133 IP karldrop.ssh > 198.211.111.194.51520: Flags [P.], seq 394816:395200, ack 1121, win 501, options [nop,nop,TS val 119426163 ecr 2363710678], length 384
02:59:30.111061 IP 198.211.111.194.51520 > karldrop.ssh: Flags [.], ack 395200, win 1839, options [nop,nop,TS val 2363710782 ecr 119426163], length 0
02:59:30.154328 IP 119.28.111.112.36566 > karldrop.ssh: Flags [S], seq 2928593255, win 29200, options [mss 1424,sackOK,TS val 509368328 ecr 0,nop,wscale 7], length 0
02:59:30.154403 IP karldrop.ssh > 119.28.111.112.36566: Flags [S.], seq 4162157689, ack 2928593256, win 65160, options [mss 1460,sackOK,TS val 2947247465 ecr 509368328,nop,wscale 7], length 0
02:59:30.198418 IP karldrop.ssh > 198.211.111.194.51520: Flags [P.], seq 395200:395584, ack 1121, win 501, options [nop,nop,TS val 119426267 ecr 2363710782], length 384
02:59:30.198687 IP karldrop.57471 > 67.207.67.2.domain: 26424+ [1au] PTR? 112.111.28.119.in-addr.arpa. (56)
02:59:30.198800 IP karldrop.54298 > 67.207.67.2.domain: 11966+ [1au] PTR? 112.111.28.119.in-addr.arpa. (56)
02:59:30.198863 IP karldrop.59622 > 67.207.67.3.domain: Flags [S], seq 4065612735, win 64240, options [mss 1460,sackOK,TS val 99363983 ecr 0,nop,wscale 7,tfo  cookiereq,nop,nop], length 0
02:59:30.200254 IP 67.207.67.3.domain > karldrop.59622: Flags [S.], seq 1120049123, ack 4065612736, win 65160, options [mss 1460,sackOK,TS val 4156631572 ecr 99363983,nop,wscale 9], length 0
02:59:30.200335 IP karldrop.59622 > 67.207.67.3.domain: Flags [.], ack 1, win 502, options [nop,nop,TS val 99363984 ecr 4156631572], length 0
02:59:30.200386 IP karldrop.59622 > 67.207.67.3.domain: Flags [P.], seq 1:48, ack 1, win 502, options [nop,nop,TS val 99363984 ecr 4156631572], length 47 6783+ PTR? 112.111.28.119.in-addr.arpa. (45)
02:59:30.201592 IP 67.207.67.3.domain > karldrop.59622: Flags [.], ack 48, win 128, options [nop,nop,TS val 4156631573 ecr 99363984], length 0
02:59:30.215767 IP 198.211.111.194.51520 > karldrop.ssh: Flags [.], ack 395584, win 1839, options [nop,nop,TS val 2363710887 ecr 119426267], length 0
02:59:30.256872 IP 67.207.67.2.domain > karldrop.54298: 11966 NXDomain 0/0/1 (56)
02:59:30.257033 IP karldrop.54298 > 67.207.67.2.domain: 11966+ PTR? 112.111.28.119.in-addr.arpa. (45)
02:59:30.260475 IP 67.207.67.2.domain > karldrop.57471: 26424 NXDomain 0/0/1 (56)
02:59:30.260891 IP karldrop.57471 > 67.207.67.2.domain: 26424+ PTR? 112.111.28.119.in-addr.arpa. (45)
02:59:30.264906 IP 67.207.67.3.domain > karldrop.59622: Flags [P.], seq 1:48, ack 48, win 128, options [nop,nop,TS val 4156631636 ecr 99363984], length 47 6783 NXDomain 0/0/0 (45)
02:59:30.264961 IP karldrop.59622 > 67.207.67.3.domain: Flags [.], ack 48, win 502, options [nop,nop,TS val 99364049 ecr 4156631636], length 0
02:59:30.381536 IP 119.28.111.112.36566 > karldrop.ssh: Flags [.], ack 1, win 229, options [nop,nop,TS val 509368556 ecr 2947247465], length 0
02:59:30.388954 IP 119.28.111.112.36566 > karldrop.ssh: Flags [P.], seq 1:23, ack 1, win 229, options [nop,nop,TS val 509368564 ecr 2947247465], length 22: SSH: SSH-2.0-libssh_0.9.6
02:59:30.389001 IP karldrop.ssh > 119.28.111.112.36566: Flags [.], ack 23, win 509, options [nop,nop,TS val 2947247700 ecr 509368564], length 0
02:59:30.393424 IP karldrop.ssh > 119.28.111.112.36566: Flags [P.], seq 1:42, ack 23, win 509, options [nop,nop,TS val 2947247704 ecr 509368564], length 41: SSH: SSH-2.0-OpenSSH_8.9p1 Ubuntu-3ubuntu0.6
02:59:30.539154 IP 67.207.67.2.domain > karldrop.54298: 11966 NXDomain 0/0/0 (45)
02:59:30.541542 IP 67.207.67.2.domain > karldrop.57471: 26424 NXDomain 0/0/0 (45)
02:59:30.542438 IP karldrop.ssh > 198.211.111.194.51520: Flags [P.], seq 395584:398480, ack 1121, win 501, options [nop,nop,TS val 119426611 ecr 2363710887], length 2896
02:59:30.542467 IP karldrop.ssh > 198.211.111.194.51520: Flags [P.], seq 398480:398784, ack 1121, win 501, options [nop,nop,TS val 119426611 ecr 2363710887], length 304
02:59:30.557162 IP 198.211.111.194.51520 > karldrop.ssh: Flags [.], ack 397032, win 1834, options [nop,nop,TS val 2363711228 ecr 119426611], length 0
02:59:30.557162 IP 198.211.111.194.51520 > karldrop.ssh: Flags [.], ack 398784, win 1821, options [nop,nop,TS val 2363711228 ecr 119426611], length 0
02:59:30.614123 IP karldrop.ssh > 198.211.111.194.51520: Flags [P.], seq 398784:399648, ack 1121, win 501, options [nop,nop,TS val 119426683 ecr 2363711228], length 864
02:59:30.619974 IP 119.28.111.112.36566 > karldrop.ssh: Flags [.], ack 42, win 229, options [nop,nop,TS val 509368795 ecr 2947247704], length 0
02:59:30.620026 IP karldrop.ssh > 119.28.111.112.36566: Flags [P.], seq 42:1154, ack 23, win 509, options [nop,nop,TS val 2947247931 ecr 509368795], length 1112
02:59:30.620045 IP 119.28.111.112.36566 > karldrop.ssh: Flags [P.], seq 23:999, ack 42, win 229, options [nop,nop,TS val 509368795 ecr 2947247704], length 976
02:59:30.628882 IP 198.211.111.194.51520 > karldrop.ssh: Flags [.], ack 399648, win 1836, options [nop,nop,TS val 2363711300 ecr 119426683], length 0
02:59:30.661882 IP karldrop.ssh > 119.28.111.112.36566: Flags [.], ack 999, win 502, options [nop,nop,TS val 2947247973 ecr 509368795], length 0
02:59:30.718124 IP karldrop.ssh > 198.211.111.194.51520: Flags [P.], seq 399648:400640, ack 1121, win 501, options [nop,nop,TS val 119426787 ecr 2363711300], length 992
02:59:30.732846 IP 198.211.111.194.51520 > karldrop.ssh: Flags [.], ack 400640, win 1835, options [nop,nop,TS val 2363711404 ecr 119426787], length 0
02:59:30.822095 IP karldrop.ssh > 198.211.111.194.51520: Flags [P.], seq 400640:401024, ack 1121, win 501, options [nop,nop,TS val 119426891 ecr 2363711404], length 384
02:59:30.836729 IP 198.211.111.194.51520 > karldrop.ssh: Flags [.], ack 401024, win 1838, options [nop,nop,TS val 2363711508 ecr 119426891], length 0
02:59:30.885945 IP 119.28.111.112.36566 > karldrop.ssh: Flags [.], ack 1154, win 246, options [nop,nop,TS val 509369061 ecr 2947247931], length 0
02:59:30.888541 IP 119.28.111.112.36566 > karldrop.ssh: Flags [P.], seq 999:1047, ack 1154, win 246, options [nop,nop,TS val 509369063 ecr 2947247973], length 48
02:59:30.888593 IP karldrop.ssh > 119.28.111.112.36566: Flags [.], ack 1047, win 502, options [nop,nop,TS val 2947248199 ecr 509369063], length 0
02:59:30.893246 IP 198.235.24.53.56473 > karldrop.8085: Flags [S], seq 3810973549, win 65535, options [mss 1460], length 0
02:59:30.895451 IP karldrop.ssh > 119.28.111.112.36566: Flags [P.], seq 1154:1686, ack 1047, win 502, options [nop,nop,TS val 2947248206 ecr 509369063], length 532
02:59:30.926247 IP karldrop.ssh > 198.211.111.194.51520: Flags [P.], seq 401024:401856, ack 1121, win 501, options [nop,nop,TS val 119426995 ecr 2363711508], length 832
02:59:30.926527 IP karldrop.52567 > 67.207.67.2.domain: 52937+ [1au] PTR? 53.24.235.198.in-addr.arpa. (55)
02:59:30.926630 IP karldrop.56489 > 67.207.67.2.domain: 18887+ [1au] PTR? 53.24.235.198.in-addr.arpa. (55)
02:59:30.926676 IP karldrop.59622 > 67.207.67.3.domain: Flags [P.], seq 48:94, ack 48, win 502, options [nop,nop,TS val 99364710 ecr 4156631636], length 46 53750+ PTR? 53.24.235.198.in-addr.arpa. (44)
02:59:30.928003 IP 67.207.67.3.domain > karldrop.59622: Flags [.], ack 94, win 128, options [nop,nop,TS val 4156632299 ecr 99364710], length 0
02:59:30.941081 IP 198.211.111.194.51520 > karldrop.ssh: Flags [.], ack 401856, win 1836, options [nop,nop,TS val 2363711612 ecr 119426995], length 0
02:59:30.950865 IP 67.207.67.2.domain > karldrop.52567: 52937 NXDomain 0/1/1 (148)
02:59:30.951118 IP karldrop.52567 > 67.207.67.2.domain: 52937+ PTR? 53.24.235.198.in-addr.arpa. (44)
02:59:30.951572 IP 67.207.67.3.domain > karldrop.59622: Flags [P.], seq 48:187, ack 94, win 128, options [nop,nop,TS val 4156632323 ecr 99364710], length 139 53750 NXDomain 0/1/0 (137)
02:59:30.951596 IP karldrop.59622 > 67.207.67.3.domain: Flags [.], ack 187, win 501, options [nop,nop,TS val 99364735 ecr 4156632323], length 0
02:59:30.955097 IP 67.207.67.2.domain > karldrop.56489: 18887 NXDomain 0/1/1 (148)
02:59:30.955244 IP karldrop.56489 > 67.207.67.2.domain: 18887+ PTR? 53.24.235.198.in-addr.arpa. (44)
02:59:30.956832 IP 67.207.67.2.domain > karldrop.56489: 18887 NXDomain 0/1/0 (137)
02:59:30.975956 IP 67.207.67.2.domain > karldrop.52567: 52937 NXDomain 0/1/0 (137)
02:59:30.976508 IP karldrop.ssh > 198.211.111.194.51520: Flags [P.], seq 401856:402208, ack 1121, win 501, options [nop,nop,TS val 119427045 ecr 2363711612], length 352
02:59:30.991176 IP 198.211.111.194.51520 > karldrop.ssh: Flags [.], ack 402208, win 1838, options [nop,nop,TS val 2363711662 ecr 119427045], length 0
02:59:31.030262 IP karldrop.ssh > 198.211.111.194.51520: Flags [P.], seq 402208:404336, ack 1121, win 501, options [nop,nop,TS val 119427099 ecr 2363711662], length 2128
02:59:31.044973 IP 198.211.111.194.51520 > karldrop.ssh: Flags [.], ack 404336, win 1829, options [nop,nop,TS val 2363711716 ecr 119427099], length 0
02:59:31.122056 IP 119.28.111.112.36566 > karldrop.ssh: Flags [.], ack 1686, win 263, options [nop,nop,TS val 509369297 ecr 2947248206], length 0
02:59:31.129814 IP 119.28.111.112.36566 > karldrop.ssh: Flags [P.], seq 1047:1063, ack 1686, win 263, options [nop,nop,TS val 509369304 ecr 2947248206], length 16
02:59:31.134100 IP karldrop.ssh > 198.211.111.194.51520: Flags [P.], seq 404336:405024, ack 1121, win 501, options [nop,nop,TS val 119427203 ecr 2363711716], length 688
02:59:31.148882 IP 198.211.111.194.51520 > karldrop.ssh: Flags [.], ack 405024, win 1837, options [nop,nop,TS val 2363711820 ecr 119427203], length 0
02:59:31.169903 IP karldrop.ssh > 119.28.111.112.36566: Flags [.], ack 1063, win 502, options [nop,nop,TS val 2947248481 ecr 509369304], length 0
02:59:31.238096 IP karldrop.ssh > 198.211.111.194.51520: Flags [P.], seq 405024:405552, ack 1121, win 501, options [nop,nop,TS val 119427307 ecr 2363711820], length 528
02:59:31.252878 IP 198.211.111.194.51520 > karldrop.ssh: Flags [.], ack 405552, win 1837, options [nop,nop,TS val 2363711924 ecr 119427307], length 0
02:59:31.342149 IP karldrop.ssh > 198.211.111.194.51520: Flags [P.], seq 405552:405936, ack 1121, win 501, options [nop,nop,TS val 119427411 ecr 2363711924], length 384
02:59:31.356888 IP 198.211.111.194.51520 > karldrop.ssh: Flags [.], ack 405936, win 1838, options [nop,nop,TS val 2363712028 ecr 119427411], length 0
02:59:31.396537 IP 119.28.111.112.36566 > karldrop.ssh: Flags [P.], seq 1063:1115, ack 1686, win 263, options [nop,nop,TS val 509369571 ecr 2947248481], length 52
02:59:31.396606 IP karldrop.ssh > 119.28.111.112.36566: Flags [.], ack 1115, win 502, options [nop,nop,TS val 2947248707 ecr 509369571], length 0
02:59:31.396881 IP karldrop.ssh > 119.28.111.112.36566: Flags [P.], seq 1686:1738, ack 1115, win 502, options [nop,nop,TS val 2947248708 ecr 509369571], length 52
02:59:31.446240 IP karldrop.ssh > 198.211.111.194.51520: Flags [P.], seq 405936:406784, ack 1121, win 501, options [nop,nop,TS val 119427515 ecr 2363712028], length 848
02:59:31.461263 IP 198.211.111.194.51520 > karldrop.ssh: Flags [.], ack 406784, win 1836, options [nop,nop,TS val 2363712132 ecr 119427515], length 0
02:59:31.550129 IP karldrop.ssh > 198.211.111.194.51520: Flags [P.], seq 406784:407168, ack 1121, win 501, options [nop,nop,TS val 119427619 ecr 2363712132], length 384
02:59:31.564840 IP 198.211.111.194.51520 > karldrop.ssh: Flags [.], ack 407168, win 1838, options [nop,nop,TS val 2363712236 ecr 119427619], length 0
02:59:31.629132 IP 119.28.111.112.36566 > karldrop.ssh: Flags [P.], seq 1115:1199, ack 1738, win 263, options [nop,nop,TS val 509369804 ecr 2947248708], length 84
02:59:31.654066 IP karldrop.ssh > 198.211.111.194.51520: Flags [P.], seq 407168:407712, ack 1121, win 501, options [nop,nop,TS val 119427723 ecr 2363712236], length 544
02:59:31.668853 IP 198.211.111.194.51520 > karldrop.ssh: Flags [.], ack 407712, win 1837, options [nop,nop,TS val 2363712340 ecr 119427723], length 0
02:59:31.669861 IP karldrop.ssh > 119.28.111.112.36566: Flags [.], ack 1199, win 502, options [nop,nop,TS val 2947248981 ecr 509369804], length 0
02:59:31.758067 IP karldrop.ssh > 198.211.111.194.51520: Flags [P.], seq 407712:408240, ack 1121, win 501, options [nop,nop,TS val 119427827 ecr 2363712340], length 528
02:59:31.772853 IP 198.211.111.194.51520 > karldrop.ssh: Flags [.], ack 408240, win 1837, options [nop,nop,TS val 2363712444 ecr 119427827], length 0
02:59:31.862072 IP karldrop.ssh > 198.211.111.194.51520: Flags [P.], seq 408240:408624, ack 1121, win 501, options [nop,nop,TS val 119427931 ecr 2363712444], length 384
02:59:31.876871 IP 198.211.111.194.51520 > karldrop.ssh: Flags [.], ack 408624, win 1838, options [nop,nop,TS val 2363712548 ecr 119427931], length 0
02:59:31.966130 IP karldrop.ssh > 198.211.111.194.51520: Flags [P.], seq 408624:409008, ack 1121, win 501, options [nop,nop,TS val 119428035 ecr 2363712548], length 384
02:59:31.988529 IP 198.211.111.194.51520 > karldrop.ssh: Flags [.], ack 409008, win 1839, options [nop,nop,TS val 2363712660 ecr 119428035], length 0
02:59:32.070104 IP karldrop.ssh > 198.211.111.194.51520: Flags [P.], seq 409008:409392, ack 1121, win 501, options [nop,nop,TS val 119428139 ecr 2363712660], length 384
02:59:32.091734 IP 198.211.111.194.51520 > karldrop.ssh: Flags [.], ack 409392, win 1839, options [nop,nop,TS val 2363712763 ecr 119428139], length 0
02:59:32.174078 IP karldrop.ssh > 198.211.111.194.51520: Flags [P.], seq 409392:409776, ack 1121, win 501, options [nop,nop,TS val 119428243 ecr 2363712763], length 384
02:59:32.194725 IP 198.211.111.194.51520 > karldrop.ssh: Flags [.], ack 409776, win 1839, options [nop,nop,TS val 2363712866 ecr 119428243], length 0
02:59:32.278162 IP karldrop.ssh > 198.211.111.194.51520: Flags [P.], seq 409776:410160, ack 1121, win 501, options [nop,nop,TS val 119428347 ecr 2363712866], length 384
02:59:32.300134 IP 198.211.111.194.51520 > karldrop.ssh: Flags [.], ack 410160, win 1839, options [nop,nop,TS val 2363712971 ecr 119428347], length 0
02:59:32.382381 IP karldrop.ssh > 198.211.111.194.51520: Flags [P.], seq 410160:410544, ack 1121, win 501, options [nop,nop,TS val 119428451 ecr 2363712971], length 384
02:59:32.405158 IP 198.211.111.194.51520 > karldrop.ssh: Flags [.], ack 410544, win 1839, options [nop,nop,TS val 2363713076 ecr 119428451], length 0
02:59:32.486137 IP karldrop.ssh > 198.211.111.194.51520: Flags [P.], seq 410544:410928, ack 1121, win 501, options [nop,nop,TS val 119428555 ecr 2363713076], length 384
02:59:32.507583 IP 198.211.111.194.51520 > karldrop.ssh: Flags [.], ack 410928, win 1839, options [nop,nop,TS val 2363713179 ecr 119428555], length 0
02:59:32.590045 IP karldrop.ssh > 198.211.111.194.51520: Flags [P.], seq 410928:411312, ack 1121, win 501, options [nop,nop,TS val 119428659 ecr 2363713179], length 384
02:59:32.610014 IP 198.211.111.194.51520 > karldrop.ssh: Flags [.], ack 411312, win 1839, options [nop,nop,TS val 2363713281 ecr 119428659], length 0
02:59:32.694086 IP karldrop.ssh > 198.211.111.194.51520: Flags [P.], seq 411312:411696, ack 1121, win 501, options [nop,nop,TS val 119428763 ecr 2363713281], length 384
02:59:32.714097 IP 198.211.111.194.51520 > karldrop.ssh: Flags [.], ack 411696, win 1839, options [nop,nop,TS val 2363713385 ecr 119428763], length 0
02:59:32.798161 IP karldrop.ssh > 198.211.111.194.51520: Flags [P.], seq 411696:412080, ack 1121, win 501, options [nop,nop,TS val 119428867 ecr 2363713385], length 384
02:59:32.815101 IP 198.211.111.194.51520 > karldrop.ssh: Flags [.], ack 412080, win 1839, options [nop,nop,TS val 2363713486 ecr 119428867], length 0
02:59:32.902115 IP karldrop.ssh > 198.211.111.194.51520: Flags [P.], seq 412080:412464, ack 1121, win 501, options [nop,nop,TS val 119428971 ecr 2363713486], length 384
02:59:32.918751 IP 198.211.111.194.51520 > karldrop.ssh: Flags [.], ack 412464, win 1839, options [nop,nop,TS val 2363713590 ecr 119428971], length 0
02:59:33.006122 IP karldrop.ssh > 198.211.111.194.51520: Flags [P.], seq 412464:412848, ack 1121, win 501, options [nop,nop,TS val 119429075 ecr 2363713590], length 384
02:59:33.015119 IP 67.207.67.3.domain > karldrop.59622: Flags [F.], seq 187, ack 94, win 128, options [nop,nop,TS val 4156634386 ecr 99364735], length 0
02:59:33.015256 IP karldrop.59622 > 67.207.67.3.domain: Flags [F.], seq 94, ack 188, win 501, options [nop,nop,TS val 99366799 ecr 4156634386], length 0
02:59:33.016592 IP 67.207.67.3.domain > karldrop.59622: Flags [.], ack 95, win 128, options [nop,nop,TS val 4156634388 ecr 99366799], length 0
02:59:33.022524 IP 198.211.111.194.51520 > karldrop.ssh: Flags [.], ack 412848, win 1839, options [nop,nop,TS val 2363713694 ecr 119429075], length 0
02:59:33.110128 IP karldrop.ssh > 198.211.111.194.51520: Flags [P.], seq 412848:413680, ack 1121, win 501, options [nop,nop,TS val 119429179 ecr 2363713694], length 832
02:59:33.136867 IP 198.211.111.194.51520 > karldrop.ssh: Flags [.], ack 413680, win 1839, options [nop,nop,TS val 2363713808 ecr 119429179], length 0
02:59:33.214398 IP karldrop.ssh > 198.211.111.194.51520: Flags [P.], seq 413680:414064, ack 1121, win 501, options [nop,nop,TS val 119429283 ecr 2363713808], length 384
02:59:33.231654 IP 198.211.111.194.51520 > karldrop.ssh: Flags [.], ack 414064, win 1839, options [nop,nop,TS val 2363713903 ecr 119429283], length 0
02:59:33.318087 IP karldrop.ssh > 198.211.111.194.51520: Flags [P.], seq 414064:414448, ack 1121, win 501, options [nop,nop,TS val 119429387 ecr 2363713903], length 384
02:59:33.335706 IP 198.211.111.194.51520 > karldrop.ssh: Flags [.], ack 414448, win 1839, options [nop,nop,TS val 2363714007 ecr 119429387], length 0
02:59:33.422082 IP karldrop.ssh > 198.211.111.194.51520: Flags [P.], seq 414448:414832, ack 1121, win 501, options [nop,nop,TS val 119429491 ecr 2363714007], length 384
02:59:33.439835 IP 198.211.111.194.51520 > karldrop.ssh: Flags [.], ack 414832, win 1839, options [nop,nop,TS val 2363714111 ecr 119429491], length 0
02:59:33.526116 IP karldrop.ssh > 198.211.111.194.51520: Flags [P.], seq 414832:415216, ack 1121, win 501, options [nop,nop,TS val 119429595 ecr 2363714111], length 384
02:59:33.547303 IP 198.211.111.194.51520 > karldrop.ssh: Flags [.], ack 415216, win 1839, options [nop,nop,TS val 2363714219 ecr 119429595], length 0
02:59:33.630179 IP karldrop.ssh > 198.211.111.194.51520: Flags [P.], seq 415216:415600, ack 1121, win 501, options [nop,nop,TS val 119429699 ecr 2363714219], length 384
02:59:33.652151 IP 198.211.111.194.51520 > karldrop.ssh: Flags [.], ack 415600, win 1839, options [nop,nop,TS val 2363714323 ecr 119429699], length 0
02:59:33.734111 IP karldrop.ssh > 198.211.111.194.51520: Flags [P.], seq 415600:415984, ack 1121, win 501, options [nop,nop,TS val 119429803 ecr 2363714323], length 384
02:59:33.754864 IP 198.211.111.194.51520 > karldrop.ssh: Flags [.], ack 415984, win 1839, options [nop,nop,TS val 2363714426 ecr 119429803], length 0
02:59:33.838109 IP karldrop.ssh > 198.211.111.194.51520: Flags [P.], seq 415984:416368, ack 1121, win 501, options [nop,nop,TS val 119429907 ecr 2363714426], length 384
02:59:33.861348 IP 198.211.111.194.51520 > karldrop.ssh: Flags [.], ack 416368, win 1839, options [nop,nop,TS val 2363714533 ecr 119429907], length 0
02:59:33.942109 IP karldrop.ssh > 198.211.111.194.51520: Flags [P.], seq 416368:416752, ack 1121, win 501, options [nop,nop,TS val 119430011 ecr 2363714533], length 384
02:59:33.963579 IP 198.211.111.194.51520 > karldrop.ssh: Flags [.], ack 416752, win 1839, options [nop,nop,TS val 2363714635 ecr 119430011], length 0
02:59:34.046081 IP karldrop.ssh > 198.211.111.194.51520: Flags [P.], seq 416752:417136, ack 1121, win 501, options [nop,nop,TS val 119430115 ecr 2363714635], length 384
02:59:34.066871 IP 198.211.111.194.51520 > karldrop.ssh: Flags [.], ack 417136, win 1839, options [nop,nop,TS val 2363714738 ecr 119430115], length 0
02:59:34.150165 IP karldrop.ssh > 198.211.111.194.51520: Flags [P.], seq 417136:417520, ack 1121, win 501, options [nop,nop,TS val 119430219 ecr 2363714738], length 384
02:59:34.168865 IP 198.211.111.194.51520 > karldrop.ssh: Flags [.], ack 417520, win 1839, options [nop,nop,TS val 2363714840 ecr 119430219], length 0
02:59:34.254169 IP karldrop.ssh > 198.211.111.194.51520: Flags [P.], seq 417520:417904, ack 1121, win 501, options [nop,nop,TS val 119430323 ecr 2363714840], length 384
02:59:34.275283 IP 198.211.111.194.51520 > karldrop.ssh: Flags [.], ack 417904, win 1839, options [nop,nop,TS val 2363714946 ecr 119430323], length 0
02:59:34.358064 IP karldrop.ssh > 198.211.111.194.51520: Flags [P.], seq 417904:418288, ack 1121, win 501, options [nop,nop,TS val 119430427 ecr 2363714946], length 384
02:59:34.379274 IP 198.211.111.194.51520 > karldrop.ssh: Flags [.], ack 418288, win 1839, options [nop,nop,TS val 2363715050 ecr 119430427], length 0
02:59:34.462079 IP karldrop.ssh > 198.211.111.194.51520: Flags [P.], seq 418288:418672, ack 1121, win 501, options [nop,nop,TS val 119430531 ecr 2363715050], length 384
02:59:34.482292 IP 198.211.111.194.51520 > karldrop.ssh: Flags [.], ack 418672, win 1839, options [nop,nop,TS val 2363715154 ecr 119430531], length 0
02:59:34.566136 IP karldrop.ssh > 198.211.111.194.51520: Flags [P.], seq 418672:419056, ack 1121, win 501, options [nop,nop,TS val 119430635 ecr 2363715154], length 384
02:59:34.587406 IP 198.211.111.194.51520 > karldrop.ssh: Flags [.], ack 419056, win 1839, options [nop,nop,TS val 2363715259 ecr 119430635], length 0
02:59:34.670148 IP karldrop.ssh > 198.211.111.194.51520: Flags [P.], seq 419056:419440, ack 1121, win 501, options [nop,nop,TS val 119430739 ecr 2363715259], length 384
02:59:34.687154 IP 198.211.111.194.51520 > karldrop.ssh: Flags [.], ack 419440, win 1839, options [nop,nop,TS val 2363715358 ecr 119430739], length 0
02:59:34.774065 IP karldrop.ssh > 198.211.111.194.51520: Flags [P.], seq 419440:419824, ack 1121, win 501, options [nop,nop,TS val 119430843 ecr 2363715358], length 384
02:59:34.793438 IP 198.211.111.194.51520 > karldrop.ssh: Flags [.], ack 419824, win 1839, options [nop,nop,TS val 2363715465 ecr 119430843], length 0
02:59:34.878115 IP karldrop.ssh > 198.211.111.194.51520: Flags [P.], seq 419824:420208, ack 1121, win 501, options [nop,nop,TS val 119430947 ecr 2363715465], length 384
02:59:34.896579 IP 198.211.111.194.51520 > karldrop.ssh: Flags [.], ack 420208, win 1839, options [nop,nop,TS val 2363715568 ecr 119430947], length 0
02:59:34.982152 IP karldrop.ssh > 198.211.111.194.51520: Flags [P.], seq 420208:420592, ack 1121, win 501, options [nop,nop,TS val 119431051 ecr 2363715568], length 384
02:59:35.003899 IP 198.211.111.194.51520 > karldrop.ssh: Flags [.], ack 420592, win 1839, options [nop,nop,TS val 2363715675 ecr 119431051], length 0
02:59:35.086111 IP karldrop.ssh > 198.211.111.194.51520: Flags [P.], seq 420592:420976, ack 1121, win 501, options [nop,nop,TS val 119431155 ecr 2363715675], length 384
02:59:35.109109 IP 198.211.111.194.51520 > karldrop.ssh: Flags [.], ack 420976, win 1839, options [nop,nop,TS val 2363715780 ecr 119431155], length 0
02:59:35.190074 IP karldrop.ssh > 198.211.111.194.51520: Flags [P.], seq 420976:421360, ack 1121, win 501, options [nop,nop,TS val 119431259 ecr 2363715780], length 384
02:59:35.209260 IP 198.211.111.194.51520 > karldrop.ssh: Flags [.], ack 421360, win 1839, options [nop,nop,TS val 2363715880 ecr 119431259], length 0
02:59:35.294116 IP karldrop.ssh > 198.211.111.194.51520: Flags [P.], seq 421360:421744, ack 1121, win 501, options [nop,nop,TS val 119431363 ecr 2363715880], length 384
02:59:35.315710 IP 198.211.111.194.51520 > karldrop.ssh: Flags [.], ack 421744, win 1839, options [nop,nop,TS val 2363715987 ecr 119431363], length 0
02:59:35.398148 IP karldrop.ssh > 198.211.111.194.51520: Flags [P.], seq 421744:422128, ack 1121, win 501, options [nop,nop,TS val 119431467 ecr 2363715987], length 384
02:59:35.417841 IP 198.211.111.194.51520 > karldrop.ssh: Flags [.], ack 422128, win 1839, options [nop,nop,TS val 2363716089 ecr 119431467], length 0
02:59:35.502105 IP karldrop.ssh > 198.211.111.194.51520: Flags [P.], seq 422128:422512, ack 1121, win 501, options [nop,nop,TS val 119431571 ecr 2363716089], length 384
02:59:35.520183 IP 198.211.111.194.51520 > karldrop.ssh: Flags [.], ack 422512, win 1839, options [nop,nop,TS val 2363716191 ecr 119431571], length 0
02:59:35.606278 IP karldrop.ssh > 198.211.111.194.51520: Flags [P.], seq 422512:422896, ack 1121, win 501, options [nop,nop,TS val 119431675 ecr 2363716191], length 384
02:59:35.623710 IP 198.211.111.194.51520 > karldrop.ssh: Flags [.], ack 422896, win 1839, options [nop,nop,TS val 2363716295 ecr 119431675], length 0
02:59:35.644999 IP karldrop.ssh > 119.28.111.112.36566: Flags [P.], seq 1738:1790, ack 1199, win 502, options [nop,nop,TS val 2947252956 ecr 509369804], length 52
02:59:35.710172 IP karldrop.ssh > 198.211.111.194.51520: Flags [P.], seq 422896:423440, ack 1121, win 501, options [nop,nop,TS val 119431779 ecr 2363716295], length 544
02:59:35.728450 IP 198.211.111.194.51520 > karldrop.ssh: Flags [.], ack 423440, win 1839, options [nop,nop,TS val 2363716400 ecr 119431779], length 0
02:59:35.814095 IP karldrop.ssh > 198.211.111.194.51520: Flags [P.], seq 423440:423824, ack 1121, win 501, options [nop,nop,TS val 119431883 ecr 2363716400], length 384
02:59:35.834659 IP 198.211.111.194.51520 > karldrop.ssh: Flags [.], ack 423824, win 1839, options [nop,nop,TS val 2363716506 ecr 119431883], length 0
02:59:35.879812 IP 119.28.111.112.36566 > karldrop.ssh: Flags [P.], seq 1199:1251, ack 1790, win 263, options [nop,nop,TS val 509374054 ecr 2947252956], length 52
02:59:35.879813 IP 119.28.111.112.36566 > karldrop.ssh: Flags [F.], seq 1251, ack 1790, win 263, options [nop,nop,TS val 509374054 ecr 2947252956], length 0
02:59:35.879900 IP karldrop.ssh > 119.28.111.112.36566: Flags [.], ack 1251, win 502, options [nop,nop,TS val 2947253191 ecr 509374054], length 0
02:59:35.883085 IP karldrop.ssh > 119.28.111.112.36566: Flags [F.], seq 1790, ack 1252, win 502, options [nop,nop,TS val 2947253194 ecr 509374054], length 0
02:59:35.918142 IP karldrop.ssh > 198.211.111.194.51520: Flags [P.], seq 423824:424832, ack 1121, win 501, options [nop,nop,TS val 119431987 ecr 2363716506], length 1008
02:59:35.938307 IP 198.211.111.194.51520 > karldrop.ssh: Flags [.], ack 424832, win 1839, options [nop,nop,TS val 2363716610 ecr 119431987], length 0
02:59:36.022132 IP karldrop.ssh > 198.211.111.194.51520: Flags [P.], seq 424832:425216, ack 1121, win 501, options [nop,nop,TS val 119432091 ecr 2363716610], length 384
02:59:36.043308 IP 198.211.111.194.51520 > karldrop.ssh: Flags [.], ack 425216, win 1839, options [nop,nop,TS val 2363716714 ecr 119432091], length 0
02:59:36.109675 IP 119.28.111.112.36566 > karldrop.ssh: Flags [.], ack 1791, win 263, options [nop,nop,TS val 509374284 ecr 2947253194], length 0
02:59:36.126162 IP karldrop.ssh > 198.211.111.194.51520: Flags [P.], seq 425216:425744, ack 1121, win 501, options [nop,nop,TS val 119432195 ecr 2363716714], length 528
02:59:36.151535 IP 198.211.111.194.51520 > karldrop.ssh: Flags [.], ack 425744, win 1839, options [nop,nop,TS val 2363716823 ecr 119432195], length 0
02:59:36.230117 IP karldrop.ssh > 198.211.111.194.51520: Flags [P.], seq 425744:426128, ack 1121, win 501, options [nop,nop,TS val 119432299 ecr 2363716823], length 384
02:59:36.250928 IP 198.211.111.194.51520 > karldrop.ssh: Flags [.], ack 426128, win 1839, options [nop,nop,TS val 2363716922 ecr 119432299], length 0
02:59:36.334090 IP karldrop.ssh > 198.211.111.194.51520: Flags [P.], seq 426128:426512, ack 1121, win 501, options [nop,nop,TS val 119432403 ecr 2363716922], length 384
02:59:36.355740 IP 198.211.111.194.51520 > karldrop.ssh: Flags [.], ack 426512, win 1839, options [nop,nop,TS val 2363717027 ecr 119432403], length 0
02:59:36.438148 IP karldrop.ssh > 198.211.111.194.51520: Flags [P.], seq 426512:426896, ack 1121, win 501, options [nop,nop,TS val 119432507 ecr 2363717027], length 384
02:59:36.459220 IP 198.211.111.194.51520 > karldrop.ssh: Flags [.], ack 426896, win 1839, options [nop,nop,TS val 2363717130 ecr 119432507], length 0
02:59:36.542141 IP karldrop.ssh > 198.211.111.194.51520: Flags [P.], seq 426896:427280, ack 1121, win 501, options [nop,nop,TS val 119432611 ecr 2363717130], length 384
02:59:36.564959 IP 198.211.111.194.51520 > karldrop.ssh: Flags [.], ack 427280, win 1839, options [nop,nop,TS val 2363717236 ecr 119432611], length 0
02:59:36.646040 IP karldrop.ssh > 198.211.111.194.51520: Flags [P.], seq 427280:427664, ack 1121, win 501, options [nop,nop,TS val 119432715 ecr 2363717236], length 384
02:59:36.667403 IP 198.211.111.194.51520 > karldrop.ssh: Flags [.], ack 427664, win 1839, options [nop,nop,TS val 2363717339 ecr 119432715], length 0
02:59:36.750156 IP karldrop.ssh > 198.211.111.194.51520: Flags [P.], seq 427664:428048, ack 1121, win 501, options [nop,nop,TS val 119432819 ecr 2363717339], length 384
02:59:36.771999 IP 198.211.111.194.51520 > karldrop.ssh: Flags [.], ack 428048, win 1839, options [nop,nop,TS val 2363717443 ecr 119432819], length 0
02:59:36.854133 IP karldrop.ssh > 198.211.111.194.51520: Flags [P.], seq 428048:428432, ack 1121, win 501, options [nop,nop,TS val 119432923 ecr 2363717443], length 384
02:59:36.875333 IP 198.211.111.194.51520 > karldrop.ssh: Flags [.], ack 428432, win 1839, options [nop,nop,TS val 2363717547 ecr 119432923], length 0
02:59:36.958152 IP karldrop.ssh > 198.211.111.194.51520: Flags [P.], seq 428432:428816, ack 1121, win 501, options [nop,nop,TS val 119433027 ecr 2363717547], length 384
02:59:36.980061 IP 198.211.111.194.51520 > karldrop.ssh: Flags [.], ack 428816, win 1839, options [nop,nop,TS val 2363717651 ecr 119433027], length 0
02:59:37.062135 IP karldrop.ssh > 198.211.111.194.51520: Flags [P.], seq 428816:429200, ack 1121, win 501, options [nop,nop,TS val 119433131 ecr 2363717651], length 384
02:59:37.084175 IP 198.211.111.194.51520 > karldrop.ssh: Flags [.], ack 429200, win 1839, options [nop,nop,TS val 2363717755 ecr 119433131], length 0
02:59:37.166139 IP karldrop.ssh > 198.211.111.194.51520: Flags [P.], seq 429200:429584, ack 1121, win 501, options [nop,nop,TS val 119433235 ecr 2363717755], length 384
02:59:37.186558 IP 198.211.111.194.51520 > karldrop.ssh: Flags [.], ack 429584, win 1839, options [nop,nop,TS val 2363717858 ecr 119433235], length 0
02:59:37.270087 IP karldrop.ssh > 198.211.111.194.51520: Flags [P.], seq 429584:429968, ack 1121, win 501, options [nop,nop,TS val 119433339 ecr 2363717858], length 384
02:59:37.291872 IP 198.211.111.194.51520 > karldrop.ssh: Flags [.], ack 429968, win 1839, options [nop,nop,TS val 2363717963 ecr 119433339], length 0
02:59:37.374112 IP karldrop.ssh > 198.211.111.194.51520: Flags [P.], seq 429968:430352, ack 1121, win 501, options [nop,nop,TS val 119433443 ecr 2363717963], length 384
02:59:37.394548 IP 198.211.111.194.51520 > karldrop.ssh: Flags [.], ack 430352, win 1839, options [nop,nop,TS val 2363718066 ecr 119433443], length 0
02:59:37.478111 IP karldrop.ssh > 198.211.111.194.51520: Flags [P.], seq 430352:430736, ack 1121, win 501, options [nop,nop,TS val 119433547 ecr 2363718066], length 384
02:59:37.499767 IP 198.211.111.194.51520 > karldrop.ssh: Flags [.], ack 430736, win 1839, options [nop,nop,TS val 2363718171 ecr 119433547], length 0
02:59:37.582145 IP karldrop.ssh > 198.211.111.194.51520: Flags [P.], seq 430736:431120, ack 1121, win 501, options [nop,nop,TS val 119433651 ecr 2363718171], length 384
02:59:37.603172 IP 198.211.111.194.51520 > karldrop.ssh: Flags [.], ack 431120, win 1839, options [nop,nop,TS val 2363718274 ecr 119433651], length 0
02:59:37.686064 IP karldrop.ssh > 198.211.111.194.51520: Flags [P.], seq 431120:431504, ack 1121, win 501, options [nop,nop,TS val 119433755 ecr 2363718274], length 384
02:59:37.706921 IP 198.211.111.194.51520 > karldrop.ssh: Flags [.], ack 431504, win 1839, options [nop,nop,TS val 2363718378 ecr 119433755], length 0
02:59:37.790107 IP karldrop.ssh > 198.211.111.194.51520: Flags [P.], seq 431504:431888, ack 1121, win 501, options [nop,nop,TS val 119433859 ecr 2363718378], length 384
02:59:37.811143 IP 198.211.111.194.51520 > karldrop.ssh: Flags [.], ack 431888, win 1839, options [nop,nop,TS val 2363718482 ecr 119433859], length 0
02:59:37.894108 IP karldrop.ssh > 198.211.111.194.51520: Flags [P.], seq 431888:432272, ack 1121, win 501, options [nop,nop,TS val 119433963 ecr 2363718482], length 384
02:59:37.915997 IP 198.211.111.194.51520 > karldrop.ssh: Flags [.], ack 432272, win 1839, options [nop,nop,TS val 2363718587 ecr 119433963], length 0
02:59:37.998098 IP karldrop.ssh > 198.211.111.194.51520: Flags [P.], seq 432272:432656, ack 1121, win 501, options [nop,nop,TS val 119434067 ecr 2363718587], length 384
02:59:38.019182 IP 198.211.111.194.51520 > karldrop.ssh: Flags [.], ack 432656, win 1839, options [nop,nop,TS val 2363718690 ecr 119434067], length 0
02:59:38.102098 IP karldrop.ssh > 198.211.111.194.51520: Flags [P.], seq 432656:433040, ack 1121, win 501, options [nop,nop,TS val 119434171 ecr 2363718690], length 384
02:59:38.124407 IP 198.211.111.194.51520 > karldrop.ssh: Flags [.], ack 433040, win 1839, options [nop,nop,TS val 2363718796 ecr 119434171], length 0
02:59:38.206075 IP karldrop.ssh > 198.211.111.194.51520: Flags [P.], seq 433040:433424, ack 1121, win 501, options [nop,nop,TS val 119434275 ecr 2363718796], length 384
02:59:38.226791 IP 198.211.111.194.51520 > karldrop.ssh: Flags [.], ack 433424, win 1839, options [nop,nop,TS val 2363718898 ecr 119434275], length 0
02:59:38.310131 IP karldrop.ssh > 198.211.111.194.51520: Flags [P.], seq 433424:433808, ack 1121, win 501, options [nop,nop,TS val 119434379 ecr 2363718898], length 384
02:59:38.327690 IP 198.211.111.194.51520 > karldrop.ssh: Flags [.], ack 433808, win 1839, options [nop,nop,TS val 2363718999 ecr 119434379], length 0
02:59:38.414073 IP karldrop.ssh > 198.211.111.194.51520: Flags [P.], seq 433808:434192, ack 1121, win 501, options [nop,nop,TS val 119434483 ecr 2363718999], length 384
02:59:38.433697 IP 198.211.111.194.51520 > karldrop.ssh: Flags [.], ack 434192, win 1839, options [nop,nop,TS val 2363719105 ecr 119434483], length 0
02:59:38.518079 IP karldrop.ssh > 198.211.111.194.51520: Flags [P.], seq 434192:434576, ack 1121, win 501, options [nop,nop,TS val 119434587 ecr 2363719105], length 384
02:59:38.538600 IP 198.211.111.194.51520 > karldrop.ssh: Flags [.], ack 434576, win 1839, options [nop,nop,TS val 2363719210 ecr 119434587], length 0
02:59:38.622116 IP karldrop.ssh > 198.211.111.194.51520: Flags [P.], seq 434576:434960, ack 1121, win 501, options [nop,nop,TS val 119434691 ecr 2363719210], length 384
02:59:38.642914 IP 198.211.111.194.51520 > karldrop.ssh: Flags [.], ack 434960, win 1839, options [nop,nop,TS val 2363719314 ecr 119434691], length 0
02:59:38.726133 IP karldrop.ssh > 198.211.111.194.51520: Flags [P.], seq 434960:435344, ack 1121, win 501, options [nop,nop,TS val 119434795 ecr 2363719314], length 384
02:59:38.747829 IP 198.211.111.194.51520 > karldrop.ssh: Flags [.], ack 435344, win 1839, options [nop,nop,TS val 2363719419 ecr 119434795], length 0
02:59:38.830145 IP karldrop.ssh > 198.211.111.194.51520: Flags [P.], seq 435344:435728, ack 1121, win 501, options [nop,nop,TS val 119434899 ecr 2363719419], length 384
02:59:38.848339 IP 198.211.111.194.51520 > karldrop.ssh: Flags [.], ack 435728, win 1839, options [nop,nop,TS val 2363719519 ecr 119434899], length 0
02:59:38.934112 IP karldrop.ssh > 198.211.111.194.51520: Flags [P.], seq 435728:436112, ack 1121, win 501, options [nop,nop,TS val 119435003 ecr 2363719519], length 384
02:59:38.954229 IP 198.211.111.194.51520 > karldrop.ssh: Flags [.], ack 436112, win 1839, options [nop,nop,TS val 2363719625 ecr 119435003], length 0
02:59:39.038125 IP karldrop.ssh > 198.211.111.194.51520: Flags [P.], seq 436112:436496, ack 1121, win 501, options [nop,nop,TS val 119435107 ecr 2363719625], length 384
02:59:39.058203 IP 198.211.111.194.51520 > karldrop.ssh: Flags [.], ack 436496, win 1839, options [nop,nop,TS val 2363719729 ecr 119435107], length 0
02:59:39.142096 IP karldrop.ssh > 198.211.111.194.51520: Flags [P.], seq 436496:436880, ack 1121, win 501, options [nop,nop,TS val 119435211 ecr 2363719729], length 384
02:59:39.163245 IP 198.211.111.194.51520 > karldrop.ssh: Flags [.], ack 436880, win 1839, options [nop,nop,TS val 2363719834 ecr 119435211], length 0
02:59:39.246123 IP karldrop.ssh > 198.211.111.194.51520: Flags [P.], seq 436880:437264, ack 1121, win 501, options [nop,nop,TS val 119435315 ecr 2363719834], length 384
02:59:39.268138 IP 198.211.111.194.51520 > karldrop.ssh: Flags [.], ack 437264, win 1839, options [nop,nop,TS val 2363719939 ecr 119435315], length 0
02:59:39.350123 IP karldrop.ssh > 198.211.111.194.51520: Flags [P.], seq 437264:437648, ack 1121, win 501, options [nop,nop,TS val 119435419 ecr 2363719939], length 384
02:59:39.367299 IP 198.211.111.194.51520 > karldrop.ssh: Flags [.], ack 437648, win 1839, options [nop,nop,TS val 2363720039 ecr 119435419], length 0
02:59:39.454080 IP karldrop.ssh > 198.211.111.194.51520: Flags [P.], seq 437648:438032, ack 1121, win 501, options [nop,nop,TS val 119435523 ecr 2363720039], length 384
02:59:39.474638 IP 198.211.111.194.51520 > karldrop.ssh: Flags [.], ack 438032, win 1839, options [nop,nop,TS val 2363720146 ecr 119435523], length 0
02:59:39.558097 IP karldrop.ssh > 198.211.111.194.51520: Flags [P.], seq 438032:438416, ack 1121, win 501, options [nop,nop,TS val 119435627 ecr 2363720146], length 384
02:59:39.580119 IP 198.211.111.194.51520 > karldrop.ssh: Flags [.], ack 438416, win 1839, options [nop,nop,TS val 2363720251 ecr 119435627], length 0
02:59:39.662198 IP karldrop.ssh > 198.211.111.194.51520: Flags [P.], seq 438416:438800, ack 1121, win 501, options [nop,nop,TS val 119435731 ecr 2363720251], length 384
02:59:39.683529 IP 198.211.111.194.51520 > karldrop.ssh: Flags [.], ack 438800, win 1839, options [nop,nop,TS val 2363720355 ecr 119435731], length 0
02:59:39.766118 IP karldrop.ssh > 198.211.111.194.51520: Flags [P.], seq 438800:439184, ack 1121, win 501, options [nop,nop,TS val 119435835 ecr 2363720355], length 384
02:59:39.785886 IP 198.211.111.194.51520 > karldrop.ssh: Flags [.], ack 439184, win 1839, options [nop,nop,TS val 2363720457 ecr 119435835], length 0
02:59:39.870079 IP karldrop.ssh > 198.211.111.194.51520: Flags [P.], seq 439184:439568, ack 1121, win 501, options [nop,nop,TS val 119435939 ecr 2363720457], length 384
02:59:39.892070 IP 198.211.111.194.51520 > karldrop.ssh: Flags [.], ack 439568, win 1839, options [nop,nop,TS val 2363720563 ecr 119435939], length 0
02:59:39.974119 IP karldrop.ssh > 198.211.111.194.51520: Flags [P.], seq 439568:439952, ack 1121, win 501, options [nop,nop,TS val 119436043 ecr 2363720563], length 384
02:59:39.993263 IP 198.211.111.194.51520 > karldrop.ssh: Flags [.], ack 439952, win 1839, options [nop,nop,TS val 2363720664 ecr 119436043], length 0
02:59:40.078154 IP karldrop.ssh > 198.211.111.194.51520: Flags [P.], seq 439952:440336, ack 1121, win 501, options [nop,nop,TS val 119436147 ecr 2363720664], length 384
02:59:40.099808 IP 198.211.111.194.51520 > karldrop.ssh: Flags [.], ack 440336, win 1839, options [nop,nop,TS val 2363720771 ecr 119436147], length 0
02:59:40.182099 IP karldrop.ssh > 198.211.111.194.51520: Flags [P.], seq 440336:440720, ack 1121, win 501, options [nop,nop,TS val 119436251 ecr 2363720771], length 384
02:59:40.200188 IP 198.211.111.194.51520 > karldrop.ssh: Flags [.], ack 440720, win 1839, options [nop,nop,TS val 2363720871 ecr 119436251], length 0
02:59:40.286137 IP karldrop.ssh > 198.211.111.194.51520: Flags [P.], seq 440720:441104, ack 1121, win 501, options [nop,nop,TS val 119436355 ecr 2363720871], length 384
02:59:40.308433 IP 198.211.111.194.51520 > karldrop.ssh: Flags [.], ack 441104, win 1839, options [nop,nop,TS val 2363720980 ecr 119436355], length 0
^C
2461 packets captured
2489 packets received by filter
23 packets dropped by kernel